No.     Time           Source                Destination           Protocol Length Info
      1 0.000000       192.168.25.1          224.0.0.1             IGMPv2   60     Membership Query, general

Frame 1: 60 bytes on wire (480 bits), 60 bytes captured (480 bits) on interface 0
Ethernet II, Src: Sagemcom_fa:f1:1e (68:15:90:fa:f1:1e), Dst: IPv4mcast_01 (01:00:5e:00:00:01)
Internet Protocol Version 4, Src: 192.168.25.1, Dst: 224.0.0.1
Internet Group Management Protocol

No.     Time           Source                Destination           Protocol Length Info
      2 0.000388       fe80::6a15:90ff:fefa:f11e ff02::1               ICMPv6   90     Multicast Listener Query

Frame 2: 90 bytes on wire (720 bits), 90 bytes captured (720 bits) on interface 0
Ethernet II, Src: Sagemcom_fa:f1:1e (68:15:90:fa:f1:1e), Dst: IPv6mcast_01 (33:33:00:00:00:01)
Internet Protocol Version 6, Src: fe80::6a15:90ff:fefa:f11e, Dst: ff02::1
Internet Control Message Protocol v6

No.     Time           Source                Destination           Protocol Length Info
      3 0.115955       2804:7f3:8880:d51f:7583:5e92:7a66:a6dc 2804:7f4:2002:1005::99 DNS      89     Standard query 0xfb9b A hbdia.com

Frame 3: 89 bytes on wire (712 bits), 89 bytes captured (712 bits) on interface 0
Ethernet II, Src: HewlettP_49:af:30 (9c:8e:99:49:af:30), Dst: Sagemcom_fa:f1:1e (68:15:90:fa:f1:1e)
Internet Protocol Version 6, Src: 2804:7f3:8880:d51f:7583:5e92:7a66:a6dc, Dst: 2804:7f4:2002:1005::99
User Datagram Protocol, Src Port: 49588, Dst Port: 53
Domain Name System (query)

No.     Time           Source                Destination           Protocol Length Info
      4 0.122537       2804:7f4:2002:1005::99 2804:7f3:8880:d51f:7583:5e92:7a66:a6dc DNS      105    Standard query response 0xfb9b A hbdia.com A 191.235.82.97

Frame 4: 105 bytes on wire (840 bits), 105 bytes captured (840 bits) on interface 0
Ethernet II, Src: Sagemcom_fa:f1:1e (68:15:90:fa:f1:1e), Dst: HewlettP_49:af:30 (9c:8e:99:49:af:30)
Internet Protocol Version 6, Src: 2804:7f4:2002:1005::99, Dst: 2804:7f3:8880:d51f:7583:5e92:7a66:a6dc
User Datagram Protocol, Src Port: 53, Dst Port: 49588
Domain Name System (response)

No.     Time           Source                Destination           Protocol Length Info
      5 0.122995       2804:7f3:8880:d51f:7583:5e92:7a66:a6dc 2804:7f4:2002:1005::99 DNS      89     Standard query 0xac68 AAAA hbdia.com

Frame 5: 89 bytes on wire (712 bits), 89 bytes captured (712 bits) on interface 0
Ethernet II, Src: HewlettP_49:af:30 (9c:8e:99:49:af:30), Dst: Sagemcom_fa:f1:1e (68:15:90:fa:f1:1e)
Internet Protocol Version 6, Src: 2804:7f3:8880:d51f:7583:5e92:7a66:a6dc, Dst: 2804:7f4:2002:1005::99
User Datagram Protocol, Src Port: 51162, Dst Port: 53
Domain Name System (query)

No.     Time           Source                Destination           Protocol Length Info
      6 0.129716       2804:7f4:2002:1005::99 2804:7f3:8880:d51f:7583:5e92:7a66:a6dc DNS      153    Standard query response 0xac68 AAAA hbdia.com SOA ns1.digitalocean.com

Frame 6: 153 bytes on wire (1224 bits), 153 bytes captured (1224 bits) on interface 0
Ethernet II, Src: Sagemcom_fa:f1:1e (68:15:90:fa:f1:1e), Dst: HewlettP_49:af:30 (9c:8e:99:49:af:30)
Internet Protocol Version 6, Src: 2804:7f4:2002:1005::99, Dst: 2804:7f3:8880:d51f:7583:5e92:7a66:a6dc
User Datagram Protocol, Src Port: 53, Dst Port: 51162
Domain Name System (response)

No.     Time           Source                Destination           Protocol Length Info
      7 0.396361       192.168.25.233        239.255.255.250       IGMPv2   46     Membership Report group 239.255.255.250

Frame 7: 46 bytes on wire (368 bits), 46 bytes captured (368 bits) on interface 0
Ethernet II, Src: HewlettP_49:af:30 (9c:8e:99:49:af:30), Dst: IPv4mcast_7f:ff:fa (01:00:5e:7f:ff:fa)
Internet Protocol Version 4, Src: 192.168.25.233, Dst: 239.255.255.250
Internet Group Management Protocol

No.     Time           Source                Destination           Protocol Length Info
      8 0.396420       192.168.25.233        224.0.0.252           IGMPv2   46     Membership Report group 224.0.0.252

Frame 8: 46 bytes on wire (368 bits), 46 bytes captured (368 bits) on interface 0
Ethernet II, Src: HewlettP_49:af:30 (9c:8e:99:49:af:30), Dst: IPv4mcast_fc (01:00:5e:00:00:fc)
Internet Protocol Version 4, Src: 192.168.25.233, Dst: 224.0.0.252
Internet Group Management Protocol

No.     Time           Source                Destination           Protocol Length Info
      9 0.396448       192.168.25.233        224.0.0.251           IGMPv2   46     Membership Report group 224.0.0.251

Frame 9: 46 bytes on wire (368 bits), 46 bytes captured (368 bits) on interface 0
Ethernet II, Src: HewlettP_49:af:30 (9c:8e:99:49:af:30), Dst: IPv4mcast_fb (01:00:5e:00:00:fb)
Internet Protocol Version 4, Src: 192.168.25.233, Dst: 224.0.0.251
Internet Group Management Protocol

No.     Time           Source                Destination           Protocol Length Info
     10 0.396512       fe80::682f:6ac4:cb76:a134 ff02::16              ICMPv6   170    Multicast Listener Report Message v2

Frame 10: 170 bytes on wire (1360 bits), 170 bytes captured (1360 bits) on interface 0
Ethernet II, Src: HewlettP_49:af:30 (9c:8e:99:49:af:30), Dst: IPv6mcast_16 (33:33:00:00:00:16)
Internet Protocol Version 6, Src: fe80::682f:6ac4:cb76:a134, Dst: ff02::16
Internet Control Message Protocol v6

No.     Time           Source                Destination           Protocol Length Info
     11 1.090789       fe80::189e:12b5:49f:c4a5 ff02::16              ICMPv6   170    Multicast Listener Report Message v2

Frame 11: 170 bytes on wire (1360 bits), 170 bytes captured (1360 bits) on interface 0
Ethernet II, Src: Apple_56:20:ea (b0:34:95:56:20:ea), Dst: IPv6mcast_16 (33:33:00:00:00:16)
Internet Protocol Version 6, Src: fe80::189e:12b5:49f:c4a5, Dst: ff02::16
Internet Control Message Protocol v6

No.     Time           Source                Destination           Protocol Length Info
     12 1.136591       fe80::1883:c4ca:6cd7:1c6f ff02::16              ICMPv6   150    Multicast Listener Report Message v2

Frame 12: 150 bytes on wire (1200 bits), 150 bytes captured (1200 bits) on interface 0
Ethernet II, Src: Apple_a2:f1:54 (f0:c1:f1:a2:f1:54), Dst: IPv6mcast_16 (33:33:00:00:00:16)
Internet Protocol Version 6, Src: fe80::1883:c4ca:6cd7:1c6f, Dst: ff02::16
Internet Control Message Protocol v6

No.     Time           Source                Destination           Protocol Length Info
     13 1.279394       192.168.25.233        45.55.71.161          HTTP 66     51028 → 80 [SYN] Seq=0 Win=8192 Len=0 MSS=1460 WS=4 SACK_PERM=1

Frame 13: 66 bytes on wire (528 bits), 66 bytes captured (528 bits) on interface 0
Ethernet II, Src: HewlettP_49:af:30 (9c:8e:99:49:af:30), Dst: Sagemcom_fa:f1:1e (68:15:90:fa:f1:1e)
Internet Protocol Version 4, Src: 192.168.25.233, Dst: 191.235.82.97
Transmission Control Protocol, Src Port: 51028, Dst Port: 80, Seq: 0, Len: 0

No.     Time           Source                Destination           Protocol Length Info
     14 1.280373       192.168.25.233        191.235.82.97 TCP      66     51029 → 80 [SYN] Seq=0 Win=8192 Len=0 MSS=1460 WS=4 SACK_PERM=1

Frame 14: 66 bytes on wire (528 bits), 66 bytes captured (528 bits) on interface 0
Ethernet II, Src: HewlettP_49:af:30 (9c:8e:99:49:af:30), Dst: Sagemcom_fa:f1:1e (68:15:90:fa:f1:1e)
Internet Protocol Version 4, Src: 192.168.25.233, Dst: 191.235.82.97
Transmission Control Protocol, Src Port: 51029, Dst Port: 80, Seq: 0, Len: 0

No.     Time           Source                Destination           Protocol Length Info
     15 1.280772       192.168.25.233        164.41.102.70 TCP      66     51030 → 80 [SYN] Seq=0 Win=8192 Len=0 MSS=1460 WS=4 SACK_PERM=1

Frame 15: 66 bytes on wire (528 bits), 66 bytes captured (528 bits) on interface 0
Ethernet II, Src: HewlettP_49:af:30 (9c:8e:99:49:af:30), Dst: Sagemcom_fa:f1:1e (68:15:90:fa:f1:1e)
Internet Protocol Version 4, Src: 192.168.25.233, Dst: 45.55.71.161
Transmission Control Protocol, Src Port: 51030, Dst Port: 80, Seq: 0, Len: 0

No.     Time           Source                Destination           Protocol Length Info
     16 1.280931       192.168.25.233        164.41.102.70 TCP      66     51031 → 80 [SYN] Seq=0 Win=8192 Len=0 MSS=1460 WS=4 SACK_PERM=1

Frame 16: 66 bytes on wire (528 bits), 66 bytes captured (528 bits) on interface 0
Ethernet II, Src: HewlettP_49:af:30 (9c:8e:99:49:af:30), Dst: Sagemcom_fa:f1:1e (68:15:90:fa:f1:1e)
Internet Protocol Version 4, Src: 192.168.25.233, Dst: 45.55.71.161
Transmission Control Protocol, Src Port: 51031, Dst Port: 80, Seq: 0, Len: 0

No.     Time           Source                Destination           Protocol Length Info
     17 1.281085       192.168.25.233        45.55.71.161          HTTP 66     51032 → 80 [SYN] Seq=0 Win=8192 Len=0 MSS=1460 WS=4 SACK_PERM=1

Frame 17: 66 bytes on wire (528 bits), 66 bytes captured (528 bits) on interface 0
Ethernet II, Src: HewlettP_49:af:30 (9c:8e:99:49:af:30), Dst: Sagemcom_fa:f1:1e (68:15:90:fa:f1:1e)
Internet Protocol Version 4, Src: 192.168.25.233, Dst: 45.55.71.161
Transmission Control Protocol, Src Port: 51032, Dst Port: 80, Seq: 0, Len: 0

No.     Time           Source                Destination           Protocol Length Info
     18 1.281237       192.168.25.233        45.55.71.161          TCP      66     51033 → 80 [SYN] Seq=0 Win=8192 Len=0 MSS=1460 WS=4 SACK_PERM=1

Frame 18: 66 bytes on wire (528 bits), 66 bytes captured (528 bits) on interface 0
Ethernet II, Src: HewlettP_49:af:30 (9c:8e:99:49:af:30), Dst: Sagemcom_fa:f1:1e (68:15:90:fa:f1:1e)
Internet Protocol Version 4, Src: 192.168.25.233, Dst: 45.55.71.161
Transmission Control Protocol, Src Port: 51033, Dst Port: 80, Seq: 0, Len: 0

No.     Time           Source                Destination           Protocol Length Info
     19 1.282131       2804:7f3:8880:d51f:7583:5e92:7a66:a6dc 2804:7f4:2002:1005::99 DNS      103    Standard query 0x024b A www.canteiraceleste.com

Frame 19: 103 bytes on wire (824 bits), 103 bytes captured (824 bits) on interface 0
Ethernet II, Src: HewlettP_49:af:30 (9c:8e:99:49:af:30), Dst: Sagemcom_fa:f1:1e (68:15:90:fa:f1:1e)
Internet Protocol Version 6, Src: 2804:7f3:8880:d51f:7583:5e92:7a66:a6dc, Dst: 2804:7f4:2002:1005::99
User Datagram Protocol, Src Port: 61038, Dst Port: 53
Domain Name System (query)

No.     Time           Source                Destination           Protocol Length Info
     20 1.315460       2804:7f3:8880:d51f:7583:5e92:7a66:a6dc 2804:7f4:2002:1005::99 DNS      106    Standard query 0xac8d A canteiraceleste.disqus.com

Frame 20: 106 bytes on wire (848 bits), 106 bytes captured (848 bits) on interface 0
Ethernet II, Src: HewlettP_49:af:30 (9c:8e:99:49:af:30), Dst: Sagemcom_fa:f1:1e (68:15:90:fa:f1:1e)
Internet Protocol Version 6, Src: 2804:7f3:8880:d51f:7583:5e92:7a66:a6dc, Dst: 2804:7f4:2002:1005::99
User Datagram Protocol, Src Port: 54245, Dst Port: 53
Domain Name System (query)

No.     Time           Source                Destination           Protocol Length Info
     21 1.315878       2804:7f3:8880:d51f:7583:5e92:7a66:a6dc 2804:7f4:2002:1005::99 DNS      91     Standard query 0x6a69 A de.tynt.com

Frame 21: 91 bytes on wire (728 bits), 91 bytes captured (728 bits) on interface 0
Ethernet II, Src: HewlettP_49:af:30 (9c:8e:99:49:af:30), Dst: Sagemcom_fa:f1:1e (68:15:90:fa:f1:1e)
Internet Protocol Version 6, Src: 2804:7f3:8880:d51f:7583:5e92:7a66:a6dc, Dst: 2804:7f4:2002:1005::99
User Datagram Protocol, Src Port: 49213, Dst Port: 53
Domain Name System (query)

No.     Time           Source                Destination           Protocol Length Info
     22 1.316153       2804:7f3:8880:d51f:7583:5e92:7a66:a6dc 2804:7f4:2002:1005::99 DNS      97     Standard query 0xfc85 A 2.bp.blogspot.com

Frame 22: 97 bytes on wire (776 bits), 97 bytes captured (776 bits) on interface 0
Ethernet II, Src: HewlettP_49:af:30 (9c:8e:99:49:af:30), Dst: Sagemcom_fa:f1:1e (68:15:90:fa:f1:1e)
Internet Protocol Version 6, Src: 2804:7f3:8880:d51f:7583:5e92:7a66:a6dc, Dst: 2804:7f4:2002:1005::99
User Datagram Protocol, Src Port: 60258, Dst Port: 53
Domain Name System (query)

No.     Time           Source                Destination           Protocol Length Info
     23 1.320022       2804:7f3:8880:d51f:7583:5e92:7a66:a6dc 2804:7f4:2002:1005::99 DNS      97     Standard query 0x5bb1 A 3.bp.blogspot.com

Frame 23: 97 bytes on wire (776 bits), 97 bytes captured (776 bits) on interface 0
Ethernet II, Src: HewlettP_49:af:30 (9c:8e:99:49:af:30), Dst: Sagemcom_fa:f1:1e (68:15:90:fa:f1:1e)
Internet Protocol Version 6, Src: 2804:7f3:8880:d51f:7583:5e92:7a66:a6dc, Dst: 2804:7f4:2002:1005::99
User Datagram Protocol, Src Port: 61879, Dst Port: 53
Domain Name System (query)

No.     Time           Source                Destination           Protocol Length Info
     24 1.320803       2804:7f3:8880:d51f:7583:5e92:7a66:a6dc 2804:7f4:2002:1005::99 DNS      97     Standard query 0x834e A 4.bp.blogspot.com

Frame 24: 97 bytes on wire (776 bits), 97 bytes captured (776 bits) on interface 0
Ethernet II, Src: HewlettP_49:af:30 (9c:8e:99:49:af:30), Dst: Sagemcom_fa:f1:1e (68:15:90:fa:f1:1e)
Internet Protocol Version 6, Src: 2804:7f3:8880:d51f:7583:5e92:7a66:a6dc, Dst: 2804:7f4:2002:1005::99
User Datagram Protocol, Src Port: 60783, Dst Port: 53
Domain Name System (query)

No.     Time           Source                Destination           Protocol Length Info
     25 1.322924       2804:7f4:2002:1005::99 2804:7f3:8880:d51f:7583:5e92:7a66:a6dc DNS      107    Standard query response 0x6a69 A de.tynt.com A 208.100.17.181

Frame 25: 107 bytes on wire (856 bits), 107 bytes captured (856 bits) on interface 0
Ethernet II, Src: Sagemcom_fa:f1:1e (68:15:90:fa:f1:1e), Dst: HewlettP_49:af:30 (9c:8e:99:49:af:30)
Internet Protocol Version 6, Src: 2804:7f4:2002:1005::99, Dst: 2804:7f3:8880:d51f:7583:5e92:7a66:a6dc
User Datagram Protocol, Src Port: 53, Dst Port: 49213
Domain Name System (response)

No.     Time           Source                Destination           Protocol Length Info
     26 1.323379       2804:7f3:8880:d51f:7583:5e92:7a66:a6dc 2804:7f4:2002:1005::99 DNS      91     Standard query 0x5808 AAAA de.tynt.com

Frame 26: 91 bytes on wire (728 bits), 91 bytes captured (728 bits) on interface 0
Ethernet II, Src: HewlettP_49:af:30 (9c:8e:99:49:af:30), Dst: Sagemcom_fa:f1:1e (68:15:90:fa:f1:1e)
Internet Protocol Version 6, Src: 2804:7f3:8880:d51f:7583:5e92:7a66:a6dc, Dst: 2804:7f4:2002:1005::99
User Datagram Protocol, Src Port: 49943, Dst Port: 53
Domain Name System (query)

No.     Time           Source                Destination           Protocol Length Info
     27 1.323731       2804:7f4:2002:1005::99 2804:7f3:8880:d51f:7583:5e92:7a66:a6dc DNS      158    Standard query response 0xfc85 A 2.bp.blogspot.com CNAME photos-ugc.l.googleusercontent.com A 216.58.222.65

Frame 27: 158 bytes on wire (1264 bits), 158 bytes captured (1264 bits) on interface 0
Ethernet II, Src: Sagemcom_fa:f1:1e (68:15:90:fa:f1:1e), Dst: HewlettP_49:af:30 (9c:8e:99:49:af:30)
Internet Protocol Version 6, Src: 2804:7f4:2002:1005::99, Dst: 2804:7f3:8880:d51f:7583:5e92:7a66:a6dc
User Datagram Protocol, Src Port: 53, Dst Port: 60258
Domain Name System (response)

No.     Time           Source                Destination           Protocol Length Info
     28 1.324057       2804:7f3:8880:d51f:7583:5e92:7a66:a6dc 2804:7f4:2002:1005::99 DNS      97     Standard query 0xabb5 AAAA 2.bp.blogspot.com

Frame 28: 97 bytes on wire (776 bits), 97 bytes captured (776 bits) on interface 0
Ethernet II, Src: HewlettP_49:af:30 (9c:8e:99:49:af:30), Dst: Sagemcom_fa:f1:1e (68:15:90:fa:f1:1e)
Internet Protocol Version 6, Src: 2804:7f3:8880:d51f:7583:5e92:7a66:a6dc, Dst: 2804:7f4:2002:1005::99
User Datagram Protocol, Src Port: 60559, Dst Port: 53
Domain Name System (query)

No.     Time           Source                Destination           Protocol Length Info
     29 1.326941       2804:7f4:2002:1005::99 2804:7f3:8880:d51f:7583:5e92:7a66:a6dc DNS      158    Standard query response 0x5bb1 A 3.bp.blogspot.com CNAME photos-ugc.l.googleusercontent.com A 216.58.222.65

Frame 29: 158 bytes on wire (1264 bits), 158 bytes captured (1264 bits) on interface 0
Ethernet II, Src: Sagemcom_fa:f1:1e (68:15:90:fa:f1:1e), Dst: HewlettP_49:af:30 (9c:8e:99:49:af:30)
Internet Protocol Version 6, Src: 2804:7f4:2002:1005::99, Dst: 2804:7f3:8880:d51f:7583:5e92:7a66:a6dc
User Datagram Protocol, Src Port: 53, Dst Port: 61879
Domain Name System (response)

No.     Time           Source                Destination           Protocol Length Info
     30 1.327262       2804:7f4:2002:1005::99 2804:7f3:8880:d51f:7583:5e92:7a66:a6dc DNS      158    Standard query response 0x834e A 4.bp.blogspot.com CNAME photos-ugc.l.googleusercontent.com A 216.58.222.65

Frame 30: 158 bytes on wire (1264 bits), 158 bytes captured (1264 bits) on interface 0
Ethernet II, Src: Sagemcom_fa:f1:1e (68:15:90:fa:f1:1e), Dst: HewlettP_49:af:30 (9c:8e:99:49:af:30)
Internet Protocol Version 6, Src: 2804:7f4:2002:1005::99, Dst: 2804:7f3:8880:d51f:7583:5e92:7a66:a6dc
User Datagram Protocol, Src Port: 53, Dst Port: 60783
Domain Name System (response)

No.     Time           Source                Destination           Protocol Length Info
     31 1.327366       2804:7f3:8880:d51f:7583:5e92:7a66:a6dc 2804:7f4:2002:1005::99 DNS      97     Standard query 0xc92e AAAA 3.bp.blogspot.com

Frame 31: 97 bytes on wire (776 bits), 97 bytes captured (776 bits) on interface 0
Ethernet II, Src: HewlettP_49:af:30 (9c:8e:99:49:af:30), Dst: Sagemcom_fa:f1:1e (68:15:90:fa:f1:1e)
Internet Protocol Version 6, Src: 2804:7f3:8880:d51f:7583:5e92:7a66:a6dc, Dst: 2804:7f4:2002:1005::99
User Datagram Protocol, Src Port: 50480, Dst Port: 53
Domain Name System (query)

No.     Time           Source                Destination           Protocol Length Info
     32 1.327533       2804:7f3:8880:d51f:7583:5e92:7a66:a6dc 2804:7f4:2002:1005::99 DNS      97     Standard query 0xca14 AAAA 4.bp.blogspot.com

Frame 32: 97 bytes on wire (776 bits), 97 bytes captured (776 bits) on interface 0
Ethernet II, Src: HewlettP_49:af:30 (9c:8e:99:49:af:30), Dst: Sagemcom_fa:f1:1e (68:15:90:fa:f1:1e)
Internet Protocol Version 6, Src: 2804:7f3:8880:d51f:7583:5e92:7a66:a6dc, Dst: 2804:7f4:2002:1005::99
User Datagram Protocol, Src Port: 60129, Dst Port: 53
Domain Name System (query)

No.     Time           Source                Destination           Protocol Length Info
     33 1.329748       2804:7f4:2002:1005::99 2804:7f3:8880:d51f:7583:5e92:7a66:a6dc DNS      163    Standard query response 0x5808 AAAA de.tynt.com SOA ns1.p20.dynect.net

Frame 33: 163 bytes on wire (1304 bits), 163 bytes captured (1304 bits) on interface 0
Ethernet II, Src: Sagemcom_fa:f1:1e (68:15:90:fa:f1:1e), Dst: HewlettP_49:af:30 (9c:8e:99:49:af:30)
Internet Protocol Version 6, Src: 2804:7f4:2002:1005::99, Dst: 2804:7f3:8880:d51f:7583:5e92:7a66:a6dc
User Datagram Protocol, Src Port: 53, Dst Port: 49943
Domain Name System (response)

No.     Time           Source                Destination           Protocol Length Info
     34 1.330727       192.168.25.233        208.100.17.181        TCP      66     51034 → 80 [SYN] Seq=0 Win=8192 Len=0 MSS=1460 WS=4 SACK_PERM=1

Frame 34: 66 bytes on wire (528 bits), 66 bytes captured (528 bits) on interface 0
Ethernet II, Src: HewlettP_49:af:30 (9c:8e:99:49:af:30), Dst: Sagemcom_fa:f1:1e (68:15:90:fa:f1:1e)
Internet Protocol Version 4, Src: 192.168.25.233, Dst: 208.100.17.181
Transmission Control Protocol, Src Port: 51034, Dst Port: 80, Seq: 0, Len: 0

No.     Time           Source                Destination           Protocol Length Info
     35 1.331026       192.168.25.233        208.100.17.181        TCP      66     51035 → 80 [SYN] Seq=0 Win=8192 Len=0 MSS=1460 WS=4 SACK_PERM=1

Frame 35: 66 bytes on wire (528 bits), 66 bytes captured (528 bits) on interface 0
Ethernet II, Src: HewlettP_49:af:30 (9c:8e:99:49:af:30), Dst: Sagemcom_fa:f1:1e (68:15:90:fa:f1:1e)
Internet Protocol Version 4, Src: 192.168.25.233, Dst: 208.100.17.181
Transmission Control Protocol, Src Port: 51035, Dst Port: 80, Seq: 0, Len: 0

No.     Time           Source                Destination           Protocol Length Info
     36 1.331215       192.168.25.233        208.100.17.181        TCP      66     51036 → 80 [SYN] Seq=0 Win=8192 Len=0 MSS=1460 WS=4 SACK_PERM=1

Frame 36: 66 bytes on wire (528 bits), 66 bytes captured (528 bits) on interface 0
Ethernet II, Src: HewlettP_49:af:30 (9c:8e:99:49:af:30), Dst: Sagemcom_fa:f1:1e (68:15:90:fa:f1:1e)
Internet Protocol Version 4, Src: 192.168.25.233, Dst: 208.100.17.181
Transmission Control Protocol, Src Port: 51036, Dst Port: 80, Seq: 0, Len: 0

No.     Time           Source                Destination           Protocol Length Info
     37 1.331546       2804:7f4:2002:1005::99 2804:7f3:8880:d51f:7583:5e92:7a66:a6dc DNS      170    Standard query response 0xabb5 AAAA 2.bp.blogspot.com CNAME photos-ugc.l.googleusercontent.com AAAA 2800:3f0:4004:805::2001

Frame 37: 170 bytes on wire (1360 bits), 170 bytes captured (1360 bits) on interface 0
Ethernet II, Src: Sagemcom_fa:f1:1e (68:15:90:fa:f1:1e), Dst: HewlettP_49:af:30 (9c:8e:99:49:af:30)
Internet Protocol Version 6, Src: 2804:7f4:2002:1005::99, Dst: 2804:7f3:8880:d51f:7583:5e92:7a66:a6dc
User Datagram Protocol, Src Port: 53, Dst Port: 60559
Domain Name System (response)

No.     Time           Source                Destination           Protocol Length Info
     38 1.332325       2804:7f3:8880:d51f:7583:5e92:7a66:a6dc 2800:3f0:4004:805::2001 TCP      86     51037 → 443 [SYN] Seq=0 Win=8192 Len=0 MSS=1440 WS=4 SACK_PERM=1

Frame 38: 86 bytes on wire (688 bits), 86 bytes captured (688 bits) on interface 0
Ethernet II, Src: HewlettP_49:af:30 (9c:8e:99:49:af:30), Dst: Sagemcom_fa:f1:1e (68:15:90:fa:f1:1e)
Internet Protocol Version 6, Src: 2804:7f3:8880:d51f:7583:5e92:7a66:a6dc, Dst: 2800:3f0:4004:805::2001
Transmission Control Protocol, Src Port: 51037, Dst Port: 443, Seq: 0, Len: 0

No.     Time           Source                Destination           Protocol Length Info
     39 1.332695       2804:7f3:8880:d51f:7583:5e92:7a66:a6dc 2800:3f0:4004:805::2001 TCP      86     51038 → 443 [SYN] Seq=0 Win=8192 Len=0 MSS=1440 WS=4 SACK_PERM=1

Frame 39: 86 bytes on wire (688 bits), 86 bytes captured (688 bits) on interface 0
Ethernet II, Src: HewlettP_49:af:30 (9c:8e:99:49:af:30), Dst: Sagemcom_fa:f1:1e (68:15:90:fa:f1:1e)
Internet Protocol Version 6, Src: 2804:7f3:8880:d51f:7583:5e92:7a66:a6dc, Dst: 2800:3f0:4004:805::2001
Transmission Control Protocol, Src Port: 51038, Dst Port: 443, Seq: 0, Len: 0

No.     Time           Source                Destination           Protocol Length Info
     40 1.332911       2804:7f3:8880:d51f:7583:5e92:7a66:a6dc 2800:3f0:4004:805::2001 TCP      86     51039 → 443 [SYN] Seq=0 Win=8192 Len=0 MSS=1440 WS=4 SACK_PERM=1

Frame 40: 86 bytes on wire (688 bits), 86 bytes captured (688 bits) on interface 0
Ethernet II, Src: HewlettP_49:af:30 (9c:8e:99:49:af:30), Dst: Sagemcom_fa:f1:1e (68:15:90:fa:f1:1e)
Internet Protocol Version 6, Src: 2804:7f3:8880:d51f:7583:5e92:7a66:a6dc, Dst: 2800:3f0:4004:805::2001
Transmission Control Protocol, Src Port: 51039, Dst Port: 443, Seq: 0, Len: 0

No.     Time           Source                Destination           Protocol Length Info
     41 1.333080       2804:7f3:8880:d51f:7583:5e92:7a66:a6dc 2804:7f4:2002:1005::99 DNS      105    Standard query 0xde49 A lh3.googleusercontent.com

Frame 41: 105 bytes on wire (840 bits), 105 bytes captured (840 bits) on interface 0
Ethernet II, Src: HewlettP_49:af:30 (9c:8e:99:49:af:30), Dst: Sagemcom_fa:f1:1e (68:15:90:fa:f1:1e)
Internet Protocol Version 6, Src: 2804:7f3:8880:d51f:7583:5e92:7a66:a6dc, Dst: 2804:7f4:2002:1005::99
User Datagram Protocol, Src Port: 63587, Dst Port: 53
Domain Name System (query)

No.     Time           Source                Destination           Protocol Length Info
     42 1.333108       2804:7f3:8880:d51f:7583:5e92:7a66:a6dc 2800:3f0:4004:805::2001 TCP      86     51040 → 443 [SYN] Seq=0 Win=8192 Len=0 MSS=1440 WS=4 SACK_PERM=1

Frame 42: 86 bytes on wire (688 bits), 86 bytes captured (688 bits) on interface 0
Ethernet II, Src: HewlettP_49:af:30 (9c:8e:99:49:af:30), Dst: Sagemcom_fa:f1:1e (68:15:90:fa:f1:1e)
Internet Protocol Version 6, Src: 2804:7f3:8880:d51f:7583:5e92:7a66:a6dc, Dst: 2800:3f0:4004:805::2001
Transmission Control Protocol, Src Port: 51040, Dst Port: 443, Seq: 0, Len: 0

No.     Time           Source                Destination           Protocol Length Info
     43 1.333355       2804:7f3:8880:d51f:7583:5e92:7a66:a6dc 2800:3f0:4004:805::2001 TCP      86     51041 → 443 [SYN] Seq=0 Win=8192 Len=0 MSS=1440 WS=4 SACK_PERM=1

Frame 43: 86 bytes on wire (688 bits), 86 bytes captured (688 bits) on interface 0
Ethernet II, Src: HewlettP_49:af:30 (9c:8e:99:49:af:30), Dst: Sagemcom_fa:f1:1e (68:15:90:fa:f1:1e)
Internet Protocol Version 6, Src: 2804:7f3:8880:d51f:7583:5e92:7a66:a6dc, Dst: 2800:3f0:4004:805::2001
Transmission Control Protocol, Src Port: 51041, Dst Port: 443, Seq: 0, Len: 0

No.     Time           Source                Destination           Protocol Length Info
     44 1.333529       2804:7f3:8880:d51f:7583:5e92:7a66:a6dc 2804:7f4:2002:1005::99 DNS      109    Standard query 0x6b9e A n-cdn-origin.areyouahuman.com

Frame 44: 109 bytes on wire (872 bits), 109 bytes captured (872 bits) on interface 0
Ethernet II, Src: HewlettP_49:af:30 (9c:8e:99:49:af:30), Dst: Sagemcom_fa:f1:1e (68:15:90:fa:f1:1e)
Internet Protocol Version 6, Src: 2804:7f3:8880:d51f:7583:5e92:7a66:a6dc, Dst: 2804:7f4:2002:1005::99
User Datagram Protocol, Src Port: 61355, Dst Port: 53
Domain Name System (query)

No.     Time           Source                Destination           Protocol Length Info
     45 1.333556       2804:7f3:8880:d51f:7583:5e92:7a66:a6dc 2800:3f0:4004:805::2001 TCP      86     51042 → 443 [SYN] Seq=0 Win=8192 Len=0 MSS=1440 WS=4 SACK_PERM=1

Frame 45: 86 bytes on wire (688 bits), 86 bytes captured (688 bits) on interface 0
Ethernet II, Src: HewlettP_49:af:30 (9c:8e:99:49:af:30), Dst: Sagemcom_fa:f1:1e (68:15:90:fa:f1:1e)
Internet Protocol Version 6, Src: 2804:7f3:8880:d51f:7583:5e92:7a66:a6dc, Dst: 2800:3f0:4004:805::2001
Transmission Control Protocol, Src Port: 51042, Dst Port: 443, Seq: 0, Len: 0

No.     Time           Source                Destination           Protocol Length Info
     46 1.334191       2804:7f4:2002:1005::99 2804:7f3:8880:d51f:7583:5e92:7a66:a6dc DNS      170    Standard query response 0xc92e AAAA 3.bp.blogspot.com CNAME photos-ugc.l.googleusercontent.com AAAA 2800:3f0:4004:805::2001

Frame 46: 170 bytes on wire (1360 bits), 170 bytes captured (1360 bits) on interface 0
Ethernet II, Src: Sagemcom_fa:f1:1e (68:15:90:fa:f1:1e), Dst: HewlettP_49:af:30 (9c:8e:99:49:af:30)
Internet Protocol Version 6, Src: 2804:7f4:2002:1005::99, Dst: 2804:7f3:8880:d51f:7583:5e92:7a66:a6dc
User Datagram Protocol, Src Port: 53, Dst Port: 50480
Domain Name System (response)

No.     Time           Source                Destination           Protocol Length Info
     47 1.334813       2804:7f3:8880:d51f:7583:5e92:7a66:a6dc 2800:3f0:4004:805::2001 TCP      86     51043 → 443 [SYN] Seq=0 Win=8192 Len=0 MSS=1440 WS=4 SACK_PERM=1

Frame 47: 86 bytes on wire (688 bits), 86 bytes captured (688 bits) on interface 0
Ethernet II, Src: HewlettP_49:af:30 (9c:8e:99:49:af:30), Dst: Sagemcom_fa:f1:1e (68:15:90:fa:f1:1e)
Internet Protocol Version 6, Src: 2804:7f3:8880:d51f:7583:5e92:7a66:a6dc, Dst: 2800:3f0:4004:805::2001
Transmission Control Protocol, Src Port: 51043, Dst Port: 443, Seq: 0, Len: 0

No.     Time           Source                Destination           Protocol Length Info
     48 1.335272       2804:7f4:2002:1005::99 2804:7f3:8880:d51f:7583:5e92:7a66:a6dc DNS      170    Standard query response 0xca14 AAAA 4.bp.blogspot.com CNAME photos-ugc.l.googleusercontent.com AAAA 2800:3f0:4004:805::2001

Frame 48: 170 bytes on wire (1360 bits), 170 bytes captured (1360 bits) on interface 0
Ethernet II, Src: Sagemcom_fa:f1:1e (68:15:90:fa:f1:1e), Dst: HewlettP_49:af:30 (9c:8e:99:49:af:30)
Internet Protocol Version 6, Src: 2804:7f4:2002:1005::99, Dst: 2804:7f3:8880:d51f:7583:5e92:7a66:a6dc
User Datagram Protocol, Src Port: 53, Dst Port: 60129
Domain Name System (response)

No.     Time           Source                Destination           Protocol Length Info
     49 1.335476       2804:7f3:8880:d51f:7583:5e92:7a66:a6dc 2800:3f0:4004:805::2001 TCP      86     51044 → 443 [SYN] Seq=0 Win=8192 Len=0 MSS=1440 WS=4 SACK_PERM=1

Frame 49: 86 bytes on wire (688 bits), 86 bytes captured (688 bits) on interface 0
Ethernet II, Src: HewlettP_49:af:30 (9c:8e:99:49:af:30), Dst: Sagemcom_fa:f1:1e (68:15:90:fa:f1:1e)
Internet Protocol Version 6, Src: 2804:7f3:8880:d51f:7583:5e92:7a66:a6dc, Dst: 2800:3f0:4004:805::2001
Transmission Control Protocol, Src Port: 51044, Dst Port: 443, Seq: 0, Len: 0

No.     Time           Source                Destination           Protocol Length Info
     50 1.335672       2804:7f3:8880:d51f:7583:5e92:7a66:a6dc 2800:3f0:4004:805::2001 TCP      86     51045 → 443 [SYN] Seq=0 Win=8192 Len=0 MSS=1440 WS=4 SACK_PERM=1

Frame 50: 86 bytes on wire (688 bits), 86 bytes captured (688 bits) on interface 0
Ethernet II, Src: HewlettP_49:af:30 (9c:8e:99:49:af:30), Dst: Sagemcom_fa:f1:1e (68:15:90:fa:f1:1e)
Internet Protocol Version 6, Src: 2804:7f3:8880:d51f:7583:5e92:7a66:a6dc, Dst: 2800:3f0:4004:805::2001
Transmission Control Protocol, Src Port: 51045, Dst Port: 443, Seq: 0, Len: 0

No.     Time           Source                Destination           Protocol Length Info
     51 1.335882       2804:7f3:8880:d51f:7583:5e92:7a66:a6dc 2800:3f0:4004:805::2001 TCP      86     51046 → 443 [SYN] Seq=0 Win=8192 Len=0 MSS=1440 WS=4 SACK_PERM=1

Frame 51: 86 bytes on wire (688 bits), 86 bytes captured (688 bits) on interface 0
Ethernet II, Src: HewlettP_49:af:30 (9c:8e:99:49:af:30), Dst: Sagemcom_fa:f1:1e (68:15:90:fa:f1:1e)
Internet Protocol Version 6, Src: 2804:7f3:8880:d51f:7583:5e92:7a66:a6dc, Dst: 2800:3f0:4004:805::2001
Transmission Control Protocol, Src Port: 51046, Dst Port: 443, Seq: 0, Len: 0

No.     Time           Source                Destination           Protocol Length Info
     52 1.336095       2804:7f3:8880:d51f:7583:5e92:7a66:a6dc 2800:3f0:4004:805::2001 TCP      86     51047 → 443 [SYN] Seq=0 Win=8192 Len=0 MSS=1440 WS=4 SACK_PERM=1

Frame 52: 86 bytes on wire (688 bits), 86 bytes captured (688 bits) on interface 0
Ethernet II, Src: HewlettP_49:af:30 (9c:8e:99:49:af:30), Dst: Sagemcom_fa:f1:1e (68:15:90:fa:f1:1e)
Internet Protocol Version 6, Src: 2804:7f3:8880:d51f:7583:5e92:7a66:a6dc, Dst: 2800:3f0:4004:805::2001
Transmission Control Protocol, Src Port: 51047, Dst Port: 443, Seq: 0, Len: 0

No.     Time           Source                Destination           Protocol Length Info
     53 1.336621       2804:7f3:8880:d51f:7583:5e92:7a66:a6dc 2800:3f0:4004:805::2001 TCP      86     51048 → 443 [SYN] Seq=0 Win=8192 Len=0 MSS=1440 WS=4 SACK_PERM=1

Frame 53: 86 bytes on wire (688 bits), 86 bytes captured (688 bits) on interface 0
Ethernet II, Src: HewlettP_49:af:30 (9c:8e:99:49:af:30), Dst: Sagemcom_fa:f1:1e (68:15:90:fa:f1:1e)
Internet Protocol Version 6, Src: 2804:7f3:8880:d51f:7583:5e92:7a66:a6dc, Dst: 2800:3f0:4004:805::2001
Transmission Control Protocol, Src Port: 51048, Dst Port: 443, Seq: 0, Len: 0

No.     Time           Source                Destination           Protocol Length Info
     54 1.338012       52.26.127.3           192.168.25.233        TLSv1.2  187    Application Data

Frame 54: 187 bytes on wire (1496 bits), 187 bytes captured (1496 bits) on interface 0
Ethernet II, Src: Sagemcom_fa:f1:1e (68:15:90:fa:f1:1e), Dst: HewlettP_49:af:30 (9c:8e:99:49:af:30)
Internet Protocol Version 4, Src: 52.26.127.3, Dst: 192.168.25.233
Transmission Control Protocol, Src Port: 443, Dst Port: 50831, Seq: 1, Ack: 1, Len: 133
Secure Sockets Layer

No.     Time           Source                Destination           Protocol Length Info
     55 1.339135       2804:7f3:8880:d51f:7583:5e92:7a66:a6dc 2800:3f0:4004:805::2001 TCP      86     51049 → 443 [SYN] Seq=0 Win=8192 Len=0 MSS=1440 WS=4 SACK_PERM=1

Frame 55: 86 bytes on wire (688 bits), 86 bytes captured (688 bits) on interface 0
Ethernet II, Src: HewlettP_49:af:30 (9c:8e:99:49:af:30), Dst: Sagemcom_fa:f1:1e (68:15:90:fa:f1:1e)
Internet Protocol Version 6, Src: 2804:7f3:8880:d51f:7583:5e92:7a66:a6dc, Dst: 2800:3f0:4004:805::2001
Transmission Control Protocol, Src Port: 51049, Dst Port: 443, Seq: 0, Len: 0

No.     Time           Source                Destination           Protocol Length Info
     56 1.339814       2804:7f3:8880:d51f:7583:5e92:7a66:a6dc 2804:7f4:2002:1005::99 DNS      94     Standard query 0xae92 A www.google.com

Frame 56: 94 bytes on wire (752 bits), 94 bytes captured (752 bits) on interface 0
Ethernet II, Src: HewlettP_49:af:30 (9c:8e:99:49:af:30), Dst: Sagemcom_fa:f1:1e (68:15:90:fa:f1:1e)
Internet Protocol Version 6, Src: 2804:7f3:8880:d51f:7583:5e92:7a66:a6dc, Dst: 2804:7f4:2002:1005::99
User Datagram Protocol, Src Port: 58674, Dst Port: 53
Domain Name System (query)

No.     Time           Source                Destination           Protocol Length Info
     57 1.340217       2804:7f4:2002:1005::99 2804:7f3:8880:d51f:7583:5e92:7a66:a6dc DNS      164    Standard query response 0xac8d A canteiraceleste.disqus.com CNAME prod.disqus.map.fastlylb.net A 151.101.56.134

Frame 57: 164 bytes on wire (1312 bits), 164 bytes captured (1312 bits) on interface 0
Ethernet II, Src: Sagemcom_fa:f1:1e (68:15:90:fa:f1:1e), Dst: HewlettP_49:af:30 (9c:8e:99:49:af:30)
Internet Protocol Version 6, Src: 2804:7f4:2002:1005::99, Dst: 2804:7f3:8880:d51f:7583:5e92:7a66:a6dc
User Datagram Protocol, Src Port: 53, Dst Port: 54245
Domain Name System (response)

No.     Time           Source                Destination           Protocol Length Info
     58 1.340789       2804:7f3:8880:d51f:7583:5e92:7a66:a6dc 2804:7f4:2002:1005::99 DNS      106    Standard query 0x5541 AAAA canteiraceleste.disqus.com

Frame 58: 106 bytes on wire (848 bits), 106 bytes captured (848 bits) on interface 0
Ethernet II, Src: HewlettP_49:af:30 (9c:8e:99:49:af:30), Dst: Sagemcom_fa:f1:1e (68:15:90:fa:f1:1e)
Internet Protocol Version 6, Src: 2804:7f3:8880:d51f:7583:5e92:7a66:a6dc, Dst: 2804:7f4:2002:1005::99
User Datagram Protocol, Src Port: 55762, Dst Port: 53
Domain Name System (query)

No.     Time           Source                Destination           Protocol Length Info
     59 1.341537       2804:7f3:8880:d51f:7583:5e92:7a66:a6dc 2804:7f4:2002:1005::99 DNS      104    Standard query 0x810b A translate.googleapis.com

Frame 59: 104 bytes on wire (832 bits), 104 bytes captured (832 bits) on interface 0
Ethernet II, Src: HewlettP_49:af:30 (9c:8e:99:49:af:30), Dst: Sagemcom_fa:f1:1e (68:15:90:fa:f1:1e)
Internet Protocol Version 6, Src: 2804:7f3:8880:d51f:7583:5e92:7a66:a6dc, Dst: 2804:7f4:2002:1005::99
User Datagram Protocol, Src Port: 50412, Dst Port: 53
Domain Name System (query)

No.     Time           Source                Destination           Protocol Length Info
     60 1.342304       2804:7f4:2002:1005::99 2804:7f3:8880:d51f:7583:5e92:7a66:a6dc DNS      150    Standard query response 0xde49 A lh3.googleusercontent.com CNAME googlehosted.l.googleusercontent.com A 216.58.222.97

Frame 60: 150 bytes on wire (1200 bits), 150 bytes captured (1200 bits) on interface 0
Ethernet II, Src: Sagemcom_fa:f1:1e (68:15:90:fa:f1:1e), Dst: HewlettP_49:af:30 (9c:8e:99:49:af:30)
Internet Protocol Version 6, Src: 2804:7f4:2002:1005::99, Dst: 2804:7f3:8880:d51f:7583:5e92:7a66:a6dc
User Datagram Protocol, Src Port: 53, Dst Port: 63587
Domain Name System (response)

No.     Time           Source                Destination           Protocol Length Info
     61 1.342778       2804:7f3:8880:d51f:7583:5e92:7a66:a6dc 2804:7f4:2002:1005::99 DNS      105    Standard query 0xaace AAAA lh3.googleusercontent.com

Frame 61: 105 bytes on wire (840 bits), 105 bytes captured (840 bits) on interface 0
Ethernet II, Src: HewlettP_49:af:30 (9c:8e:99:49:af:30), Dst: Sagemcom_fa:f1:1e (68:15:90:fa:f1:1e)
Internet Protocol Version 6, Src: 2804:7f3:8880:d51f:7583:5e92:7a66:a6dc, Dst: 2804:7f4:2002:1005::99
User Datagram Protocol, Src Port: 56275, Dst Port: 53
Domain Name System (query)

No.     Time           Source                Destination           Protocol Length Info
     62 1.345524       2804:7f4:2002:1005::99 2804:7f3:8880:d51f:7583:5e92:7a66:a6dc DNS      237    Standard query response 0x6b9e A n-cdn-origin.areyouahuman.com A 52.5.249.193 A 52.6.4.4 A 52.5.109.177 A 54.164.241.143 A 52.55.154.55 A 52.73.161.143 A 52.21.50.190 A 54.152.222.146

Frame 62: 237 bytes on wire (1896 bits), 237 bytes captured (1896 bits) on interface 0
Ethernet II, Src: Sagemcom_fa:f1:1e (68:15:90:fa:f1:1e), Dst: HewlettP_49:af:30 (9c:8e:99:49:af:30)
Internet Protocol Version 6, Src: 2804:7f4:2002:1005::99, Dst: 2804:7f3:8880:d51f:7583:5e92:7a66:a6dc
User Datagram Protocol, Src Port: 53, Dst Port: 61355
Domain Name System (response)

No.     Time           Source                Destination           Protocol Length Info
     63 1.345968       2804:7f3:8880:d51f:7583:5e92:7a66:a6dc 2804:7f4:2002:1005::99 DNS      109    Standard query 0x2c68 AAAA n-cdn-origin.areyouahuman.com

Frame 63: 109 bytes on wire (872 bits), 109 bytes captured (872 bits) on interface 0
Ethernet II, Src: HewlettP_49:af:30 (9c:8e:99:49:af:30), Dst: Sagemcom_fa:f1:1e (68:15:90:fa:f1:1e)
Internet Protocol Version 6, Src: 2804:7f3:8880:d51f:7583:5e92:7a66:a6dc, Dst: 2804:7f4:2002:1005::99
User Datagram Protocol, Src Port: 50592, Dst Port: 53
Domain Name System (query)

No.     Time           Source                Destination           Protocol Length Info
     64 1.354163       2804:7f4:2002:1005::99 2804:7f3:8880:d51f:7583:5e92:7a66:a6dc DNS      110    Standard query response 0xae92 A www.google.com A 216.58.202.132

Frame 64: 110 bytes on wire (880 bits), 110 bytes captured (880 bits) on interface 0
Ethernet II, Src: Sagemcom_fa:f1:1e (68:15:90:fa:f1:1e), Dst: HewlettP_49:af:30 (9c:8e:99:49:af:30)
Internet Protocol Version 6, Src: 2804:7f4:2002:1005::99, Dst: 2804:7f3:8880:d51f:7583:5e92:7a66:a6dc
User Datagram Protocol, Src Port: 53, Dst Port: 58674
Domain Name System (response)

No.     Time           Source                Destination           Protocol Length Info
     65 1.354701       2804:7f3:8880:d51f:7583:5e92:7a66:a6dc 2804:7f4:2002:1005::99 DNS      94     Standard query 0x015a AAAA www.google.com

Frame 65: 94 bytes on wire (752 bits), 94 bytes captured (752 bits) on interface 0
Ethernet II, Src: HewlettP_49:af:30 (9c:8e:99:49:af:30), Dst: Sagemcom_fa:f1:1e (68:15:90:fa:f1:1e)
Internet Protocol Version 6, Src: 2804:7f3:8880:d51f:7583:5e92:7a66:a6dc, Dst: 2804:7f4:2002:1005::99
User Datagram Protocol, Src Port: 54208, Dst Port: 53
Domain Name System (query)

No.     Time           Source                Destination           Protocol Length Info
     66 1.355938       2804:7f4:2002:1005::99 2804:7f3:8880:d51f:7583:5e92:7a66:a6dc DNS      206    Standard query response 0x5541 AAAA canteiraceleste.disqus.com CNAME prod.disqus.map.fastlylb.net SOA ns1.fastlylb.net

Frame 66: 206 bytes on wire (1648 bits), 206 bytes captured (1648 bits) on interface 0
