No.     Time           Source                Destination           Protocol Length Info
      1 0.000000       192.168.25.233        35.186.208.246        TCP      55     60261 → 80 [ACK] Seq=1 Ack=1 Win=16512 Len=1

Frame 1: 55 bytes on wire (440 bits), 55 bytes captured (440 bits) on interface 0
Ethernet II, Src: HewlettP_49:af:30 (9c:8e:99:49:af:30), Dst: Sagemcom_fa:f1:1e (68:15:90:fa:f1:1e)
Internet Protocol Version 4, Src: 192.168.25.233, Dst: 35.186.208.246
Transmission Control Protocol, Src Port: 60261, Dst Port: 80, Seq: 1, Ack: 1, Len: 1

No.     Time           Source                Destination           Protocol Length Info
      2 0.026801       35.186.208.246        192.168.25.233        TCP      66     80 → 60261 [ACK] Seq=1 Ack=2 Win=344 Len=0 SLE=1 SRE=2

Frame 2: 66 bytes on wire (528 bits), 66 bytes captured (528 bits) on interface 0
Ethernet II, Src: Sagemcom_fa:f1:1e (68:15:90:fa:f1:1e), Dst: HewlettP_49:af:30 (9c:8e:99:49:af:30)
Internet Protocol Version 4, Src: 35.186.208.246, Dst: 192.168.25.233
Transmission Control Protocol, Src Port: 80, Dst Port: 60261, Seq: 1, Ack: 2, Len: 0

No.     Time           Source                Destination           Protocol Length Info
      3 0.373022       fe80::6a15:90ff:fefa:f11e 2804:7f3:8882:909e:e081:315e:f477:243c ICMP   86     Neighbor Solicitation for 2804:7f3:8882:909e:e081:315e:f477:243c from 68:15:90:fa:f1:1e