No.     Time           Source                Destination           Protocol Length Info
      1 0.000000       Palladiu_43:ed:64     Broadcast             ARP      60     Who has 192.168.25.1? Tell 192.168.25.218

Frame 1: 60 bytes on wire (480 bits), 60 bytes captured (480 bits) on interface 0
Ethernet II, Src: Palladiu_43:ed:64 (5c:c9:d3:43:ed:64), Dst: Broadcast (ff:ff:ff:ff:ff:ff)
Address Resolution Protocol (request)

No.     Time           Source                Destination           Protocol Length Info
      2 3.229670       192.168.25.233        192.168.25.1          DNS      77     Standard query 0x104c A www.zezooshop.com

Frame 2: 77 bytes on wire (616 bits), 77 bytes captured (616 bits) on interface 0
Ethernet II, Src: HewlettP_49:af:30 (9c:8e:99:49:af:30), Dst: Sagemcom_fa:f1:1e (68:15:90:fa:f1:1e)
Internet Protocol Version 4, Src: 192.168.25.233, Dst: 192.168.25.1
User Datagram Protocol, Src Port: 49414, Dst Port: 53
Domain Name System (query)

No.     Time           Source                Destination           Protocol Length Info
      3 3.255838       192.168.25.1          192.168.25.233        DNS      168    Standard query response 0x104c A www.zezooshop.com CNAME zezooshop-1280927815.us-east-1.elb.amazonaws.com A 23.23.54.237 A 52.204.51.59

Frame 3: 168 bytes on wire (1344 bits), 168 bytes captured (1344 bits) on interface 0
Ethernet II, Src: Sagemcom_fa:f1:1e (68:15:90:fa:f1:1e), Dst: HewlettP_49:af:30 (9c:8e:99:49:af:30)
Internet Protocol Version 4, Src: 192.168.25.1, Dst: 192.168.25.233
User Datagram Protocol, Src Port: 53, Dst Port: 49414
Domain Name System (response)

No.     Time           Source                Destination           Protocol Length Info
      4 3.256265       192.168.25.233        192.168.25.1          DNS      77     Standard query 0xbac1 AAAA www.zezooshop.com

Frame 4: 77 bytes on wire (616 bits), 77 bytes captured (616 bits) on interface 0
Ethernet II, Src: HewlettP_49:af:30 (9c:8e:99:49:af:30), Dst: Sagemcom_fa:f1:1e (68:15:90:fa:f1:1e)
Internet Protocol Version 4, Src: 192.168.25.233, Dst: 192.168.25.1
User Datagram Protocol, Src Port: 58816, Dst Port: 53
Domain Name System (query)

No.     Time           Source                Destination           Protocol Length Info
      5 3.282338       192.168.25.1          192.168.25.233        DNS      218    Standard query response 0xbac1 AAAA www.zezooshop.com CNAME zezooshop-1280927815.us-east-1.elb.amazonaws.com SOA ns-1119.awsdns-11.org

Frame 5: 218 bytes on wire (1744 bits), 218 bytes captured (1744 bits) on interface 0
Ethernet II, Src: Sagemcom_fa:f1:1e (68:15:90:fa:f1:1e), Dst: HewlettP_49:af:30 (9c:8e:99:49:af:30)
Internet Protocol Version 4, Src: 192.168.25.1, Dst: 192.168.25.233
User Datagram Protocol, Src Port: 53, Dst Port: 58816
Domain Name System (response)

No.     Time           Source                Destination           Protocol Length Info
      6 4.340256       192.168.25.233        192.168.25.1          DNS      79     Standard query 0xf605 A clients4.google.com

Frame 6: 79 bytes on wire (632 bits), 79 bytes captured (632 bits) on interface 0
Ethernet II, Src: HewlettP_49:af:30 (9c:8e:99:49:af:30), Dst: Sagemcom_fa:f1:1e (68:15:90:fa:f1:1e)
Internet Protocol Version 4, Src: 192.168.25.233, Dst: 192.168.25.1
User Datagram Protocol, Src Port: 55476, Dst Port: 53
Domain Name System (query)

No.     Time           Source                Destination           Protocol Length Info
      7 4.347791       192.168.25.1          192.168.25.233        DNS      119    Standard query response 0xf605 A clients4.google.com CNAME clients.l.google.com A 216.58.222.110

Frame 7: 119 bytes on wire (952 bits), 119 bytes captured (952 bits) on interface 0
Ethernet II, Src: Sagemcom_fa:f1:1e (68:15:90:fa:f1:1e), Dst: HewlettP_49:af:30 (9c:8e:99:49:af:30)
Internet Protocol Version 4, Src: 192.168.25.1, Dst: 192.168.25.233
User Datagram Protocol, Src Port: 53, Dst Port: 55476
Domain Name System (response)

No.     Time           Source                Destination           Protocol Length Info
      8 4.348388       192.168.25.233        192.168.25.1          DNS      79     Standard query 0x0346 AAAA clients4.google.com

Frame 8: 79 bytes on wire (632 bits), 79 bytes captured (632 bits) on interface 0
Ethernet II, Src: HewlettP_49:af:30 (9c:8e:99:49:af:30), Dst: Sagemcom_fa:f1:1e (68:15:90:fa:f1:1e)
Internet Protocol Version 4, Src: 192.168.25.233, Dst: 192.168.25.1
User Datagram Protocol, Src Port: 60253, Dst Port: 53
Domain Name System (query)

No.     Time           Source                Destination           Protocol Length Info
      9 4.355980       192.168.25.1          192.168.25.233        DNS      131    Standard query response 0x0346 AAAA clients4.google.com CNAME clients.l.google.com AAAA 2800:3f0:4004:805::200e

Frame 9: 131 bytes on wire (1048 bits), 131 bytes captured (1048 bits) on interface 0
Ethernet II, Src: Sagemcom_fa:f1:1e (68:15:90:fa:f1:1e), Dst: HewlettP_49:af:30 (9c:8e:99:49:af:30)
Internet Protocol Version 4, Src: 192.168.25.1, Dst: 192.168.25.233
User Datagram Protocol, Src Port: 53, Dst Port: 60253
Domain Name System (response)

No.     Time           Source                Destination           Protocol Length Info
     10 4.357005       2804:7f3:8880:d51f:7583:5e92:7a66:a6dc 2800:3f0:4004:805::200e TCP      86     51877 → 443 [SYN] Seq=0 Win=8192 Len=0 MSS=1440 WS=4 SACK_PERM=1

Frame 10: 86 bytes on wire (688 bits), 86 bytes captured (688 bits) on interface 0
Ethernet II, Src: HewlettP_49:af:30 (9c:8e:99:49:af:30), Dst: Sagemcom_fa:f1:1e (68:15:90:fa:f1:1e)
Internet Protocol Version 6, Src: 2804:7f3:8880:d51f:7583:5e92:7a66:a6dc, Dst: 2800:3f0:4004:805::200e
Transmission Control Protocol, Src Port: 51877, Dst Port: 443, Seq: 0, Len: 0

No.     Time           Source                Destination           Protocol Length Info
     11 4.368099       192.168.25.233        191.235.82.97         TCP      66     51878 → 80 [SYN] Seq=0 Win=8192 Len=0 MSS=1460 WS=4 SACK_PERM=1

Frame 11: 66 bytes on wire (528 bits), 66 bytes captured (528 bits) on interface 0
Ethernet II, Src: HewlettP_49:af:30 (9c:8e:99:49:af:30), Dst: Sagemcom_fa:f1:1e (68:15:90:fa:f1:1e)
Internet Protocol Version 4, Src: 192.168.25.233, Dst: 191.235.82.97
Transmission Control Protocol, Src Port: 51878, Dst Port: 80, Seq: 0, Len: 0

No.     Time           Source                Destination           Protocol Length Info
     12 4.368998       192.168.25.233        192.168.25.1          DNS      74     Standard query 0xe878 A www.google.com

Frame 12: 74 bytes on wire (592 bits), 74 bytes captured (592 bits) on interface 0
Ethernet II, Src: HewlettP_49:af:30 (9c:8e:99:49:af:30), Dst: Sagemcom_fa:f1:1e (68:15:90:fa:f1:1e)
Internet Protocol Version 4, Src: 192.168.25.233, Dst: 192.168.25.1
User Datagram Protocol, Src Port: 62218, Dst Port: 53
Domain Name System (query)

No.     Time           Source                Destination           Protocol Length Info
     13 4.371466       2804:7f3:8880:d51f:7583:5e92:7a66:a6dc 2400:cb00:2048:1::681b:95e4 TCP      86     51879 → 80 [SYN] Seq=0 Win=8192 Len=0 MSS=1440 WS=4 SACK_PERM=1

Frame 13: 86 bytes on wire (688 bits), 86 bytes captured (688 bits) on interface 0
Ethernet II, Src: HewlettP_49:af:30 (9c:8e:99:49:af:30), Dst: Sagemcom_fa:f1:1e (68:15:90:fa:f1:1e)
Internet Protocol Version 6, Src: 2804:7f3:8880:d51f:7583:5e92:7a66:a6dc, Dst: 2400:cb00:2048:1::681b:95e4
Transmission Control Protocol, Src Port: 51879, Dst Port: 80, Seq: 0, Len: 0

No.     Time           Source                Destination           Protocol Length Info
     14 4.371927       2804:7f3:8880:d51f:7583:5e92:7a66:a6dc 2800:3f0:4004:801::2002 TCP      86     51880 → 80 [SYN] Seq=0 Win=8192 Len=0 MSS=1440 WS=4 SACK_PERM=1

Frame 14: 86 bytes on wire (688 bits), 86 bytes captured (688 bits) on interface 0
Ethernet II, Src: HewlettP_49:af:30 (9c:8e:99:49:af:30), Dst: Sagemcom_fa:f1:1e (68:15:90:fa:f1:1e)
Internet Protocol Version 6, Src: 2804:7f3:8880:d51f:7583:5e92:7a66:a6dc, Dst: 2800:3f0:4004:801::2002
Transmission Control Protocol, Src Port: 51880, Dst Port: 80, Seq: 0, Len: 0

No.     Time           Source                Destination           Protocol Length Info
     15 4.372140       2804:7f3:8880:d51f:7583:5e92:7a66:a6dc 2800:3f0:4004:801::2002 TCP      86     51881 → 80 [SYN] Seq=0 Win=8192 Len=0 MSS=1440 WS=4 SACK_PERM=1

Frame 15: 86 bytes on wire (688 bits), 86 bytes captured (688 bits) on interface 0
Ethernet II, Src: HewlettP_49:af:30 (9c:8e:99:49:af:30), Dst: Sagemcom_fa:f1:1e (68:15:90:fa:f1:1e)
Internet Protocol Version 6, Src: 2804:7f3:8880:d51f:7583:5e92:7a66:a6dc, Dst: 2800:3f0:4004:801::2002
Transmission Control Protocol, Src Port: 51881, Dst Port: 80, Seq: 0, Len: 0

No.     Time           Source                Destination           Protocol Length Info
     16 4.372353       2804:7f3:8880:d51f:7583:5e92:7a66:a6dc 2800:3f0:4004:801::2002 TCP      86     51882 → 80 [SYN] Seq=0 Win=8192 Len=0 MSS=1440 WS=4 SACK_PERM=1

Frame 16: 86 bytes on wire (688 bits), 86 bytes captured (688 bits) on interface 0
Ethernet II, Src: HewlettP_49:af:30 (9c:8e:99:49:af:30), Dst: Sagemcom_fa:f1:1e (68:15:90:fa:f1:1e)
Internet Protocol Version 6, Src: 2804:7f3:8880:d51f:7583:5e92:7a66:a6dc, Dst: 2800:3f0:4004:801::2002
Transmission Control Protocol, Src Port: 51882, Dst Port: 80, Seq: 0, Len: 0

No.     Time           Source                Destination           Protocol Length Info
     17 4.372797       2804:7f3:8880:d51f:7583:5e92:7a66:a6dc 2800:3f0:4004:801::2002 TCP      86     51883 → 80 [SYN] Seq=0 Win=8192 Len=0 MSS=1440 WS=4 SACK_PERM=1

Frame 17: 86 bytes on wire (688 bits), 86 bytes captured (688 bits) on interface 0
Ethernet II, Src: HewlettP_49:af:30 (9c:8e:99:49:af:30), Dst: Sagemcom_fa:f1:1e (68:15:90:fa:f1:1e)
Internet Protocol Version 6, Src: 2804:7f3:8880:d51f:7583:5e92:7a66:a6dc, Dst: 2800:3f0:4004:801::2002
Transmission Control Protocol, Src Port: 51883, Dst Port: 80, Seq: 0, Len: 0

No.     Time           Source                Destination           Protocol Length Info
     18 4.373010       2804:7f3:8880:d51f:7583:5e92:7a66:a6dc 2800:3f0:4004:801::2002 TCP      86     51884 → 80 [SYN] Seq=0 Win=8192 Len=0 MSS=1440 WS=4 SACK_PERM=1

Frame 18: 86 bytes on wire (688 bits), 86 bytes captured (688 bits) on interface 0
Ethernet II, Src: HewlettP_49:af:30 (9c:8e:99:49:af:30), Dst: Sagemcom_fa:f1:1e (68:15:90:fa:f1:1e)
Internet Protocol Version 6, Src: 2804:7f3:8880:d51f:7583:5e92:7a66:a6dc, Dst: 2800:3f0:4004:801::2002
Transmission Control Protocol, Src Port: 51884, Dst Port: 80, Seq: 0, Len: 0

No.     Time           Source                Destination           Protocol Length Info
     19 4.373433       2804:7f3:8880:d51f:7583:5e92:7a66:a6dc 2800:3f0:4004:801::2002 TCP      86     51885 → 80 [SYN] Seq=0 Win=8192 Len=0 MSS=1440 WS=4 SACK_PERM=1

Frame 19: 86 bytes on wire (688 bits), 86 bytes captured (688 bits) on interface 0
Ethernet II, Src: HewlettP_49:af:30 (9c:8e:99:49:af:30), Dst: Sagemcom_fa:f1:1e (68:15:90:fa:f1:1e)
Internet Protocol Version 6, Src: 2804:7f3:8880:d51f:7583:5e92:7a66:a6dc, Dst: 2800:3f0:4004:801::2002
Transmission Control Protocol, Src Port: 51885, Dst Port: 80, Seq: 0, Len: 0

No.     Time           Source                Destination           Protocol Length Info
     20 4.374225       2804:7f3:8880:d51f:7583:5e92:7a66:a6dc 2400:cb00:2048:1::681b:95e4 TCP      86     51886 → 80 [SYN] Seq=0 Win=8192 Len=0 MSS=1440 WS=4 SACK_PERM=1

Frame 20: 86 bytes on wire (688 bits), 86 bytes captured (688 bits) on interface 0
Ethernet II, Src: HewlettP_49:af:30 (9c:8e:99:49:af:30), Dst: Sagemcom_fa:f1:1e (68:15:90:fa:f1:1e)
Internet Protocol Version 6, Src: 2804:7f3:8880:d51f:7583:5e92:7a66:a6dc, Dst: 2400:cb00:2048:1::681b:95e4
Transmission Control Protocol, Src Port: 51886, Dst Port: 80, Seq: 0, Len: 0

No.     Time           Source                Destination           Protocol Length Info
     21 4.374459       2804:7f3:8880:d51f:7583:5e92:7a66:a6dc 2400:cb00:2048:1::681b:95e4 TCP      86     51887 → 80 [SYN] Seq=0 Win=8192 Len=0 MSS=1440 WS=4 SACK_PERM=1

Frame 21: 86 bytes on wire (688 bits), 86 bytes captured (688 bits) on interface 0
Ethernet II, Src: HewlettP_49:af:30 (9c:8e:99:49:af:30), Dst: Sagemcom_fa:f1:1e (68:15:90:fa:f1:1e)
Internet Protocol Version 6, Src: 2804:7f3:8880:d51f:7583:5e92:7a66:a6dc, Dst: 2400:cb00:2048:1::681b:95e4
Transmission Control Protocol, Src Port: 51887, Dst Port: 80, Seq: 0, Len: 0

No.     Time           Source                Destination           Protocol Length Info
     22 4.376490       192.168.25.1          192.168.25.233        DNS      90     Standard query response 0xe878 A www.google.com A 216.58.202.132

Frame 22: 90 bytes on wire (720 bits), 90 bytes captured (720 bits) on interface 0
Ethernet II, Src: Sagemcom_fa:f1:1e (68:15:90:fa:f1:1e), Dst: HewlettP_49:af:30 (9c:8e:99:49:af:30)
Internet Protocol Version 4, Src: 192.168.25.1, Dst: 192.168.25.233
User Datagram Protocol, Src Port: 53, Dst Port: 62218
Domain Name System (response)

No.     Time           Source                Destination           Protocol Length Info
     23 4.376701       192.168.25.233        192.168.25.1          DNS      74     Standard query 0x71bb A cse.google.com

Frame 23: 74 bytes on wire (592 bits), 74 bytes captured (592 bits) on interface 0
Ethernet II, Src: HewlettP_49:af:30 (9c:8e:99:49:af:30), Dst: Sagemcom_fa:f1:1e (68:15:90:fa:f1:1e)
Internet Protocol Version 4, Src: 192.168.25.233, Dst: 192.168.25.1
User Datagram Protocol, Src Port: 63174, Dst Port: 53
Domain Name System (query)

No.     Time           Source                Destination           Protocol Length Info
     24 4.377100       192.168.25.233        192.168.25.1          DNS      79     Standard query 0x3c5e A clients1.google.com

Frame 24: 79 bytes on wire (632 bits), 79 bytes captured (632 bits) on interface 0
Ethernet II, Src: HewlettP_49:af:30 (9c:8e:99:49:af:30), Dst: Sagemcom_fa:f1:1e (68:15:90:fa:f1:1e)
Internet Protocol Version 4, Src: 192.168.25.233, Dst: 192.168.25.1
User Datagram Protocol, Src Port: 57599, Dst Port: 53
Domain Name System (query)

No.     Time           Source                Destination           Protocol Length Info
     25 4.378484       2804:7f3:8880:d51f:7583:5e92:7a66:a6dc 2400:cb00:2048:1::681b:95e4 TCP      86     51888 → 80 [SYN] Seq=0 Win=8192 Len=0 MSS=1440 WS=4 SACK_PERM=1

Frame 25: 86 bytes on wire (688 bits), 86 bytes captured (688 bits) on interface 0
Ethernet II, Src: HewlettP_49:af:30 (9c:8e:99:49:af:30), Dst: Sagemcom_fa:f1:1e (68:15:90:fa:f1:1e)
Internet Protocol Version 6, Src: 2804:7f3:8880:d51f:7583:5e92:7a66:a6dc, Dst: 2400:cb00:2048:1::681b:95e4
Transmission Control Protocol, Src Port: 51888, Dst Port: 80, Seq: 0, Len: 0

No.     Time           Source                Destination           Protocol Length Info
     26 4.378726       2804:7f3:8880:d51f:7583:5e92:7a66:a6dc 2400:cb00:2048:1::681b:95e4 TCP      86     51889 → 80 [SYN] Seq=0 Win=8192 Len=0 MSS=1440 WS=4 SACK_PERM=1

Frame 26: 86 bytes on wire (688 bits), 86 bytes captured (688 bits) on interface 0
Ethernet II, Src: HewlettP_49:af:30 (9c:8e:99:49:af:30), Dst: Sagemcom_fa:f1:1e (68:15:90:fa:f1:1e)
Internet Protocol Version 6, Src: 2804:7f3:8880:d51f:7583:5e92:7a66:a6dc, Dst: 2400:cb00:2048:1::681b:95e4
Transmission Control Protocol, Src Port: 51889, Dst Port: 80, Seq: 0, Len: 0

No.     Time           Source                Destination           Protocol Length Info
     27 4.378952       2804:7f3:8880:d51f:7583:5e92:7a66:a6dc 2400:cb00:2048:1::681b:95e4 TCP      86     51890 → 80 [SYN] Seq=0 Win=8192 Len=0 MSS=1440 WS=4 SACK_PERM=1

Frame 27: 86 bytes on wire (688 bits), 86 bytes captured (688 bits) on interface 0
Ethernet II, Src: HewlettP_49:af:30 (9c:8e:99:49:af:30), Dst: Sagemcom_fa:f1:1e (68:15:90:fa:f1:1e)
Internet Protocol Version 6, Src: 2804:7f3:8880:d51f:7583:5e92:7a66:a6dc, Dst: 2400:cb00:2048:1::681b:95e4
Transmission Control Protocol, Src Port: 51890, Dst Port: 80, Seq: 0, Len: 0

No.     Time           Source                Destination           Protocol Length Info
     28 4.380866       192.168.25.233        186.202.136.238       TCP      66     51891 → 80 [SYN] Seq=0 Win=8192 Len=0 MSS=1460 WS=4 SACK_PERM=1

Frame 28: 66 bytes on wire (528 bits), 66 bytes captured (528 bits) on interface 0
Ethernet II, Src: HewlettP_49:af:30 (9c:8e:99:49:af:30), Dst: Sagemcom_fa:f1:1e (68:15:90:fa:f1:1e)
Internet Protocol Version 4, Src: 192.168.25.233, Dst: 186.202.136.238
Transmission Control Protocol, Src Port: 51891, Dst Port: 80, Seq: 0, Len: 0

No.     Time           Source                Destination           Protocol Length Info
     29 4.381177       192.168.25.233        186.202.136.238       TCP      66     51892 → 80 [SYN] Seq=0 Win=8192 Len=0 MSS=1460 WS=4 SACK_PERM=1

Frame 29: 66 bytes on wire (528 bits), 66 bytes captured (528 bits) on interface 0
Ethernet II, Src: HewlettP_49:af:30 (9c:8e:99:49:af:30), Dst: Sagemcom_fa:f1:1e (68:15:90:fa:f1:1e)
Internet Protocol Version 4, Src: 192.168.25.233, Dst: 186.202.136.238
Transmission Control Protocol, Src Port: 51892, Dst Port: 80, Seq: 0, Len: 0

No.     Time           Source                Destination           Protocol Length Info
     30 4.381364       192.168.25.233        186.202.136.238       TCP      66     51893 → 80 [SYN] Seq=0 Win=8192 Len=0 MSS=1460 WS=4 SACK_PERM=1

Frame 30: 66 bytes on wire (528 bits), 66 bytes captured (528 bits) on interface 0
Ethernet II, Src: HewlettP_49:af:30 (9c:8e:99:49:af:30), Dst: Sagemcom_fa:f1:1e (68:15:90:fa:f1:1e)
Internet Protocol Version 4, Src: 192.168.25.233, Dst: 186.202.136.238
Transmission Control Protocol, Src Port: 51893, Dst Port: 80, Seq: 0, Len: 0

No.     Time           Source                Destination           Protocol Length Info
     31 4.381629       192.168.25.233        50.31.164.173         TCP      66     51894 → 443 [SYN] Seq=0 Win=8192 Len=0 MSS=1460 WS=4 SACK_PERM=1

Frame 31: 66 bytes on wire (528 bits), 66 bytes captured (528 bits) on interface 0
Ethernet II, Src: HewlettP_49:af:30 (9c:8e:99:49:af:30), Dst: Sagemcom_fa:f1:1e (68:15:90:fa:f1:1e)
Internet Protocol Version 4, Src: 192.168.25.233, Dst: 50.31.164.173
Transmission Control Protocol, Src Port: 51894, Dst Port: 443, Seq: 0, Len: 0

No.     Time           Source                Destination           Protocol Length Info
     32 4.381786       192.168.25.233        192.168.25.1          DNS      74     Standard query 0x33db AAAA www.google.com

Frame 32: 74 bytes on wire (592 bits), 74 bytes captured (592 bits) on interface 0
Ethernet II, Src: HewlettP_49:af:30 (9c:8e:99:49:af:30), Dst: Sagemcom_fa:f1:1e (68:15:90:fa:f1:1e)
Internet Protocol Version 4, Src: 192.168.25.233, Dst: 192.168.25.1
User Datagram Protocol, Src Port: 51347, Dst Port: 53
Domain Name System (query)

No.     Time           Source                Destination           Protocol Length Info
     33 4.381815       192.168.25.233        50.31.164.173         TCP      66     51895 → 443 [SYN] Seq=0 Win=8192 Len=0 MSS=1460 WS=4 SACK_PERM=1

Frame 33: 66 bytes on wire (528 bits), 66 bytes captured (528 bits) on interface 0
Ethernet II, Src: HewlettP_49:af:30 (9c:8e:99:49:af:30), Dst: Sagemcom_fa:f1:1e (68:15:90:fa:f1:1e)
Internet Protocol Version 4, Src: 192.168.25.233, Dst: 50.31.164.173
Transmission Control Protocol, Src Port: 51895, Dst Port: 443, Seq: 0, Len: 0

No.     Time           Source                Destination           Protocol Length Info
     34 4.382011       192.168.25.233        50.31.164.173         TCP      66     51896 → 443 [SYN] Seq=0 Win=8192 Len=0 MSS=1460 WS=4 SACK_PERM=1

Frame 34: 66 bytes on wire (528 bits), 66 bytes captured (528 bits) on interface 0
Ethernet II, Src: HewlettP_49:af:30 (9c:8e:99:49:af:30), Dst: Sagemcom_fa:f1:1e (68:15:90:fa:f1:1e)
Internet Protocol Version 4, Src: 192.168.25.233, Dst: 50.31.164.173
Transmission Control Protocol, Src Port: 51896, Dst Port: 443, Seq: 0, Len: 0

No.     Time           Source                Destination           Protocol Length Info
     35 4.382558       2800:3f0:4004:805::200e 2804:7f3:8880:d51f:7583:5e92:7a66:a6dc TCP      86     443 → 51877 [SYN, ACK] Seq=0 Ack=1 Win=27200 Len=0 MSS=1360 SACK_PERM=1 WS=128

Frame 35: 86 bytes on wire (688 bits), 86 bytes captured (688 bits) on interface 0
Ethernet II, Src: Sagemcom_fa:f1:1e (68:15:90:fa:f1:1e), Dst: HewlettP_49:af:30 (9c:8e:99:49:af:30)
Internet Protocol Version 6, Src: 2800:3f0:4004:805::200e, Dst: 2804:7f3:8880:d51f:7583:5e92:7a66:a6dc
Transmission Control Protocol, Src Port: 443, Dst Port: 51877, Seq: 0, Ack: 1, Len: 0

No.     Time           Source                Destination           Protocol Length Info
     36 4.382636       2804:7f3:8880:d51f:7583:5e92:7a66:a6dc 2800:3f0:4004:805::200e TCP      74     51877 → 443 [ACK] Seq=1 Ack=1 Win=66640 Len=0

Frame 36: 74 bytes on wire (592 bits), 74 bytes captured (592 bits) on interface 0
Ethernet II, Src: HewlettP_49:af:30 (9c:8e:99:49:af:30), Dst: Sagemcom_fa:f1:1e (68:15:90:fa:f1:1e)
Internet Protocol Version 6, Src: 2804:7f3:8880:d51f:7583:5e92:7a66:a6dc, Dst: 2800:3f0:4004:805::200e
Transmission Control Protocol, Src Port: 51877, Dst Port: 443, Seq: 1, Ack: 1, Len: 0

No.     Time           Source                Destination           Protocol Length Info
     37 4.384357       192.168.25.233        52.84.174.25          TCP      66     51897 → 80 [SYN] Seq=0 Win=8192 Len=0 MSS=1460 WS=4 SACK_PERM=1

Frame 37: 66 bytes on wire (528 bits), 66 bytes captured (528 bits) on interface 0
Ethernet II, Src: HewlettP_49:af:30 (9c:8e:99:49:af:30), Dst: Sagemcom_fa:f1:1e (68:15:90:fa:f1:1e)
Internet Protocol Version 4, Src: 192.168.25.233, Dst: 52.84.174.25
Transmission Control Protocol, Src Port: 51897, Dst Port: 80, Seq: 0, Len: 0

No.     Time           Source                Destination           Protocol Length Info
     38 4.385573       192.168.25.233        52.84.174.25          TCP      66     51898 → 80 [SYN] Seq=0 Win=8192 Len=0 MSS=1460 WS=4 SACK_PERM=1

Frame 38: 66 bytes on wire (528 bits), 66 bytes captured (528 bits) on interface 0
Ethernet II, Src: HewlettP_49:af:30 (9c:8e:99:49:af:30), Dst: Sagemcom_fa:f1:1e (68:15:90:fa:f1:1e)
Internet Protocol Version 4, Src: 192.168.25.233, Dst: 52.84.174.25
Transmission Control Protocol, Src Port: 51898, Dst Port: 80, Seq: 0, Len: 0

No.     Time           Source                Destination           Protocol Length Info
     39 4.385789       192.168.25.233        52.84.174.25          TCP      66     51899 → 80 [SYN] Seq=0 Win=8192 Len=0 MSS=1460 WS=4 SACK_PERM=1

Frame 39: 66 bytes on wire (528 bits), 66 bytes captured (528 bits) on interface 0
Ethernet II, Src: HewlettP_49:af:30 (9c:8e:99:49:af:30), Dst: Sagemcom_fa:f1:1e (68:15:90:fa:f1:1e)
Internet Protocol Version 4, Src: 192.168.25.233, Dst: 52.84.174.25
Transmission Control Protocol, Src Port: 51899, Dst Port: 80, Seq: 0, Len: 0

No.     Time           Source                Destination           Protocol Length Info
     40 4.385994       192.168.25.233        52.84.174.25          TCP      66     51900 → 80 [SYN] Seq=0 Win=8192 Len=0 MSS=1460 WS=4 SACK_PERM=1

Frame 40: 66 bytes on wire (528 bits), 66 bytes captured (528 bits) on interface 0
Ethernet II, Src: HewlettP_49:af:30 (9c:8e:99:49:af:30), Dst: Sagemcom_fa:f1:1e (68:15:90:fa:f1:1e)
Internet Protocol Version 4, Src: 192.168.25.233, Dst: 52.84.174.25
Transmission Control Protocol, Src Port: 51900, Dst Port: 80, Seq: 0, Len: 0

No.     Time           Source                Destination           Protocol Length Info
     41 4.387851       192.168.25.1          192.168.25.233        DNS      90     Standard query response 0x71bb A cse.google.com A 172.217.29.78

Frame 41: 90 bytes on wire (720 bits), 90 bytes captured (720 bits) on interface 0
Ethernet II, Src: Sagemcom_fa:f1:1e (68:15:90:fa:f1:1e), Dst: HewlettP_49:af:30 (9c:8e:99:49:af:30)
Internet Protocol Version 4, Src: 192.168.25.1, Dst: 192.168.25.233
User Datagram Protocol, Src Port: 53, Dst Port: 63174
Domain Name System (response)

No.     Time           Source                Destination           Protocol Length Info
     42 4.389884       192.168.25.233        192.168.25.1          DNS      74     Standard query 0x2578 AAAA cse.google.com

Frame 42: 74 bytes on wire (592 bits), 74 bytes captured (592 bits) on interface 0
Ethernet II, Src: HewlettP_49:af:30 (9c:8e:99:49:af:30), Dst: Sagemcom_fa:f1:1e (68:15:90:fa:f1:1e)
Internet Protocol Version 4, Src: 192.168.25.233, Dst: 192.168.25.1
User Datagram Protocol, Src Port: 53369, Dst Port: 53
Domain Name System (query)

No.     Time           Source                Destination           Protocol Length Info
     43 4.390228       192.168.25.233        52.84.174.25          TCP      66     51901 → 80 [SYN] Seq=0 Win=8192 Len=0 MSS=1460 WS=4 SACK_PERM=1

Frame 43: 66 bytes on wire (528 bits), 66 bytes captured (528 bits) on interface 0
Ethernet II, Src: HewlettP_49:af:30 (9c:8e:99:49:af:30), Dst: Sagemcom_fa:f1:1e (68:15:90:fa:f1:1e)
Internet Protocol Version 4, Src: 192.168.25.233, Dst: 52.84.174.25
Transmission Control Protocol, Src Port: 51901, Dst Port: 80, Seq: 0, Len: 0

No.     Time           Source                Destination           Protocol Length Info
     44 4.390450       192.168.25.233        52.84.174.25          TCP      66     51902 → 80 [SYN] Seq=0 Win=8192 Len=0 MSS=1460 WS=4 SACK_PERM=1

Frame 44: 66 bytes on wire (528 bits), 66 bytes captured (528 bits) on interface 0
Ethernet II, Src: HewlettP_49:af:30 (9c:8e:99:49:af:30), Dst: Sagemcom_fa:f1:1e (68:15:90:fa:f1:1e)
Internet Protocol Version 4, Src: 192.168.25.233, Dst: 52.84.174.25
Transmission Control Protocol, Src Port: 51902, Dst Port: 80, Seq: 0, Len: 0

No.     Time           Source                Destination           Protocol Length Info
     45 4.392914       2804:7f3:8880:d51f:7583:5e92:7a66:a6dc 2800:3f0:4004:801::2002 TCP      86     51903 → 80 [SYN] Seq=0 Win=8192 Len=0 MSS=1440 WS=4 SACK_PERM=1

Frame 45: 86 bytes on wire (688 bits), 86 bytes captured (688 bits) on interface 0
Ethernet II, Src: HewlettP_49:af:30 (9c:8e:99:49:af:30), Dst: Sagemcom_fa:f1:1e (68:15:90:fa:f1:1e)
Internet Protocol Version 6, Src: 2804:7f3:8880:d51f:7583:5e92:7a66:a6dc, Dst: 2800:3f0:4004:801::2002
Transmission Control Protocol, Src Port: 51903, Dst Port: 80, Seq: 0, Len: 0

No.     Time           Source                Destination           Protocol Length Info
     46 4.393534       192.168.25.233        192.168.25.1          DNS      80     Standard query 0x8d29 A connect.facebook.net

Frame 46: 80 bytes on wire (640 bits), 80 bytes captured (640 bits) on interface 0
Ethernet II, Src: HewlettP_49:af:30 (9c:8e:99:49:af:30), Dst: Sagemcom_fa:f1:1e (68:15:90:fa:f1:1e)
Internet Protocol Version 4, Src: 192.168.25.233, Dst: 192.168.25.1
User Datagram Protocol, Src Port: 49307, Dst Port: 53
Domain Name System (query)

No.     Time           Source                Destination           Protocol Length Info
     47 4.394122       192.168.25.1          192.168.25.233        DNS      119    Standard query response 0x3c5e A clients1.google.com CNAME clients.l.google.com A 216.58.222.110

Frame 47: 119 bytes on wire (952 bits), 119 bytes captured (952 bits) on interface 0
Ethernet II, Src: Sagemcom_fa:f1:1e (68:15:90:fa:f1:1e), Dst: HewlettP_49:af:30 (9c:8e:99:49:af:30)
Internet Protocol Version 4, Src: 192.168.25.1, Dst: 192.168.25.233
User Datagram Protocol, Src Port: 53, Dst Port: 57599
Domain Name System (response)

No.     Time           Source                Destination           Protocol Length Info
     48 4.394454       192.168.25.233        192.168.25.1          DNS      79     Standard query 0xc6e0 AAAA clients1.google.com

Frame 48: 79 bytes on wire (632 bits), 79 bytes captured (632 bits) on interface 0
Ethernet II, Src: HewlettP_49:af:30 (9c:8e:99:49:af:30), Dst: Sagemcom_fa:f1:1e (68:15:90:fa:f1:1e)
Internet Protocol Version 4, Src: 192.168.25.233, Dst: 192.168.25.1
User Datagram Protocol, Src Port: 58691, Dst Port: 53
Domain Name System (query)

No.     Time           Source                Destination           Protocol Length Info
     49 4.395054       2400:cb00:2048:1::681b:95e4 2804:7f3:8880:d51f:7583:5e92:7a66:a6dc TCP      86     80 → 51879 [SYN, ACK] Seq=0 Ack=1 Win=24400 Len=0 MSS=1220 SACK_PERM=1 WS=1024

Frame 49: 86 bytes on wire (688 bits), 86 bytes captured (688 bits) on interface 0
Ethernet II, Src: Sagemcom_fa:f1:1e (68:15:90:fa:f1:1e), Dst: HewlettP_49:af:30 (9c:8e:99:49:af:30)
Internet Protocol Version 6, Src: 2400:cb00:2048:1::681b:95e4, Dst: 2804:7f3:8880:d51f:7583:5e92:7a66:a6dc
Transmission Control Protocol, Src Port: 80, Dst Port: 51879, Seq: 0, Ack: 1, Len: 0

No.     Time           Source                Destination           Protocol Length Info
     50 4.395098       2804:7f3:8880:d51f:7583:5e92:7a66:a6dc 2800:3f0:4004:801::2002 TCP      86     51904 → 80 [SYN] Seq=0 Win=8192 Len=0 MSS=1440 WS=4 SACK_PERM=1

Frame 50: 86 bytes on wire (688 bits), 86 bytes captured (688 bits) on interface 0
Ethernet II, Src: HewlettP_49:af:30 (9c:8e:99:49:af:30), Dst: Sagemcom_fa:f1:1e (68:15:90:fa:f1:1e)
Internet Protocol Version 6, Src: 2804:7f3:8880:d51f:7583:5e92:7a66:a6dc, Dst: 2800:3f0:4004:801::2002
Transmission Control Protocol, Src Port: 51904, Dst Port: 80, Seq: 0, Len: 0

No.     Time           Source                Destination           Protocol Length Info
     51 4.395117       2804:7f3:8880:d51f:7583:5e92:7a66:a6dc 2400:cb00:2048:1::681b:95e4 TCP      74     51879 → 80 [ACK] Seq=1 Ack=1 Win=65880 Len=0

Frame 51: 74 bytes on wire (592 bits), 74 bytes captured (592 bits) on interface 0
Ethernet II, Src: HewlettP_49:af:30 (9c:8e:99:49:af:30), Dst: Sagemcom_fa:f1:1e (68:15:90:fa:f1:1e)
Internet Protocol Version 6, Src: 2804:7f3:8880:d51f:7583:5e92:7a66:a6dc, Dst: 2400:cb00:2048:1::681b:95e4
Transmission Control Protocol, Src Port: 51879, Dst Port: 80, Seq: 1, Ack: 1, Len: 0

No.     Time           Source                Destination           Protocol Length Info
     52 4.395869       192.168.25.1          192.168.25.233        DNS      102    Standard query response 0x33db AAAA www.google.com AAAA 2800:3f0:4001:815::2004

Frame 52: 102 bytes on wire (816 bits), 102 bytes captured (816 bits) on interface 0
Ethernet II, Src: Sagemcom_fa:f1:1e (68:15:90:fa:f1:1e), Dst: HewlettP_49:af:30 (9c:8e:99:49:af:30)
Internet Protocol Version 4, Src: 192.168.25.1, Dst: 192.168.25.233
User Datagram Protocol, Src Port: 53, Dst Port: 51347
Domain Name System (response)

No.     Time           Source                Destination           Protocol Length Info
     53 4.396308       191.235.82.97         192.168.25.233        TCP      66     80 → 51878 [SYN, ACK] Seq=0 Ack=1 Win=29200 Len=0 MSS=1420 SACK_PERM=1 WS=128

Frame 53: 66 bytes on wire (528 bits), 66 bytes captured (528 bits) on interface 0
Ethernet II, Src: Sagemcom_fa:f1:1e (68:15:90:fa:f1:1e), Dst: HewlettP_49:af:30 (9c:8e:99:49:af:30)
Internet Protocol Version 4, Src: 191.235.82.97, Dst: 192.168.25.233
Transmission Control Protocol, Src Port: 80, Dst Port: 51878, Seq: 0, Ack: 1, Len: 0

No.     Time           Source                Destination           Protocol Length Info
     54 4.396327       192.168.25.233        192.168.25.1          DNS      90     Standard query 0x9d80 A flamidia.blob.core.windows.net

Frame 54: 90 bytes on wire (720 bits), 90 bytes captured (720 bits) on interface 0
Ethernet II, Src: HewlettP_49:af:30 (9c:8e:99:49:af:30), Dst: Sagemcom_fa:f1:1e (68:15:90:fa:f1:1e)
Internet Protocol Version 4, Src: 192.168.25.233, Dst: 192.168.25.1
User Datagram Protocol, Src Port: 61250, Dst Port: 53
Domain Name System (query)

No.     Time           Source                Destination           Protocol Length Info
     55 4.396373       192.168.25.233        191.235.82.97         TCP      54     51878 → 80 [ACK] Seq=1 Ack=1 Win=66740 Len=0

Frame 55: 54 bytes on wire (432 bits), 54 bytes captured (432 bits) on interface 0
Ethernet II, Src: HewlettP_49:af:30 (9c:8e:99:49:af:30), Dst: Sagemcom_fa:f1:1e (68:15:90:fa:f1:1e)
Internet Protocol Version 4, Src: 192.168.25.233, Dst: 191.235.82.97
Transmission Control Protocol, Src Port: 51878, Dst Port: 80, Seq: 1, Ack: 1, Len: 0

No.     Time           Source                Destination           Protocol Length Info
     56 4.398543       2800:3f0:4004:801::2002 2804:7f3:8880:d51f:7583:5e92:7a66:a6dc TCP      86     80 → 51880 [SYN, ACK] Seq=0 Ack=1 Win=27200 Len=0 MSS=1360 SACK_PERM=1 WS=128

Frame 56: 86 bytes on wire (688 bits), 86 bytes captured (688 bits) on interface 0
Ethernet II, Src: Sagemcom_fa:f1:1e (68:15:90:fa:f1:1e), Dst: HewlettP_49:af:30 (9c:8e:99:49:af:30)
Internet Protocol Version 6, Src: 2800:3f0:4004:801::2002, Dst: 2804:7f3:8880:d51f:7583:5e92:7a66:a6dc
Transmission Control Protocol, Src Port: 80, Dst Port: 51880, Seq: 0, Ack: 1, Len: 0

No.     Time           Source                Destination           Protocol Length Info
     57 4.398631       2804:7f3:8880:d51f:7583:5e92:7a66:a6dc 2800:3f0:4004:801::2002 TCP      74     51880 → 80 [ACK] Seq=1 Ack=1 Win=66640 Len=0

Frame 57: 74 bytes on wire (592 bits), 74 bytes captured (592 bits) on interface 0
Ethernet II, Src: HewlettP_49:af:30 (9c:8e:99:49:af:30), Dst: Sagemcom_fa:f1:1e (68:15:90:fa:f1:1e)
Internet Protocol Version 6, Src: 2804:7f3:8880:d51f:7583:5e92:7a66:a6dc, Dst: 2800:3f0:4004:801::2002
Transmission Control Protocol, Src Port: 51880, Dst Port: 80, Seq: 1, Ack: 1, Len: 0

No.     Time           Source                Destination           Protocol Length Info
     58 4.398731       192.168.25.233        201.7.177.137         TCP      66     51905 → 80 [SYN] Seq=0 Win=8192 Len=0 MSS=1460 WS=4 SACK_PERM=1

Frame 58: 66 bytes on wire (528 bits), 66 bytes captured (528 bits) on interface 0
Ethernet II, Src: HewlettP_49:af:30 (9c:8e:99:49:af:30), Dst: Sagemcom_fa:f1:1e (68:15:90:fa:f1:1e)
Internet Protocol Version 4, Src: 192.168.25.233, Dst: 201.7.177.137
Transmission Control Protocol, Src Port: 51905, Dst Port: 80, Seq: 0, Len: 0

No.     Time           Source                Destination           Protocol Length Info
     59 4.398894       192.168.25.1          192.168.25.233        DNS      141    Standard query response 0xc6e0 AAAA clients1.google.com CNAME clients.l.google.com AAAA 2800:3f0:4004:805::200e

Frame 59: 141 bytes on wire (1128 bits), 141 bytes captured (1128 bits) on interface 0
Ethernet II, Src: Sagemcom_fa:f1:1e (68:15:90:fa:f1:1e), Dst: HewlettP_49:af:30 (9c:8e:99:49:af:30)
Internet Protocol Version 4, Src: 192.168.25.1, Dst: 192.168.25.233
User Datagram Protocol, Src Port: 53, Dst Port: 58691
Domain Name System (response)

No.     Time           Source                Destination           Protocol Length Info
     60 4.399396       192.168.25.233        201.7.177.137         TCP      66     51906 → 80 [SYN] Seq=0 Win=8192 Len=0 MSS=1460 WS=4 SACK_PERM=1

Frame 60: 66 bytes on wire (528 bits), 66 bytes captured (528 bits) on interface 0
Ethernet II, Src: HewlettP_49:af:30 (9c:8e:99:49:af:30), Dst: Sagemcom_fa:f1:1e (68:15:90:fa:f1:1e)
Internet Protocol Version 4, Src: 192.168.25.233, Dst: 201.7.177.137
Transmission Control Protocol, Src Port: 51906, Dst Port: 80, Seq: 0, Len: 0

No.     Time           Source                Destination           Protocol Length Info
     61 4.399617       192.168.25.233        201.7.177.137         TCP      66     51907 → 80 [SYN] Seq=0 Win=8192 Len=0 MSS=1460 WS=4 SACK_PERM=1

Frame 61: 66 bytes on wire (528 bits), 66 bytes captured (528 bits) on interface 0
Ethernet II, Src: HewlettP_49:af:30 (9c:8e:99:49:af:30), Dst: Sagemcom_fa:f1:1e (68:15:90:fa:f1:1e)
Internet Protocol Version 4, Src: 192.168.25.233, Dst: 201.7.177.137
Transmission Control Protocol, Src Port: 51907, Dst Port: 80, Seq: 0, Len: 0

No.     Time           Source                Destination           Protocol Length Info
     62 4.399831       192.168.25.233        201.7.177.137         TCP      66     51908 → 80 [SYN] Seq=0 Win=8192 Len=0 MSS=1460 WS=4 SACK_PERM=1

Frame 62: 66 bytes on wire (528 bits), 66 bytes captured (528 bits) on interface 0
Ethernet II, Src: HewlettP_49:af:30 (9c:8e:99:49:af:30), Dst: Sagemcom_fa:f1:1e (68:15:90:fa:f1:1e)
Internet Protocol Version 4, Src: 192.168.25.233, Dst: 201.7.177.137
Transmission Control Protocol, Src Port: 51908, Dst Port: 80, Seq: 0, Len: 0

No.     Time           Source                Destination           Protocol Length Info
     63 4.400035       192.168.25.233        201.7.177.137         TCP      66     51909 → 80 [SYN] Seq=0 Win=8192 Len=0 MSS=1460 WS=4 SACK_PERM=1

Frame 63: 66 bytes on wire (528 bits), 66 bytes captured (528 bits) on interface 0
Ethernet II, Src: HewlettP_49:af:30 (9c:8e:99:49:af:30), Dst: Sagemcom_fa:f1:1e (68:15:90:fa:f1:1e)
Internet Protocol Version 4, Src: 192.168.25.233, Dst: 201.7.177.137
Transmission Control Protocol, Src Port: 51909, Dst Port: 80, Seq: 0, Len: 0

No.     Time           Source                Destination           Protocol Length Info
     64 4.400244       192.168.25.233        201.7.177.137         TCP      66     51910 → 80 [SYN] Seq=0 Win=8192 Len=0 MSS=1460 WS=4 SACK_PERM=1

Frame 64: 66 bytes on wire (528 bits), 66 bytes captured (528 bits) on interface 0
Ethernet II, Src: HewlettP_49:af:30 (9c:8e:99:49:af:30), Dst: Sagemcom_fa:f1:1e (68:15:90:fa:f1:1e)
Internet Protocol Version 4, Src: 192.168.25.233, Dst: 201.7.177.137
Transmission Control Protocol, Src Port: 51910, Dst Port: 80, Seq: 0, Len: 0

No.     Time           Source                Destination           Protocol Length Info
     65 4.401027       192.168.25.1          192.168.25.233        DNS      102    Standard query response 0x2578 AAAA cse.google.com AAAA 2800:3f0:4004:804::200e

Frame 65: 102 bytes on wire (816 bits), 102 bytes captured (816 bits) on interface 0
Ethernet II, Src: Sagemcom_fa:f1:1e (68:15:90:fa:f1:1e), Dst: HewlettP_49:af:30 (9c:8e:99:49:af:30)
Internet Protocol Version 4, Src: 192.168.25.1, Dst: 192.168.25.233
User Datagram Protocol, Src Port: 53, Dst Port: 53369
Domain Name System (response)

No.     Time           Source                Destination           Protocol Length Info
     66 4.401258       2804:7f3:8880:d51f:7583:5e92:7a66:a6dc 2800:3f0:4004:801::2002 TCP      86     51911 → 443 [SYN] Seq=0 Win=8192 Len=0 MSS=1440 WS=4 SACK_PERM=1

Frame 66: 86 bytes on wire (688 bits), 86 bytes captured (688 bits) on interface 0
Ethernet II, Src: HewlettP_49:af:30 (9c:8e:99:49:af:30), Dst: Sagemcom_fa:f1:1e (68:15:90:fa:f1:1e)
Internet Protocol Version 6, Src: 2804:7f3:8880:d51f:7583:5e92:7a66:a6dc, Dst: 2800:3f0:4004:801::2002
Transmission Control Protocol, Src Port: 51911, Dst Port: 443, Seq: 0, Len: 0

No.     Time           Source                Destination           Protocol Length Info
     67 4.401808       2804:7f3:8880:d51f:7583:5e92:7a66:a6dc 2800:3f0:4004:805::200e TLSv1.2  591    Client Hello

Frame 67: 591 bytes on wire (4728 bits), 591 bytes captured (4728 bits) on interface 0
Ethernet II, Src: HewlettP_49:af:30 (9c:8e:99:49:af:30), Dst: Sagemcom_fa:f1:1e (68:15:90:fa:f1:1e)
Internet Protocol Version 6, Src: 2804:7f3:8880:d51f:7583:5e92:7a66:a6dc, Dst: 2800:3f0:4004:805::200e
Transmission Control Protocol, Src Port: 51877, Dst Port: 443, Seq: 1, Ack: 1, Len: 517
Secure Sockets Layer

No.     Time           Source                Destination           Protocol Length Info
