No.     Time           Source                Destination           Protocol Length Info
      1 0.000000       2804:7f3:8880:d51f:7583:5e92:7a66:a6dc 2804:7f4:2002:1005::98 DNS      90     Standard query 0x7bae A www.unb.br

Frame 1: 90 bytes on wire (720 bits), 90 bytes captured (720 bits) on interface 0
Ethernet II, Src: HewlettP_49:af:30 (9c:8e:99:49:af:30), Dst: Sagemcom_fa:f1:1e (68:15:90:fa:f1:1e)
Internet Protocol Version 6, Src: 2804:7f3:8880:d51f:7583:5e92:7a66:a6dc, Dst: 2804:7f4:2002:1005::98
User Datagram Protocol, Src Port: 64192, Dst Port: 53
Domain Name System (query)

No.     Time           Source                Destination           Protocol Length Info
      2 0.009438       2804:7f4:2002:1005::98 2804:7f3:8880:d51f:7583:5e92:7a66:a6dc DNS      106    Standard query response 0x7bae A www.unb.br A 164.41.102.70

Frame 2: 106 bytes on wire (848 bits), 106 bytes captured (848 bits) on interface 0
Ethernet II, Src: Sagemcom_fa:f1:1e (68:15:90:fa:f1:1e), Dst: HewlettP_49:af:30 (9c:8e:99:49:af:30)
Internet Protocol Version 6, Src: 2804:7f4:2002:1005::98, Dst: 2804:7f3:8880:d51f:7583:5e92:7a66:a6dc
User Datagram Protocol, Src Port: 53, Dst Port: 64192
Domain Name System (response)

No.     Time           Source                Destination           Protocol Length Info
      3 0.010703       2804:7f3:8880:d51f:7583:5e92:7a66:a6dc 2804:7f4:2002:1005::98 DNS      90     Standard query 0xf0f5 AAAA www.unb.br

Frame 3: 90 bytes on wire (720 bits), 90 bytes captured (720 bits) on interface 0
Ethernet II, Src: HewlettP_49:af:30 (9c:8e:99:49:af:30), Dst: Sagemcom_fa:f1:1e (68:15:90:fa:f1:1e)
Internet Protocol Version 6, Src: 2804:7f3:8880:d51f:7583:5e92:7a66:a6dc, Dst: 2804:7f4:2002:1005::98
User Datagram Protocol, Src Port: 51121, Dst Port: 53
Domain Name System (query)

No.     Time           Source                Destination           Protocol Length Info
      4 0.017127       2804:7f4:2002:1005::98 2804:7f3:8880:d51f:7583:5e92:7a66:a6dc DNS      142    Standard query response 0xf0f5 AAAA www.unb.br SOA dns1.unb.br

Frame 4: 142 bytes on wire (1136 bits), 142 bytes captured (1136 bits) on interface 0
Ethernet II, Src: Sagemcom_fa:f1:1e (68:15:90:fa:f1:1e), Dst: HewlettP_49:af:30 (9c:8e:99:49:af:30)
Internet Protocol Version 6, Src: 2804:7f4:2002:1005::98, Dst: 2804:7f3:8880:d51f:7583:5e92:7a66:a6dc
User Datagram Protocol, Src Port: 53, Dst Port: 51121
Domain Name System (response)

No.     Time           Source                Destination           Protocol Length Info
      5 1.552568       2804:7f3:8880:d51f:7583:5e92:7a66:a6dc 2804:7f4:2002:1005::98 DNS      103    Standard query 0x9e7c A www.canteiraceleste.com

Frame 5: 103 bytes on wire (824 bits), 103 bytes captured (824 bits) on interface 0
Ethernet II, Src: HewlettP_49:af:30 (9c:8e:99:49:af:30), Dst: Sagemcom_fa:f1:1e (68:15:90:fa:f1:1e)
Internet Protocol Version 6, Src: 2804:7f3:8880:d51f:7583:5e92:7a66:a6dc, Dst: 2804:7f4:2002:1005::98
User Datagram Protocol, Src Port: 57785, Dst Port: 53
Domain Name System (query)

No.     Time           Source                Destination           Protocol Length Info
      6 1.553072       2804:7f3:8880:d51f:7583:5e92:7a66:a6dc 2804:7f4:2002:1005::98 DNS      106    Standard query 0xf548 A canteiraceleste.disqus.com

Frame 6: 106 bytes on wire (848 bits), 106 bytes captured (848 bits) on interface 0
Ethernet II, Src: HewlettP_49:af:30 (9c:8e:99:49:af:30), Dst: Sagemcom_fa:f1:1e (68:15:90:fa:f1:1e)
Internet Protocol Version 6, Src: 2804:7f3:8880:d51f:7583:5e92:7a66:a6dc, Dst: 2804:7f4:2002:1005::98
User Datagram Protocol, Src Port: 61750, Dst Port: 53
Domain Name System (query)

No.     Time           Source                Destination           Protocol Length Info
      7 1.564054       2804:7f3:8880:d51f:7583:5e92:7a66:a6dc 2804:7f4:2002:1005::98 DNS      93     Standard query 0x0932 A ps.eyeota.net

Frame 7: 93 bytes on wire (744 bits), 93 bytes captured (744 bits) on interface 0
Ethernet II, Src: HewlettP_49:af:30 (9c:8e:99:49:af:30), Dst: Sagemcom_fa:f1:1e (68:15:90:fa:f1:1e)
Internet Protocol Version 6, Src: 2804:7f3:8880:d51f:7583:5e92:7a66:a6dc, Dst: 2804:7f4:2002:1005::98
User Datagram Protocol, Src Port: 63062, Dst Port: 53
Domain Name System (query)

No.     Time           Source                Destination           Protocol Length Info
      8 1.568575       2804:7f3:8880:d51f:7583:5e92:7a66:a6dc 2804:7f4:2002:1005::98 DNS      97     Standard query 0xd01e A 2.bp.blogspot.com

Frame 8: 97 bytes on wire (776 bits), 97 bytes captured (776 bits) on interface 0
Ethernet II, Src: HewlettP_49:af:30 (9c:8e:99:49:af:30), Dst: Sagemcom_fa:f1:1e (68:15:90:fa:f1:1e)
Internet Protocol Version 6, Src: 2804:7f3:8880:d51f:7583:5e92:7a66:a6dc, Dst: 2804:7f4:2002:1005::98
User Datagram Protocol, Src Port: 55967, Dst Port: 53
Domain Name System (query)

No.     Time           Source                Destination           Protocol Length Info
      9 1.568901       2804:7f3:8880:d51f:7583:5e92:7a66:a6dc 2804:7f4:2002:1005::98 DNS      94     Standard query 0x20ba A www.google.com

Frame 9: 94 bytes on wire (752 bits), 94 bytes captured (752 bits) on interface 0
Ethernet II, Src: HewlettP_49:af:30 (9c:8e:99:49:af:30), Dst: Sagemcom_fa:f1:1e (68:15:90:fa:f1:1e)
Internet Protocol Version 6, Src: 2804:7f3:8880:d51f:7583:5e92:7a66:a6dc, Dst: 2804:7f4:2002:1005::98
User Datagram Protocol, Src Port: 61940, Dst Port: 53
Domain Name System (query)

No.     Time           Source                Destination           Protocol Length Info
     10 1.569116       2804:7f3:8880:d51f:7583:5e92:7a66:a6dc 2804:7f4:2002:1005::98 DNS      97     Standard query 0x6a2a A 3.bp.blogspot.com

Frame 10: 97 bytes on wire (776 bits), 97 bytes captured (776 bits) on interface 0
Ethernet II, Src: HewlettP_49:af:30 (9c:8e:99:49:af:30), Dst: Sagemcom_fa:f1:1e (68:15:90:fa:f1:1e)
Internet Protocol Version 6, Src: 2804:7f3:8880:d51f:7583:5e92:7a66:a6dc, Dst: 2804:7f4:2002:1005::98
User Datagram Protocol, Src Port: 62981, Dst Port: 53
Domain Name System (query)

No.     Time           Source                Destination           Protocol Length Info
     11 1.570403       2804:7f4:2002:1005::98 2804:7f3:8880:d51f:7583:5e92:7a66:a6dc DNS      109    Standard query response 0x0932 A ps.eyeota.net A 54.161.197.102

Frame 11: 109 bytes on wire (872 bits), 109 bytes captured (872 bits) on interface 0
Ethernet II, Src: Sagemcom_fa:f1:1e (68:15:90:fa:f1:1e), Dst: HewlettP_49:af:30 (9c:8e:99:49:af:30)
Internet Protocol Version 6, Src: 2804:7f4:2002:1005::98, Dst: 2804:7f3:8880:d51f:7583:5e92:7a66:a6dc
User Datagram Protocol, Src Port: 53, Dst Port: 63062
Domain Name System (response)

No.     Time           Source                Destination           Protocol Length Info
     12 1.571424       2804:7f3:8880:d51f:7583:5e92:7a66:a6dc 2804:7f4:2002:1005::98 DNS      93     Standard query 0x27fd AAAA ps.eyeota.net

Frame 12: 93 bytes on wire (744 bits), 93 bytes captured (744 bits) on interface 0
Ethernet II, Src: HewlettP_49:af:30 (9c:8e:99:49:af:30), Dst: Sagemcom_fa:f1:1e (68:15:90:fa:f1:1e)
Internet Protocol Version 6, Src: 2804:7f3:8880:d51f:7583:5e92:7a66:a6dc, Dst: 2804:7f4:2002:1005::98
User Datagram Protocol, Src Port: 55724, Dst Port: 53
Domain Name System (query)

No.     Time           Source                Destination           Protocol Length Info
     13 1.575617       2804:7f4:2002:1005::98 2804:7f3:8880:d51f:7583:5e92:7a66:a6dc DNS      158    Standard query response 0xd01e A 2.bp.blogspot.com CNAME photos-ugc.l.googleusercontent.com A 172.217.29.65

Frame 13: 158 bytes on wire (1264 bits), 158 bytes captured (1264 bits) on interface 0
Ethernet II, Src: Sagemcom_fa:f1:1e (68:15:90:fa:f1:1e), Dst: HewlettP_49:af:30 (9c:8e:99:49:af:30)
Internet Protocol Version 6, Src: 2804:7f4:2002:1005::98, Dst: 2804:7f3:8880:d51f:7583:5e92:7a66:a6dc
User Datagram Protocol, Src Port: 53, Dst Port: 55967
Domain Name System (response)

No.     Time           Source                Destination           Protocol Length Info
     14 1.576063       2804:7f3:8880:d51f:7583:5e92:7a66:a6dc 2804:7f4:2002:1005::98 DNS      97     Standard query 0x8ca6 AAAA 2.bp.blogspot.com

Frame 14: 97 bytes on wire (776 bits), 97 bytes captured (776 bits) on interface 0
Ethernet II, Src: HewlettP_49:af:30 (9c:8e:99:49:af:30), Dst: Sagemcom_fa:f1:1e (68:15:90:fa:f1:1e)
Internet Protocol Version 6, Src: 2804:7f3:8880:d51f:7583:5e92:7a66:a6dc, Dst: 2804:7f4:2002:1005::98
User Datagram Protocol, Src Port: 57717, Dst Port: 53
Domain Name System (query)

No.     Time           Source                Destination           Protocol Length Info
     15 1.576562       2804:7f4:2002:1005::98 2804:7f3:8880:d51f:7583:5e92:7a66:a6dc DNS      110    Standard query response 0x20ba A www.google.com A 216.58.222.68

Frame 15: 110 bytes on wire (880 bits), 110 bytes captured (880 bits) on interface 0
Ethernet II, Src: Sagemcom_fa:f1:1e (68:15:90:fa:f1:1e), Dst: HewlettP_49:af:30 (9c:8e:99:49:af:30)
Internet Protocol Version 6, Src: 2804:7f4:2002:1005::98, Dst: 2804:7f3:8880:d51f:7583:5e92:7a66:a6dc
User Datagram Protocol, Src Port: 53, Dst Port: 61940
Domain Name System (response)

No.     Time           Source                Destination           Protocol Length Info
     16 1.576819       2804:7f3:8880:d51f:7583:5e92:7a66:a6dc 2804:7f4:2002:1005::98 DNS      94     Standard query 0x9393 AAAA www.google.com

Frame 16: 94 bytes on wire (752 bits), 94 bytes captured (752 bits) on interface 0
Ethernet II, Src: HewlettP_49:af:30 (9c:8e:99:49:af:30), Dst: Sagemcom_fa:f1:1e (68:15:90:fa:f1:1e)
Internet Protocol Version 6, Src: 2804:7f3:8880:d51f:7583:5e92:7a66:a6dc, Dst: 2804:7f4:2002:1005::98
User Datagram Protocol, Src Port: 62322, Dst Port: 53
Domain Name System (query)

No.     Time           Source                Destination           Protocol Length Info
     17 1.577287       2804:7f4:2002:1005::98 2804:7f3:8880:d51f:7583:5e92:7a66:a6dc DNS      158    Standard query response 0x6a2a A 3.bp.blogspot.com CNAME photos-ugc.l.googleusercontent.com A 172.217.29.65

Frame 17: 158 bytes on wire (1264 bits), 158 bytes captured (1264 bits) on interface 0
Ethernet II, Src: Sagemcom_fa:f1:1e (68:15:90:fa:f1:1e), Dst: HewlettP_49:af:30 (9c:8e:99:49:af:30)
Internet Protocol Version 6, Src: 2804:7f4:2002:1005::98, Dst: 2804:7f3:8880:d51f:7583:5e92:7a66:a6dc
User Datagram Protocol, Src Port: 53, Dst Port: 62981
Domain Name System (response)

No.     Time           Source                Destination           Protocol Length Info
     18 1.577769       2804:7f3:8880:d51f:7583:5e92:7a66:a6dc 2804:7f4:2002:1005::98 DNS      97     Standard query 0x2749 AAAA 3.bp.blogspot.com

Frame 18: 97 bytes on wire (776 bits), 97 bytes captured (776 bits) on interface 0
Ethernet II, Src: HewlettP_49:af:30 (9c:8e:99:49:af:30), Dst: Sagemcom_fa:f1:1e (68:15:90:fa:f1:1e)
Internet Protocol Version 6, Src: 2804:7f3:8880:d51f:7583:5e92:7a66:a6dc, Dst: 2804:7f4:2002:1005::98
User Datagram Protocol, Src Port: 54720, Dst Port: 53
Domain Name System (query)

No.     Time           Source                Destination           Protocol Length Info
     19 1.578310       2804:7f4:2002:1005::98 2804:7f3:8880:d51f:7583:5e92:7a66:a6dc DNS      164    Standard query response 0xf548 A canteiraceleste.disqus.com CNAME prod.disqus.map.fastlylb.net A 151.101.56.134

Frame 19: 164 bytes on wire (1312 bits), 164 bytes captured (1312 bits) on interface 0
Ethernet II, Src: Sagemcom_fa:f1:1e (68:15:90:fa:f1:1e), Dst: HewlettP_49:af:30 (9c:8e:99:49:af:30)
Internet Protocol Version 6, Src: 2804:7f4:2002:1005::98, Dst: 2804:7f3:8880:d51f:7583:5e92:7a66:a6dc
User Datagram Protocol, Src Port: 53, Dst Port: 61750
Domain Name System (response)

No.     Time           Source                Destination           Protocol Length Info
     20 1.578588       2804:7f4:2002:1005::98 2804:7f3:8880:d51f:7583:5e92:7a66:a6dc DNS      174    Standard query response 0x27fd AAAA ps.eyeota.net SOA ns-659.awsdns-18.net

Frame 20: 174 bytes on wire (1392 bits), 174 bytes captured (1392 bits) on interface 0
Ethernet II, Src: Sagemcom_fa:f1:1e (68:15:90:fa:f1:1e), Dst: HewlettP_49:af:30 (9c:8e:99:49:af:30)
Internet Protocol Version 6, Src: 2804:7f4:2002:1005::98, Dst: 2804:7f3:8880:d51f:7583:5e92:7a66:a6dc
User Datagram Protocol, Src Port: 53, Dst Port: 55724
Domain Name System (response)

No.     Time           Source                Destination           Protocol Length Info
     21 1.578718       2804:7f3:8880:d51f:7583:5e92:7a66:a6dc 2804:7f4:2002:1005::98 DNS      106    Standard query 0x5daa AAAA canteiraceleste.disqus.com

Frame 21: 106 bytes on wire (848 bits), 106 bytes captured (848 bits) on interface 0
Ethernet II, Src: HewlettP_49:af:30 (9c:8e:99:49:af:30), Dst: Sagemcom_fa:f1:1e (68:15:90:fa:f1:1e)
Internet Protocol Version 6, Src: 2804:7f3:8880:d51f:7583:5e92:7a66:a6dc, Dst: 2804:7f4:2002:1005::98
User Datagram Protocol, Src Port: 63022, Dst Port: 53
Domain Name System (query)

No.     Time           Source                Destination           Protocol Length Info
     22 1.582512       2804:7f4:2002:1005::98 2804:7f3:8880:d51f:7583:5e92:7a66:a6dc DNS      170    Standard query response 0x8ca6 AAAA 2.bp.blogspot.com CNAME photos-ugc.l.googleusercontent.com AAAA 2800:3f0:4004:804::2001

Frame 22: 170 bytes on wire (1360 bits), 170 bytes captured (1360 bits) on interface 0
Ethernet II, Src: Sagemcom_fa:f1:1e (68:15:90:fa:f1:1e), Dst: HewlettP_49:af:30 (9c:8e:99:49:af:30)
Internet Protocol Version 6, Src: 2804:7f4:2002:1005::98, Dst: 2804:7f3:8880:d51f:7583:5e92:7a66:a6dc
User Datagram Protocol, Src Port: 53, Dst Port: 57717
Domain Name System (response)

No.     Time           Source                Destination           Protocol Length Info
     23 1.583202       2804:7f4:2002:1005::98 2804:7f3:8880:d51f:7583:5e92:7a66:a6dc DNS      122    Standard query response 0x9393 AAAA www.google.com AAAA 2800:3f0:4004:804::2004

Frame 23: 122 bytes on wire (976 bits), 122 bytes captured (976 bits) on interface 0
Ethernet II, Src: Sagemcom_fa:f1:1e (68:15:90:fa:f1:1e), Dst: HewlettP_49:af:30 (9c:8e:99:49:af:30)
Internet Protocol Version 6, Src: 2804:7f4:2002:1005::98, Dst: 2804:7f3:8880:d51f:7583:5e92:7a66:a6dc
User Datagram Protocol, Src Port: 53, Dst Port: 62322
Domain Name System (response)

No.     Time           Source                Destination           Protocol Length Info
     24 1.584702       2804:7f4:2002:1005::98 2804:7f3:8880:d51f:7583:5e92:7a66:a6dc DNS      170    Standard query response 0x2749 AAAA 3.bp.blogspot.com CNAME photos-ugc.l.googleusercontent.com AAAA 2800:3f0:4004:804::2001

Frame 24: 170 bytes on wire (1360 bits), 170 bytes captured (1360 bits) on interface 0
Ethernet II, Src: Sagemcom_fa:f1:1e (68:15:90:fa:f1:1e), Dst: HewlettP_49:af:30 (9c:8e:99:49:af:30)
Internet Protocol Version 6, Src: 2804:7f4:2002:1005::98, Dst: 2804:7f3:8880:d51f:7583:5e92:7a66:a6dc
User Datagram Protocol, Src Port: 53, Dst Port: 54720
Domain Name System (response)

No.     Time           Source                Destination           Protocol Length Info
     25 1.585425       2804:7f4:2002:1005::98 2804:7f3:8880:d51f:7583:5e92:7a66:a6dc DNS      206    Standard query response 0x5daa AAAA canteiraceleste.disqus.com CNAME prod.disqus.map.fastlylb.net SOA ns1.fastlylb.net

Frame 25: 206 bytes on wire (1648 bits), 206 bytes captured (1648 bits) on interface 0
Ethernet II, Src: Sagemcom_fa:f1:1e (68:15:90:fa:f1:1e), Dst: HewlettP_49:af:30 (9c:8e:99:49:af:30)
Internet Protocol Version 6, Src: 2804:7f4:2002:1005::98, Dst: 2804:7f3:8880:d51f:7583:5e92:7a66:a6dc
User Datagram Protocol, Src Port: 53, Dst Port: 63022
Domain Name System (response)

No.     Time           Source                Destination           Protocol Length Info
     26 1.593018       2804:7f3:8880:d51f:7583:5e92:7a66:a6dc 2800:3f0:4004:804::2001 TCP      86     50612 → 443 [SYN] Seq=0 Win=8192 Len=0 MSS=1440 WS=4 SACK_PERM=1

Frame 26: 86 bytes on wire (688 bits), 86 bytes captured (688 bits) on interface 0
Ethernet II, Src: HewlettP_49:af:30 (9c:8e:99:49:af:30), Dst: Sagemcom_fa:f1:1e (68:15:90:fa:f1:1e)
Internet Protocol Version 6, Src: 2804:7f3:8880:d51f:7583:5e92:7a66:a6dc, Dst: 2800:3f0:4004:804::2001
Transmission Control Protocol, Src Port: 50612, Dst Port: 443, Seq: 0, Len: 0

No.     Time           Source                Destination           Protocol Length Info
     27 1.593257       2804:7f3:8880:d51f:7583:5e92:7a66:a6dc 2800:3f0:4004:804::2001 TCP      86     50613 → 443 [SYN] Seq=0 Win=8192 Len=0 MSS=1440 WS=4 SACK_PERM=1

Frame 27: 86 bytes on wire (688 bits), 86 bytes captured (688 bits) on interface 0
Ethernet II, Src: HewlettP_49:af:30 (9c:8e:99:49:af:30), Dst: Sagemcom_fa:f1:1e (68:15:90:fa:f1:1e)
Internet Protocol Version 6, Src: 2804:7f3:8880:d51f:7583:5e92:7a66:a6dc, Dst: 2800:3f0:4004:804::2001
Transmission Control Protocol, Src Port: 50613, Dst Port: 443, Seq: 0, Len: 0

No.     Time           Source                Destination           Protocol Length Info
     28 1.593564       2804:7f3:8880:d51f:7583:5e92:7a66:a6dc 2804:7f4:2002:1005::98 DNS      97     Standard query 0x5155 A 4.bp.blogspot.com

Frame 28: 97 bytes on wire (776 bits), 97 bytes captured (776 bits) on interface 0
Ethernet II, Src: HewlettP_49:af:30 (9c:8e:99:49:af:30), Dst: Sagemcom_fa:f1:1e (68:15:90:fa:f1:1e)
Internet Protocol Version 6, Src: 2804:7f3:8880:d51f:7583:5e92:7a66:a6dc, Dst: 2804:7f4:2002:1005::98
User Datagram Protocol, Src Port: 60388, Dst Port: 53
Domain Name System (query)

No.     Time           Source                Destination           Protocol Length Info
     29 1.593786       2804:7f3:8880:d51f:7583:5e92:7a66:a6dc 2800:3f0:4004:804::2001 TCP      86     50614 → 443 [SYN] Seq=0 Win=8192 Len=0 MSS=1440 WS=4 SACK_PERM=1

Frame 29: 86 bytes on wire (688 bits), 86 bytes captured (688 bits) on interface 0
Ethernet II, Src: HewlettP_49:af:30 (9c:8e:99:49:af:30), Dst: Sagemcom_fa:f1:1e (68:15:90:fa:f1:1e)
Internet Protocol Version 6, Src: 2804:7f3:8880:d51f:7583:5e92:7a66:a6dc, Dst: 2800:3f0:4004:804::2001
Transmission Control Protocol, Src Port: 50614, Dst Port: 443, Seq: 0, Len: 0

No.     Time           Source                Destination           Protocol Length Info
     30 1.593997       2804:7f3:8880:d51f:7583:5e92:7a66:a6dc 2800:3f0:4004:804::2001 TCP      86     50615 → 443 [SYN] Seq=0 Win=8192 Len=0 MSS=1440 WS=4 SACK_PERM=1

Frame 30: 86 bytes on wire (688 bits), 86 bytes captured (688 bits) on interface 0
Ethernet II, Src: HewlettP_49:af:30 (9c:8e:99:49:af:30), Dst: Sagemcom_fa:f1:1e (68:15:90:fa:f1:1e)
Internet Protocol Version 6, Src: 2804:7f3:8880:d51f:7583:5e92:7a66:a6dc, Dst: 2800:3f0:4004:804::2001
Transmission Control Protocol, Src Port: 50615, Dst Port: 443, Seq: 0, Len: 0

No.     Time           Source                Destination           Protocol Length Info
     31 1.594211       2804:7f3:8880:d51f:7583:5e92:7a66:a6dc 2800:3f0:4004:804::2001 TCP      86     50616 → 443 [SYN] Seq=0 Win=8192 Len=0 MSS=1440 WS=4 SACK_PERM=1

Frame 31: 86 bytes on wire (688 bits), 86 bytes captured (688 bits) on interface 0
Ethernet II, Src: HewlettP_49:af:30 (9c:8e:99:49:af:30), Dst: Sagemcom_fa:f1:1e (68:15:90:fa:f1:1e)
Internet Protocol Version 6, Src: 2804:7f3:8880:d51f:7583:5e92:7a66:a6dc, Dst: 2800:3f0:4004:804::2001
Transmission Control Protocol, Src Port: 50616, Dst Port: 443, Seq: 0, Len: 0

No.     Time           Source                Destination           Protocol Length Info
     32 1.594417       2804:7f3:8880:d51f:7583:5e92:7a66:a6dc 2800:3f0:4004:804::2001 TCP      86     50617 → 443 [SYN] Seq=0 Win=8192 Len=0 MSS=1440 WS=4 SACK_PERM=1

Frame 32: 86 bytes on wire (688 bits), 86 bytes captured (688 bits) on interface 0
Ethernet II, Src: HewlettP_49:af:30 (9c:8e:99:49:af:30), Dst: Sagemcom_fa:f1:1e (68:15:90:fa:f1:1e)
Internet Protocol Version 6, Src: 2804:7f3:8880:d51f:7583:5e92:7a66:a6dc, Dst: 2800:3f0:4004:804::2001
Transmission Control Protocol, Src Port: 50617, Dst Port: 443, Seq: 0, Len: 0

No.     Time           Source                Destination           Protocol Length Info
     33 1.594969       2804:7f3:8880:d51f:7583:5e92:7a66:a6dc 2800:3f0:4004:804::2004 TCP      86     50618 → 443 [SYN] Seq=0 Win=8192 Len=0 MSS=1440 WS=4 SACK_PERM=1

Frame 33: 86 bytes on wire (688 bits), 86 bytes captured (688 bits) on interface 0
Ethernet II, Src: HewlettP_49:af:30 (9c:8e:99:49:af:30), Dst: Sagemcom_fa:f1:1e (68:15:90:fa:f1:1e)
Internet Protocol Version 6, Src: 2804:7f3:8880:d51f:7583:5e92:7a66:a6dc, Dst: 2800:3f0:4004:804::2004
Transmission Control Protocol, Src Port: 50618, Dst Port: 443, Seq: 0, Len: 0

No.     Time           Source                Destination           Protocol Length Info
     34 1.595020       2804:7f3:8880:d51f:7583:5e92:7a66:a6dc 2804:7f4:2002:1005::98 DNS      109    Standard query 0x891e A n-cdn-origin.areyouahuman.com

Frame 34: 109 bytes on wire (872 bits), 109 bytes captured (872 bits) on interface 0
Ethernet II, Src: HewlettP_49:af:30 (9c:8e:99:49:af:30), Dst: Sagemcom_fa:f1:1e (68:15:90:fa:f1:1e)
Internet Protocol Version 6, Src: 2804:7f3:8880:d51f:7583:5e92:7a66:a6dc, Dst: 2804:7f4:2002:1005::98
User Datagram Protocol, Src Port: 53052, Dst Port: 53
Domain Name System (query)

No.     Time           Source                Destination           Protocol Length Info
     35 1.595310       2804:7f3:8880:d51f:7583:5e92:7a66:a6dc 2800:3f0:4004:804::2001 TCP      86     50619 → 443 [SYN] Seq=0 Win=8192 Len=0 MSS=1440 WS=4 SACK_PERM=1

Frame 35: 86 bytes on wire (688 bits), 86 bytes captured (688 bits) on interface 0
Ethernet II, Src: HewlettP_49:af:30 (9c:8e:99:49:af:30), Dst: Sagemcom_fa:f1:1e (68:15:90:fa:f1:1e)
Internet Protocol Version 6, Src: 2804:7f3:8880:d51f:7583:5e92:7a66:a6dc, Dst: 2800:3f0:4004:804::2001
Transmission Control Protocol, Src Port: 50619, Dst Port: 443, Seq: 0, Len: 0

No.     Time           Source                Destination           Protocol Length Info
     36 1.595522       2804:7f3:8880:d51f:7583:5e92:7a66:a6dc 2800:3f0:4004:804::2001 TCP      86     50620 → 443 [SYN] Seq=0 Win=8192 Len=0 MSS=1440 WS=4 SACK_PERM=1

Frame 36: 86 bytes on wire (688 bits), 86 bytes captured (688 bits) on interface 0
Ethernet II, Src: HewlettP_49:af:30 (9c:8e:99:49:af:30), Dst: Sagemcom_fa:f1:1e (68:15:90:fa:f1:1e)
Internet Protocol Version 6, Src: 2804:7f3:8880:d51f:7583:5e92:7a66:a6dc, Dst: 2800:3f0:4004:804::2001
Transmission Control Protocol, Src Port: 50620, Dst Port: 443, Seq: 0, Len: 0

No.     Time           Source                Destination           Protocol Length Info
     37 1.595689       2804:7f3:8880:d51f:7583:5e92:7a66:a6dc 2804:7f4:2002:1005::98 DNS      104    Standard query 0xee8f A translate.googleapis.com

Frame 37: 104 bytes on wire (832 bits), 104 bytes captured (832 bits) on interface 0
Ethernet II, Src: HewlettP_49:af:30 (9c:8e:99:49:af:30), Dst: Sagemcom_fa:f1:1e (68:15:90:fa:f1:1e)
Internet Protocol Version 6, Src: 2804:7f3:8880:d51f:7583:5e92:7a66:a6dc, Dst: 2804:7f4:2002:1005::98
User Datagram Protocol, Src Port: 62886, Dst Port: 53
Domain Name System (query)

No.     Time           Source                Destination           Protocol Length Info
     38 1.595713       2804:7f3:8880:d51f:7583:5e92:7a66:a6dc 2800:3f0:4004:804::2001 TCP      86     50621 → 443 [SYN] Seq=0 Win=8192 Len=0 MSS=1440 WS=4 SACK_PERM=1

Frame 38: 86 bytes on wire (688 bits), 86 bytes captured (688 bits) on interface 0
Ethernet II, Src: HewlettP_49:af:30 (9c:8e:99:49:af:30), Dst: Sagemcom_fa:f1:1e (68:15:90:fa:f1:1e)
Internet Protocol Version 6, Src: 2804:7f3:8880:d51f:7583:5e92:7a66:a6dc, Dst: 2800:3f0:4004:804::2001
Transmission Control Protocol, Src Port: 50621, Dst Port: 443, Seq: 0, Len: 0

No.     Time           Source                Destination           Protocol Length Info
     39 1.595907       2804:7f3:8880:d51f:7583:5e92:7a66:a6dc 2800:3f0:4004:804::2001 TCP      86     50622 → 443 [SYN] Seq=0 Win=8192 Len=0 MSS=1440 WS=4 SACK_PERM=1

Frame 39: 86 bytes on wire (688 bits), 86 bytes captured (688 bits) on interface 0
Ethernet II, Src: HewlettP_49:af:30 (9c:8e:99:49:af:30), Dst: Sagemcom_fa:f1:1e (68:15:90:fa:f1:1e)
Internet Protocol Version 6, Src: 2804:7f3:8880:d51f:7583:5e92:7a66:a6dc, Dst: 2800:3f0:4004:804::2001
Transmission Control Protocol, Src Port: 50622, Dst Port: 443, Seq: 0, Len: 0

No.     Time           Source                Destination           Protocol Length Info
     40 1.596139       2804:7f3:8880:d51f:7583:5e92:7a66:a6dc 2800:3f0:4004:804::2001 TCP      86     50623 → 443 [SYN] Seq=0 Win=8192 Len=0 MSS=1440 WS=4 SACK_PERM=1

Frame 40: 86 bytes on wire (688 bits), 86 bytes captured (688 bits) on interface 0
Ethernet II, Src: HewlettP_49:af:30 (9c:8e:99:49:af:30), Dst: Sagemcom_fa:f1:1e (68:15:90:fa:f1:1e)
Internet Protocol Version 6, Src: 2804:7f3:8880:d51f:7583:5e92:7a66:a6dc, Dst: 2800:3f0:4004:804::2001
Transmission Control Protocol, Src Port: 50623, Dst Port: 443, Seq: 0, Len: 0

No.     Time           Source                Destination           Protocol Length Info
     41 1.596377       2804:7f3:8880:d51f:7583:5e92:7a66:a6dc 2800:3f0:4004:804::2001 TCP      86     50624 → 443 [SYN] Seq=0 Win=8192 Len=0 MSS=1440 WS=4 SACK_PERM=1

Frame 41: 86 bytes on wire (688 bits), 86 bytes captured (688 bits) on interface 0
Ethernet II, Src: HewlettP_49:af:30 (9c:8e:99:49:af:30), Dst: Sagemcom_fa:f1:1e (68:15:90:fa:f1:1e)
Internet Protocol Version 6, Src: 2804:7f3:8880:d51f:7583:5e92:7a66:a6dc, Dst: 2800:3f0:4004:804::2001
Transmission Control Protocol, Src Port: 50624, Dst Port: 443, Seq: 0, Len: 0

No.     Time           Source                Destination           Protocol Length Info
     42 1.596698       192.168.25.233        151.101.56.134        TCP      66     50625 → 80 [SYN] Seq=0 Win=8192 Len=0 MSS=1460 WS=4 SACK_PERM=1

Frame 42: 66 bytes on wire (528 bits), 66 bytes captured (528 bits) on interface 0
Ethernet II, Src: HewlettP_49:af:30 (9c:8e:99:49:af:30), Dst: Sagemcom_fa:f1:1e (68:15:90:fa:f1:1e)
Internet Protocol Version 4, Src: 192.168.25.233, Dst: 151.101.56.134
Transmission Control Protocol, Src Port: 50625, Dst Port: 80, Seq: 0, Len: 0

No.     Time           Source                Destination           Protocol Length Info
     43 1.596914       192.168.25.233        151.101.56.134        TCP      66     50626 → 80 [SYN] Seq=0 Win=8192 Len=0 MSS=1460 WS=4 SACK_PERM=1

Frame 43: 66 bytes on wire (528 bits), 66 bytes captured (528 bits) on interface 0
Ethernet II, Src: HewlettP_49:af:30 (9c:8e:99:49:af:30), Dst: Sagemcom_fa:f1:1e (68:15:90:fa:f1:1e)
Internet Protocol Version 4, Src: 192.168.25.233, Dst: 151.101.56.134
Transmission Control Protocol, Src Port: 50626, Dst Port: 80, Seq: 0, Len: 0

No.     Time           Source                Destination           Protocol Length Info
     44 1.597136       192.168.25.233        151.101.56.134        TCP      66     50627 → 80 [SYN] Seq=0 Win=8192 Len=0 MSS=1460 WS=4 SACK_PERM=1

Frame 44: 66 bytes on wire (528 bits), 66 bytes captured (528 bits) on interface 0
Ethernet II, Src: HewlettP_49:af:30 (9c:8e:99:49:af:30), Dst: Sagemcom_fa:f1:1e (68:15:90:fa:f1:1e)
Internet Protocol Version 4, Src: 192.168.25.233, Dst: 151.101.56.134
Transmission Control Protocol, Src Port: 50627, Dst Port: 80, Seq: 0, Len: 0

No.     Time           Source                Destination           Protocol Length Info
     45 1.597275       2804:7f3:8880:d51f:7583:5e92:7a66:a6dc 2804:7f4:2002:1005::98 DNS      95     Standard query 0x9b10 A www.gstatic.com

Frame 45: 95 bytes on wire (760 bits), 95 bytes captured (760 bits) on interface 0
Ethernet II, Src: HewlettP_49:af:30 (9c:8e:99:49:af:30), Dst: Sagemcom_fa:f1:1e (68:15:90:fa:f1:1e)
Internet Protocol Version 6, Src: 2804:7f3:8880:d51f:7583:5e92:7a66:a6dc, Dst: 2804:7f4:2002:1005::98
User Datagram Protocol, Src Port: 51960, Dst Port: 53
Domain Name System (query)

No.     Time           Source                Destination           Protocol Length Info
     46 1.597322       192.168.25.233        151.101.56.134        TCP      66     50628 → 80 [SYN] Seq=0 Win=8192 Len=0 MSS=1460 WS=4 SACK_PERM=1

Frame 46: 66 bytes on wire (528 bits), 66 bytes captured (528 bits) on interface 0
Ethernet II, Src: HewlettP_49:af:30 (9c:8e:99:49:af:30), Dst: Sagemcom_fa:f1:1e (68:15:90:fa:f1:1e)
Internet Protocol Version 4, Src: 192.168.25.233, Dst: 151.101.56.134
Transmission Control Protocol, Src Port: 50628, Dst Port: 80, Seq: 0, Len: 0

No.     Time           Source                Destination           Protocol Length Info
     47 1.599631       192.168.25.233        54.161.197.102        TCP      66     50629 → 80 [SYN] Seq=0 Win=8192 Len=0 MSS=1460 WS=4 SACK_PERM=1

Frame 47: 66 bytes on wire (528 bits), 66 bytes captured (528 bits) on interface 0
Ethernet II, Src: HewlettP_49:af:30 (9c:8e:99:49:af:30), Dst: Sagemcom_fa:f1:1e (68:15:90:fa:f1:1e)
Internet Protocol Version 4, Src: 192.168.25.233, Dst: 54.161.197.102
Transmission Control Protocol, Src Port: 50629, Dst Port: 80, Seq: 0, Len: 0

No.     Time           Source                Destination           Protocol Length Info
     48 1.599731       2804:7f3:8880:d51f:7583:5e92:7a66:a6dc 2804:7f4:2002:1005::98 DNS      92     Standard query 0xd1e2 A redes.unb.br

Frame 48: 92 bytes on wire (736 bits), 92 bytes captured (736 bits) on interface 0
Ethernet II, Src: HewlettP_49:af:30 (9c:8e:99:49:af:30), Dst: Sagemcom_fa:f1:1e (68:15:90:fa:f1:1e)
Internet Protocol Version 6, Src: 2804:7f3:8880:d51f:7583:5e92:7a66:a6dc, Dst: 2804:7f4:2002:1005::98
User Datagram Protocol, Src Port: 57371, Dst Port: 53
Domain Name System (query)

No.     Time           Source                Destination           Protocol Length Info
     49 1.600007       192.168.25.233        54.161.197.102        TCP      66     50630 → 80 [SYN] Seq=0 Win=8192 Len=0 MSS=1460 WS=4 SACK_PERM=1

Frame 49: 66 bytes on wire (528 bits), 66 bytes captured (528 bits) on interface 0
Ethernet II, Src: HewlettP_49:af:30 (9c:8e:99:49:af:30), Dst: Sagemcom_fa:f1:1e (68:15:90:fa:f1:1e)
Internet Protocol Version 4, Src: 192.168.25.233, Dst: 54.161.197.102
Transmission Control Protocol, Src Port: 50630, Dst Port: 80, Seq: 0, Len: 0

No.     Time           Source                Destination           Protocol Length Info
     50 1.600237       192.168.25.233        54.161.197.102        TCP      66     50631 → 80 [SYN] Seq=0 Win=8192 Len=0 MSS=1460 WS=4 SACK_PERM=1

Frame 50: 66 bytes on wire (528 bits), 66 bytes captured (528 bits) on interface 0
Ethernet II, Src: HewlettP_49:af:30 (9c:8e:99:49:af:30), Dst: Sagemcom_fa:f1:1e (68:15:90:fa:f1:1e)
Internet Protocol Version 4, Src: 192.168.25.233, Dst: 54.161.197.102
Transmission Control Protocol, Src Port: 50631, Dst Port: 80, Seq: 0, Len: 0

No.     Time           Source                Destination           Protocol Length Info
     51 1.602489       2804:7f4:2002:1005::98 2804:7f3:8880:d51f:7583:5e92:7a66:a6dc DNS      158    Standard query response 0x5155 A 4.bp.blogspot.com CNAME photos-ugc.l.googleusercontent.com A 172.217.29.65

Frame 51: 158 bytes on wire (1264 bits), 158 bytes captured (1264 bits) on interface 0
Ethernet II, Src: Sagemcom_fa:f1:1e (68:15:90:fa:f1:1e), Dst: HewlettP_49:af:30 (9c:8e:99:49:af:30)
Internet Protocol Version 6, Src: 2804:7f4:2002:1005::98, Dst: 2804:7f3:8880:d51f:7583:5e92:7a66:a6dc
User Datagram Protocol, Src Port: 53, Dst Port: 60388
Domain Name System (response)

No.     Time           Source                Destination           Protocol Length Info
     52 1.603083       2804:7f3:8880:d51f:7583:5e92:7a66:a6dc 2804:7f4:2002:1005::98 DNS      97     Standard query 0x4192 AAAA 4.bp.blogspot.com

Frame 52: 97 bytes on wire (776 bits), 97 bytes captured (776 bits) on interface 0
Ethernet II, Src: HewlettP_49:af:30 (9c:8e:99:49:af:30), Dst: Sagemcom_fa:f1:1e (68:15:90:fa:f1:1e)
Internet Protocol Version 6, Src: 2804:7f3:8880:d51f:7583:5e92:7a66:a6dc, Dst: 2804:7f4:2002:1005::98
User Datagram Protocol, Src Port: 53429, Dst Port: 53
Domain Name System (query)

No.     Time           Source                Destination           Protocol Length Info
     53 1.609123       2804:7f4:2002:1005::98 2804:7f3:8880:d51f:7583:5e92:7a66:a6dc DNS      237    Standard query response 0x891e A n-cdn-origin.areyouahuman.com A 52.20.182.36 A 52.203.77.168 A 52.21.74.121 A 52.207.111.23 A 52.204.40.126 A 52.205.83.136 A 52.201.138.250 A 52.21.216.12

Frame 53: 237 bytes on wire (1896 bits), 237 bytes captured (1896 bits) on interface 0
Ethernet II, Src: Sagemcom_fa:f1:1e (68:15:90:fa:f1:1e), Dst: HewlettP_49:af:30 (9c:8e:99:49:af:30)
Internet Protocol Version 6, Src: 2804:7f4:2002:1005::98, Dst: 2804:7f3:8880:d51f:7583:5e92:7a66:a6dc
User Datagram Protocol, Src Port: 53, Dst Port: 53052
Domain Name System (response)

No.     Time           Source                Destination           Protocol Length Info
     54 1.609970       2804:7f3:8880:d51f:7583:5e92:7a66:a6dc 2804:7f4:2002:1005::98 DNS      109    Standard query 0x6909 AAAA n-cdn-origin.areyouahuman.com

Frame 54: 109 bytes on wire (872 bits), 109 bytes captured (872 bits) on interface 0
Ethernet II, Src: HewlettP_49:af:30 (9c:8e:99:49:af:30), Dst: Sagemcom_fa:f1:1e (68:15:90:fa:f1:1e)
Internet Protocol Version 6, Src: 2804:7f3:8880:d51f:7583:5e92:7a66:a6dc, Dst: 2804:7f4:2002:1005::98
User Datagram Protocol, Src Port: 62581, Dst Port: 53
Domain Name System (query)

No.     Time           Source                Destination           Protocol Length Info
     55 1.613775       2804:7f4:2002:1005::98 2804:7f3:8880:d51f:7583:5e92:7a66:a6dc DNS      120    Standard query response 0xee8f A translate.googleapis.com A 216.58.222.74

Frame 55: 120 bytes on wire (960 bits), 120 bytes captured (960 bits) on interface 0
Ethernet II, Src: Sagemcom_fa:f1:1e (68:15:90:fa:f1:1e), Dst: HewlettP_49:af:30 (9c:8e:99:49:af:30)
Internet Protocol Version 6, Src: 2804:7f4:2002:1005::98, Dst: 2804:7f3:8880:d51f:7583:5e92:7a66:a6dc
User Datagram Protocol, Src Port: 53, Dst Port: 62886
Domain Name System (response)

No.     Time           Source                Destination           Protocol Length Info
     56 1.614730       2804:7f3:8880:d51f:7583:5e92:7a66:a6dc 2804:7f4:2002:1005::98 DNS      104    Standard query 0x4bf1 AAAA translate.googleapis.com

Frame 56: 104 bytes on wire (832 bits), 104 bytes captured (832 bits) on interface 0
Ethernet II, Src: HewlettP_49:af:30 (9c:8e:99:49:af:30), Dst: Sagemcom_fa:f1:1e (68:15:90:fa:f1:1e)
Internet Protocol Version 6, Src: 2804:7f3:8880:d51f:7583:5e92:7a66:a6dc, Dst: 2804:7f4:2002:1005::98
User Datagram Protocol, Src Port: 60435, Dst Port: 53
Domain Name System (query)

No.     Time           Source                Destination           Protocol Length Info
     57 1.617995       2804:7f4:2002:1005::98 2804:7f3:8880:d51f:7583:5e92:7a66:a6dc DNS      111    Standard query response 0x9b10 A www.gstatic.com A 216.58.222.67

Frame 57: 111 bytes on wire (888 bits), 111 bytes captured (888 bits) on interface 0
Ethernet II, Src: Sagemcom_fa:f1:1e (68:15:90:fa:f1:1e), Dst: HewlettP_49:af:30 (9c:8e:99:49:af:30)
Internet Protocol Version 6, Src: 2804:7f4:2002:1005::98, Dst: 2804:7f3:8880:d51f:7583:5e92:7a66:a6dc
User Datagram Protocol, Src Port: 53, Dst Port: 51960
Domain Name System (response)

No.     Time           Source                Destination           Protocol Length Info
     58 1.618568       2804:7f3:8880:d51f:7583:5e92:7a66:a6dc 2804:7f4:2002:1005::98 DNS      95     Standard query 0x0be7 AAAA www.gstatic.com

Frame 58: 95 bytes on wire (760 bits), 95 bytes captured (760 bits) on interface 0
Ethernet II, Src: HewlettP_49:af:30 (9c:8e:99:49:af:30), Dst: Sagemcom_fa:f1:1e (68:15:90:fa:f1:1e)
Internet Protocol Version 6, Src: 2804:7f3:8880:d51f:7583:5e92:7a66:a6dc, Dst: 2804:7f4:2002:1005::98
User Datagram Protocol, Src Port: 64141, Dst Port: 53
Domain Name System (query)

No.     Time           Source                Destination           Protocol Length Info
     59 1.619695       2800:3f0:4004:804::2001 2804:7f3:8880:d51f:7583:5e92:7a66:a6dc TCP      86     443 → 50613 [SYN, ACK] Seq=0 Ack=1 Win=27200 Len=0 MSS=1360 SACK_PERM=1 WS=128

Frame 59: 86 bytes on wire (688 bits), 86 bytes captured (688 bits) on interface 0
Ethernet II, Src: Sagemcom_fa:f1:1e (68:15:90:fa:f1:1e), Dst: HewlettP_49:af:30 (9c:8e:99:49:af:30)
Internet Protocol Version 6, Src: 2800:3f0:4004:804::2001, Dst: 2804:7f3:8880:d51f:7583:5e92:7a66:a6dc
Transmission Control Protocol, Src Port: 443, Dst Port: 50613, Seq: 0, Ack: 1, Len: 0

No.     Time           Source                Destination           Protocol Length Info
     60 1.619823       2804:7f3:8880:d51f:7583:5e92:7a66:a6dc 2800:3f0:4004:804::2001 TCP      74     50613 → 443 [ACK] Seq=1 Ack=1 Win=66640 Len=0

Frame 60: 74 bytes on wire (592 bits), 74 bytes captured (592 bits) on interface 0
Ethernet II, Src: HewlettP_49:af:30 (9c:8e:99:49:af:30), Dst: Sagemcom_fa:f1:1e (68:15:90:fa:f1:1e)
Internet Protocol Version 6, Src: 2804:7f3:8880:d51f:7583:5e92:7a66:a6dc, Dst: 2800:3f0:4004:804::2001
Transmission Control Protocol, Src Port: 50613, Dst Port: 443, Seq: 1, Ack: 1, Len: 0

No.     Time           Source                Destination           Protocol Length Info
     61 1.620209       2804:7f3:8880:d51f:7583:5e92:7a66:a6dc 2800:3f0:4004:804::2001 TLSv1.2  279    Client Hello

Frame 61: 279 bytes on wire (2232 bits), 279 bytes captured (2232 bits) on interface 0
Ethernet II, Src: HewlettP_49:af:30 (9c:8e:99:49:af:30), Dst: Sagemcom_fa:f1:1e (68:15:90:fa:f1:1e)
Internet Protocol Version 6, Src: 2804:7f3:8880:d51f:7583:5e92:7a66:a6dc, Dst: 2800:3f0:4004:804::2001
Transmission Control Protocol, Src Port: 50613, Dst Port: 443, Seq: 1, Ack: 1, Len: 205
Secure Sockets Layer

No.     Time           Source                Destination           Protocol Length Info
     62 1.621654       2800:3f0:4004:804::2001 2804:7f3:8880:d51f:7583:5e92:7a66:a6dc TCP      86     443 → 50614 [SYN, ACK] Seq=0 Ack=1 Win=27200 Len=0 MSS=1360 SACK_PERM=1 WS=128

Frame 62: 86 bytes on wire (688 bits), 86 bytes captured (688 bits) on interface 0
Ethernet II, Src: Sagemcom_fa:f1:1e (68:15:90:fa:f1:1e), Dst: HewlettP_49:af:30 (9c:8e:99:49:af:30)
Internet Protocol Version 6, Src: 2800:3f0:4004:804::2001, Dst: 2804:7f3:8880:d51f:7583:5e92:7a66:a6dc
Transmission Control Protocol, Src Port: 443, Dst Port: 50614, Seq: 0, Ack: 1, Len: 0

No.     Time           Source                Destination           Protocol Length Info
     63 1.621774       2804:7f3:8880:d51f:7583:5e92:7a66:a6dc 2800:3f0:4004:804::2001 TCP      74     50614 → 443 [ACK] Seq=1 Ack=1 Win=66640 Len=0

Frame 63: 74 bytes on wire (592 bits), 74 bytes captured (592 bits) on interface 0
Ethernet II, Src: HewlettP_49:af:30 (9c:8e:99:49:af:30), Dst: Sagemcom_fa:f1:1e (68:15:90:fa:f1:1e)
Internet Protocol Version 6, Src: 2804:7f3:8880:d51f:7583:5e92:7a66:a6dc, Dst: 2800:3f0:4004:804::2001
Transmission Control Protocol, Src Port: 50614, Dst Port: 443, Seq: 1, Ack: 1, Len: 0

No.     Time           Source                Destination           Protocol Length Info
     64 1.622387       2804:7f4:2002:1005::98 2804:7f3:8880:d51f:7583:5e92:7a66:a6dc DNS      170    Standard query response 0x4192 AAAA 4.bp.blogspot.com CNAME photos-ugc.l.googleusercontent.com AAAA 2800:3f0:4004:804::2001

Frame 64: 170 bytes on wire (1360 bits), 170 bytes captured (1360 bits) on interface 0
Ethernet II, Src: Sagemcom_fa:f1:1e (68:15:90:fa:f1:1e), Dst: HewlettP_49:af:30 (9c:8e:99:49:af:30)
