No.     Time           Source                Destination           Protocol Length Info
      1 0.000000       172.31.197.245        104.244.42.1          TLSv1.2  251    Application Data

Frame 1: 251 bytes on wire (2008 bits), 251 bytes captured (2008 bits) on interface 0
Ethernet II, Src: Tp-LinkT_ec:75:a2 (00:25:86:ec:75:a2), Dst: ArubaNet_02:38:10 (00:1a:1e:02:38:10)
Internet Protocol Version 4, Src: 172.31.197.245, Dst: 104.244.42.1
Transmission Control Protocol, Src Port: 54883, Dst Port: 443, Seq: 1, Ack: 1, Len: 197
Secure Sockets Layer

No.     Time           Source                Destination           Protocol Length Info
      2 0.121527       104.244.42.1          172.31.197.245        TCP      60     443 → 54883 [ACK] Seq=1 Ack=198 Win=683 Len=0

Frame 2: 60 bytes on wire (480 bits), 60 bytes captured (480 bits) on interface 0
Ethernet II, Src: ArubaNet_02:38:10 (00:1a:1e:02:38:10), Dst: Tp-LinkT_ec:75:a2 (00:25:86:ec:75:a2)
Internet Protocol Version 4, Src: 104.244.42.1, Dst: 172.31.197.245
Transmission Control Protocol, Src Port: 443, Dst Port: 54883, Seq: 1, Ack: 198, Len: 0

No.     Time           Source                Destination           Protocol Length Info
      3 0.295160       104.244.42.1          172.31.197.245        TLSv1.2  728    Application Data

Frame 3: 728 bytes on wire (5824 bits), 728 bytes captured (5824 bits) on interface 0
Ethernet II, Src: ArubaNet_02:38:10 (00:1a:1e:02:38:10), Dst: Tp-LinkT_ec:75:a2 (00:25:86:ec:75:a2)
Internet Protocol Version 4, Src: 104.244.42.1, Dst: 172.31.197.245
Transmission Control Protocol, Src Port: 443, Dst Port: 54883, Seq: 1, Ack: 198, Len: 674
Secure Sockets Layer

No.     Time           Source                Destination           Protocol Length Info
      4 0.295440       104.244.42.1          172.31.197.245        TLSv1.2  306    Application Data

Frame 4: 306 bytes on wire (2448 bits), 306 bytes captured (2448 bits) on interface 0
Ethernet II, Src: ArubaNet_02:38:10 (00:1a:1e:02:38:10), Dst: Tp-LinkT_ec:75:a2 (00:25:86:ec:75:a2)
Internet Protocol Version 4, Src: 104.244.42.1, Dst: 172.31.197.245
Transmission Control Protocol, Src Port: 443, Dst Port: 54883, Seq: 675, Ack: 198, Len: 252
Secure Sockets Layer

No.     Time           Source                Destination           Protocol Length Info
      5 0.295554       172.31.197.245        104.244.42.1          TCP      54     54883 → 443 [ACK] Seq=198 Ack=927 Win=269 Len=0

Frame 5: 54 bytes on wire (432 bits), 54 bytes captured (432 bits) on interface 0
Ethernet II, Src: Tp-LinkT_ec:75:a2 (00:25:86:ec:75:a2), Dst: ArubaNet_02:38:10 (00:1a:1e:02:38:10)
Internet Protocol Version 4, Src: 172.31.197.245, Dst: 104.244.42.1
Transmission Control Protocol, Src Port: 54883, Dst Port: 443, Seq: 198, Ack: 927, Len: 0

No.     Time           Source                Destination           Protocol Length Info
      6 0.295893       104.244.42.1          172.31.197.245        TLSv1.2  102    Application Data

Frame 6: 102 bytes on wire (816 bits), 102 bytes captured (816 bits) on interface 0
Ethernet II, Src: ArubaNet_02:38:10 (00:1a:1e:02:38:10), Dst: Tp-LinkT_ec:75:a2 (00:25:86:ec:75:a2)
Internet Protocol Version 4, Src: 104.244.42.1, Dst: 172.31.197.245
Transmission Control Protocol, Src Port: 443, Dst Port: 54883, Seq: 927, Ack: 198, Len: 48
Secure Sockets Layer

No.     Time           Source                Destination           Protocol Length Info
      7 0.296197       104.244.42.1          172.31.197.245        TLSv1.2  92     Application Data

Frame 7: 92 bytes on wire (736 bits), 92 bytes captured (736 bits) on interface 0
Ethernet II, Src: ArubaNet_02:38:10 (00:1a:1e:02:38:10), Dst: Tp-LinkT_ec:75:a2 (00:25:86:ec:75:a2)
Internet Protocol Version 4, Src: 104.244.42.1, Dst: 172.31.197.245
Transmission Control Protocol, Src Port: 443, Dst Port: 54883, Seq: 975, Ack: 198, Len: 38
Secure Sockets Layer

No.     Time           Source                Destination           Protocol Length Info
      8 0.296261       172.31.197.245        104.244.42.1          TCP      54     54883 → 443 [ACK] Seq=198 Ack=1013 Win=269 Len=0

Frame 8: 54 bytes on wire (432 bits), 54 bytes captured (432 bits) on interface 0
Ethernet II, Src: Tp-LinkT_ec:75:a2 (00:25:86:ec:75:a2), Dst: ArubaNet_02:38:10 (00:1a:1e:02:38:10)
Internet Protocol Version 4, Src: 172.31.197.245, Dst: 104.244.42.1
Transmission Control Protocol, Src Port: 54883, Dst Port: 443, Seq: 198, Ack: 1013, Len: 0

No.     Time           Source                Destination           Protocol Length Info
      9 8.960132       172.31.197.245        164.41.101.11         DNS      83     Standard query 0xa24f A safebrowsing.google.com

Frame 9: 83 bytes on wire (664 bits), 83 bytes captured (664 bits) on interface 0
Ethernet II, Src: Tp-LinkT_ec:75:a2 (00:25:86:ec:75:a2), Dst: ArubaNet_02:38:10 (00:1a:1e:02:38:10)
Internet Protocol Version 4, Src: 172.31.197.245, Dst: 164.41.101.11
User Datagram Protocol, Src Port: 49236, Dst Port: 53
Domain Name System (query)

No.     Time           Source                Destination           Protocol Length Info
     10 9.029432       164.41.101.11         172.31.197.245        DNS      118    Standard query response 0xa24f A safebrowsing.google.com CNAME sb.l.google.com A 172.217.29.46

Frame 10: 118 bytes on wire (944 bits), 118 bytes captured (944 bits) on interface 0
Ethernet II, Src: ArubaNet_02:38:10 (00:1a:1e:02:38:10), Dst: Tp-LinkT_ec:75:a2 (00:25:86:ec:75:a2)
Internet Protocol Version 4, Src: 164.41.101.11, Dst: 172.31.197.245
User Datagram Protocol, Src Port: 53, Dst Port: 49236
Domain Name System (response)

No.     Time           Source                Destination           Protocol Length Info
     11 9.030299       172.31.197.245        172.217.29.46         TCP      66     54921 → 443 [SYN] Seq=0 Win=8192 Len=0 MSS=1460 WS=4 SACK_PERM=1

Frame 11: 66 bytes on wire (528 bits), 66 bytes captured (528 bits) on interface 0
Ethernet II, Src: Tp-LinkT_ec:75:a2 (00:25:86:ec:75:a2), Dst: ArubaNet_02:38:10 (00:1a:1e:02:38:10)
Internet Protocol Version 4, Src: 172.31.197.245, Dst: 172.217.29.46
Transmission Control Protocol, Src Port: 54921, Dst Port: 443, Seq: 0, Len: 0

No.     Time           Source                Destination           Protocol Length Info
     12 9.195165       172.217.29.46         172.31.197.245        TCP      66     443 → 54921 [SYN, ACK] Seq=0 Ack=1 Win=42780 Len=0 MSS=1380 SACK_PERM=1 WS=128

Frame 12: 66 bytes on wire (528 bits), 66 bytes captured (528 bits) on interface 0
Ethernet II, Src: ArubaNet_02:38:10 (00:1a:1e:02:38:10), Dst: Tp-LinkT_ec:75:a2 (00:25:86:ec:75:a2)
Internet Protocol Version 4, Src: 172.217.29.46, Dst: 172.31.197.245
Transmission Control Protocol, Src Port: 443, Dst Port: 54921, Seq: 0, Ack: 1, Len: 0

No.     Time           Source                Destination           Protocol Length Info
     13 9.195292       172.31.197.245        172.217.29.46         TCP      54     54921 → 443 [ACK] Seq=1 Ack=1 Win=16560 Len=0

Frame 13: 54 bytes on wire (432 bits), 54 bytes captured (432 bits) on interface 0
Ethernet II, Src: Tp-LinkT_ec:75:a2 (00:25:86:ec:75:a2), Dst: ArubaNet_02:38:10 (00:1a:1e:02:38:10)
Internet Protocol Version 4, Src: 172.31.197.245, Dst: 172.217.29.46
Transmission Control Protocol, Src Port: 54921, Dst Port: 443, Seq: 1, Ack: 1, Len: 0

No.     Time           Source                Destination           Protocol Length Info
     14 9.195971       172.31.197.245        172.217.29.46         TLSv1.2  571    Client Hello

Frame 14: 571 bytes on wire (4568 bits), 571 bytes captured (4568 bits) on interface 0
Ethernet II, Src: Tp-LinkT_ec:75:a2 (00:25:86:ec:75:a2), Dst: ArubaNet_02:38:10 (00:1a:1e:02:38:10)
Internet Protocol Version 4, Src: 172.31.197.245, Dst: 172.217.29.46
Transmission Control Protocol, Src Port: 54921, Dst Port: 443, Seq: 1, Ack: 1, Len: 517
Secure Sockets Layer

No.     Time           Source                Destination           Protocol Length Info
     15 9.351541       172.217.29.46         172.31.197.245        TCP      60     443 → 54921 [ACK] Seq=1 Ack=518 Win=43904 Len=0

Frame 15: 60 bytes on wire (480 bits), 60 bytes captured (480 bits) on interface 0
Ethernet II, Src: ArubaNet_02:38:10 (00:1a:1e:02:38:10), Dst: Tp-LinkT_ec:75:a2 (00:25:86:ec:75:a2)
Internet Protocol Version 4, Src: 172.217.29.46, Dst: 172.31.197.245
Transmission Control Protocol, Src Port: 443, Dst Port: 54921, Seq: 1, Ack: 518, Len: 0

No.     Time           Source                Destination           Protocol Length Info
     16 9.352127       172.217.29.46         172.31.197.245        TLSv1.2  206    Server Hello, Change Cipher Spec, Encrypted Handshake Message

Frame 16: 206 bytes on wire (1648 bits), 206 bytes captured (1648 bits) on interface 0
Ethernet II, Src: ArubaNet_02:38:10 (00:1a:1e:02:38:10), Dst: Tp-LinkT_ec:75:a2 (00:25:86:ec:75:a2)
Internet Protocol Version 4, Src: 172.217.29.46, Dst: 172.31.197.245
Transmission Control Protocol, Src Port: 443, Dst Port: 54921, Seq: 1, Ack: 518, Len: 152
Secure Sockets Layer

No.     Time           Source                Destination           Protocol Length Info
     17 9.357054       172.31.197.245        172.217.29.46         TLSv1.2  254    Change Cipher Spec, Encrypted Handshake Message, Encrypted Handshake Message

Frame 17: 254 bytes on wire (2032 bits), 254 bytes captured (2032 bits) on interface 0
Ethernet II, Src: Tp-LinkT_ec:75:a2 (00:25:86:ec:75:a2), Dst: ArubaNet_02:38:10 (00:1a:1e:02:38:10)
Internet Protocol Version 4, Src: 172.31.197.245, Dst: 172.217.29.46
Transmission Control Protocol, Src Port: 54921, Dst Port: 443, Seq: 518, Ack: 153, Len: 200
Secure Sockets Layer

No.     Time           Source                Destination           Protocol Length Info
     18 9.361519       172.31.197.245        172.217.29.46         TLSv1.2  99     Application Data

Frame 18: 99 bytes on wire (792 bits), 99 bytes captured (792 bits) on interface 0
Ethernet II, Src: Tp-LinkT_ec:75:a2 (00:25:86:ec:75:a2), Dst: ArubaNet_02:38:10 (00:1a:1e:02:38:10)
Internet Protocol Version 4, Src: 172.31.197.245, Dst: 172.217.29.46
Transmission Control Protocol, Src Port: 54921, Dst Port: 443, Seq: 718, Ack: 153, Len: 45
Secure Sockets Layer

No.     Time           Source                Destination           Protocol Length Info
     19 9.361651       172.31.197.245        172.217.29.46         TLSv1.2  102    Application Data

Frame 19: 102 bytes on wire (816 bits), 102 bytes captured (816 bits) on interface 0
Ethernet II, Src: Tp-LinkT_ec:75:a2 (00:25:86:ec:75:a2), Dst: ArubaNet_02:38:10 (00:1a:1e:02:38:10)
Internet Protocol Version 4, Src: 172.31.197.245, Dst: 172.217.29.46
Transmission Control Protocol, Src Port: 54921, Dst Port: 443, Seq: 763, Ack: 153, Len: 48
Secure Sockets Layer

No.     Time           Source                Destination           Protocol Length Info
     20 9.361701       172.31.197.245        172.217.29.46         TLSv1.2  88     Application Data

Frame 20: 88 bytes on wire (704 bits), 88 bytes captured (704 bits) on interface 0
Ethernet II, Src: Tp-LinkT_ec:75:a2 (00:25:86:ec:75:a2), Dst: ArubaNet_02:38:10 (00:1a:1e:02:38:10)
Internet Protocol Version 4, Src: 172.31.197.245, Dst: 172.217.29.46
Transmission Control Protocol, Src Port: 54921, Dst Port: 443, Seq: 811, Ack: 153, Len: 34
Secure Sockets Layer

No.     Time           Source                Destination           Protocol Length Info
     21 9.362060       172.31.197.245        172.217.29.46         TLSv1.2  429    Application Data

Frame 21: 429 bytes on wire (3432 bits), 429 bytes captured (3432 bits) on interface 0
Ethernet II, Src: Tp-LinkT_ec:75:a2 (00:25:86:ec:75:a2), Dst: ArubaNet_02:38:10 (00:1a:1e:02:38:10)
Internet Protocol Version 4, Src: 172.31.197.245, Dst: 172.217.29.46
Transmission Control Protocol, Src Port: 54921, Dst Port: 443, Seq: 845, Ack: 153, Len: 375
Secure Sockets Layer

No.     Time           Source                Destination           Protocol Length Info
     22 9.362146       172.31.197.245        172.217.29.46         TCP      1434   [TCP segment of a reassembled PDU]

Frame 22: 1434 bytes on wire (11472 bits), 1434 bytes captured (11472 bits) on interface 0
Ethernet II, Src: Tp-LinkT_ec:75:a2 (00:25:86:ec:75:a2), Dst: ArubaNet_02:38:10 (00:1a:1e:02:38:10)
Internet Protocol Version 4, Src: 172.31.197.245, Dst: 172.217.29.46
Transmission Control Protocol, Src Port: 54921, Dst Port: 443, Seq: 1220, Ack: 153, Len: 1380

No.     Time           Source                Destination           Protocol Length Info
     23 9.511627       172.217.29.46         172.31.197.245        TLSv1.2  102    Application Data

Frame 23: 102 bytes on wire (816 bits), 102 bytes captured (816 bits) on interface 0
Ethernet II, Src: ArubaNet_02:38:10 (00:1a:1e:02:38:10), Dst: Tp-LinkT_ec:75:a2 (00:25:86:ec:75:a2)
Internet Protocol Version 4, Src: 172.217.29.46, Dst: 172.31.197.245
Transmission Control Protocol, Src Port: 443, Dst Port: 54921, Seq: 153, Ack: 718, Len: 48
Secure Sockets Layer

No.     Time           Source                Destination           Protocol Length Info
     24 9.511763       172.31.197.245        172.217.29.46         TCP      1434   [TCP segment of a reassembled PDU]

Frame 24: 1434 bytes on wire (11472 bits), 1434 bytes captured (11472 bits) on interface 0
Ethernet II, Src: Tp-LinkT_ec:75:a2 (00:25:86:ec:75:a2), Dst: ArubaNet_02:38:10 (00:1a:1e:02:38:10)
Internet Protocol Version 4, Src: 172.31.197.245, Dst: 172.217.29.46
Transmission Control Protocol, Src Port: 54921, Dst Port: 443, Seq: 2600, Ack: 201, Len: 1380

No.     Time           Source                Destination           Protocol Length Info
     25 9.511773       172.31.197.245        172.217.29.46         TLSv1.2  269    Application Data[TCP segment of a reassembled PDU]

Frame 25: 269 bytes on wire (2152 bits), 269 bytes captured (2152 bits) on interface 0
Ethernet II, Src: Tp-LinkT_ec:75:a2 (00:25:86:ec:75:a2), Dst: ArubaNet_02:38:10 (00:1a:1e:02:38:10)
Internet Protocol Version 4, Src: 172.31.197.245, Dst: 172.217.29.46
Transmission Control Protocol, Src Port: 54921, Dst Port: 443, Seq: 3980, Ack: 201, Len: 215
[3 Reassembled TCP Segments (2882 bytes): #22(1380), #24(1380), #25(122)]
Secure Sockets Layer

No.     Time           Source                Destination           Protocol Length Info
     26 9.512121       172.217.29.46         172.31.197.245        TLSv1.2  88     Application Data

Frame 26: 88 bytes on wire (704 bits), 88 bytes captured (704 bits) on interface 0
Ethernet II, Src: ArubaNet_02:38:10 (00:1a:1e:02:38:10), Dst: Tp-LinkT_ec:75:a2 (00:25:86:ec:75:a2)
Internet Protocol Version 4, Src: 172.217.29.46, Dst: 172.31.197.245
Transmission Control Protocol, Src Port: 443, Dst Port: 54921, Seq: 201, Ack: 718, Len: 34
Secure Sockets Layer

No.     Time           Source                Destination           Protocol Length Info
     27 9.514642       172.217.29.46         172.31.197.245        TCP      60     443 → 54921 [ACK] Seq=235 Ack=811 Win=44928 Len=0

Frame 27: 60 bytes on wire (480 bits), 60 bytes captured (480 bits) on interface 0
Ethernet II, Src: ArubaNet_02:38:10 (00:1a:1e:02:38:10), Dst: Tp-LinkT_ec:75:a2 (00:25:86:ec:75:a2)
Internet Protocol Version 4, Src: 172.217.29.46, Dst: 172.31.197.245
Transmission Control Protocol, Src Port: 443, Dst Port: 54921, Seq: 235, Ack: 811, Len: 0

No.     Time           Source                Destination           Protocol Length Info
     28 9.514826       172.217.29.46         172.31.197.245        TLSv1.2  84     Application Data

Frame 28: 84 bytes on wire (672 bits), 84 bytes captured (672 bits) on interface 0
Ethernet II, Src: ArubaNet_02:38:10 (00:1a:1e:02:38:10), Dst: Tp-LinkT_ec:75:a2 (00:25:86:ec:75:a2)
Internet Protocol Version 4, Src: 172.217.29.46, Dst: 172.31.197.245
Transmission Control Protocol, Src Port: 443, Dst Port: 54921, Seq: 235, Ack: 811, Len: 30
Secure Sockets Layer

No.     Time           Source                Destination           Protocol Length Info
     29 9.514898       172.31.197.245        172.217.29.46         TCP      54     54921 → 443 [ACK] Seq=4195 Ack=265 Win=16296 Len=0

Frame 29: 54 bytes on wire (432 bits), 54 bytes captured (432 bits) on interface 0
Ethernet II, Src: Tp-LinkT_ec:75:a2 (00:25:86:ec:75:a2), Dst: ArubaNet_02:38:10 (00:1a:1e:02:38:10)
Internet Protocol Version 4, Src: 172.31.197.245, Dst: 172.217.29.46
Transmission Control Protocol, Src Port: 54921, Dst Port: 443, Seq: 4195, Ack: 265, Len: 0

No.     Time           Source                Destination           Protocol Length Info
     30 9.515829       172.217.29.46         172.31.197.245        TCP      60     443 → 54921 [ACK] Seq=265 Ack=1220 Win=46080 Len=0

Frame 30: 60 bytes on wire (480 bits), 60 bytes captured (480 bits) on interface 0
Ethernet II, Src: ArubaNet_02:38:10 (00:1a:1e:02:38:10), Dst: Tp-LinkT_ec:75:a2 (00:25:86:ec:75:a2)
Internet Protocol Version 4, Src: 172.217.29.46, Dst: 172.31.197.245
Transmission Control Protocol, Src Port: 443, Dst Port: 54921, Seq: 265, Ack: 1220, Len: 0

No.     Time           Source                Destination           Protocol Length Info
     31 9.554374       172.217.29.46         172.31.197.245        TCP      60     443 → 54921 [ACK] Seq=265 Ack=2600 Win=48768 Len=0

Frame 31: 60 bytes on wire (480 bits), 60 bytes captured (480 bits) on interface 0
Ethernet II, Src: ArubaNet_02:38:10 (00:1a:1e:02:38:10), Dst: Tp-LinkT_ec:75:a2 (00:25:86:ec:75:a2)
Internet Protocol Version 4, Src: 172.217.29.46, Dst: 172.31.197.245
Transmission Control Protocol, Src Port: 443, Dst Port: 54921, Seq: 265, Ack: 2600, Len: 0

No.     Time           Source                Destination           Protocol Length Info
     32 9.554460       172.31.197.245        172.217.29.46         TCP      1434   [TCP segment of a reassembled PDU]

Frame 32: 1434 bytes on wire (11472 bits), 1434 bytes captured (11472 bits) on interface 0
Ethernet II, Src: Tp-LinkT_ec:75:a2 (00:25:86:ec:75:a2), Dst: ArubaNet_02:38:10 (00:1a:1e:02:38:10)
Internet Protocol Version 4, Src: 172.31.197.245, Dst: 172.217.29.46
Transmission Control Protocol, Src Port: 54921, Dst Port: 443, Seq: 4195, Ack: 265, Len: 1380

No.     Time           Source                Destination           Protocol Length Info
     33 9.554470       172.31.197.245        172.217.29.46         TLSv1.2  116    Application Data, Application Data

Frame 33: 116 bytes on wire (928 bits), 116 bytes captured (928 bits) on interface 0
Ethernet II, Src: Tp-LinkT_ec:75:a2 (00:25:86:ec:75:a2), Dst: ArubaNet_02:38:10 (00:1a:1e:02:38:10)
Internet Protocol Version 4, Src: 172.31.197.245, Dst: 172.217.29.46
Transmission Control Protocol, Src Port: 54921, Dst Port: 443, Seq: 5575, Ack: 265, Len: 62
[3 Reassembled TCP Segments (1505 bytes): #25(93), #32(1380), #33(32)]
Secure Sockets Layer
Secure Sockets Layer

No.     Time           Source                Destination           Protocol Length Info
     34 9.661516       172.217.29.46         172.31.197.245        TCP      60     443 → 54921 [ACK] Seq=265 Ack=3980 Win=51584 Len=0

Frame 34: 60 bytes on wire (480 bits), 60 bytes captured (480 bits) on interface 0
Ethernet II, Src: ArubaNet_02:38:10 (00:1a:1e:02:38:10), Dst: Tp-LinkT_ec:75:a2 (00:25:86:ec:75:a2)
Internet Protocol Version 4, Src: 172.217.29.46, Dst: 172.31.197.245
Transmission Control Protocol, Src Port: 443, Dst Port: 54921, Seq: 265, Ack: 3980, Len: 0

No.     Time           Source                Destination           Protocol Length Info
     35 9.661825       172.217.29.46         172.31.197.245        TCP      60     443 → 54921 [ACK] Seq=265 Ack=4195 Win=54400 Len=0

Frame 35: 60 bytes on wire (480 bits), 60 bytes captured (480 bits) on interface 0
Ethernet II, Src: ArubaNet_02:38:10 (00:1a:1e:02:38:10), Dst: Tp-LinkT_ec:75:a2 (00:25:86:ec:75:a2)
Internet Protocol Version 4, Src: 172.217.29.46, Dst: 172.31.197.245
Transmission Control Protocol, Src Port: 443, Dst Port: 54921, Seq: 265, Ack: 4195, Len: 0

No.     Time           Source                Destination           Protocol Length Info
     36 9.702743       172.217.29.46         172.31.197.245        TCP      60     443 → 54921 [ACK] Seq=265 Ack=5575 Win=57088 Len=0

Frame 36: 60 bytes on wire (480 bits), 60 bytes captured (480 bits) on interface 0
Ethernet II, Src: ArubaNet_02:38:10 (00:1a:1e:02:38:10), Dst: Tp-LinkT_ec:75:a2 (00:25:86:ec:75:a2)
Internet Protocol Version 4, Src: 172.217.29.46, Dst: 172.31.197.245
Transmission Control Protocol, Src Port: 443, Dst Port: 54921, Seq: 265, Ack: 5575, Len: 0

No.     Time           Source                Destination           Protocol Length Info
     37 9.703204       172.217.29.46         172.31.197.245        TCP      60     443 → 54921 [ACK] Seq=265 Ack=5637 Win=57088 Len=0

Frame 37: 60 bytes on wire (480 bits), 60 bytes captured (480 bits) on interface 0
Ethernet II, Src: ArubaNet_02:38:10 (00:1a:1e:02:38:10), Dst: Tp-LinkT_ec:75:a2 (00:25:86:ec:75:a2)
Internet Protocol Version 4, Src: 172.217.29.46, Dst: 172.31.197.245
Transmission Control Protocol, Src Port: 443, Dst Port: 54921, Seq: 265, Ack: 5637, Len: 0

No.     Time           Source                Destination           Protocol Length Info
     38 9.756612       172.217.29.46         172.31.197.245        TLSv1.2  281    Application Data

Frame 38: 281 bytes on wire (2248 bits), 281 bytes captured (2248 bits) on interface 0
Ethernet II, Src: ArubaNet_02:38:10 (00:1a:1e:02:38:10), Dst: Tp-LinkT_ec:75:a2 (00:25:86:ec:75:a2)
Internet Protocol Version 4, Src: 172.217.29.46, Dst: 172.31.197.245
Transmission Control Protocol, Src Port: 443, Dst Port: 54921, Seq: 265, Ack: 5637, Len: 227
Secure Sockets Layer

No.     Time           Source                Destination           Protocol Length Info
     39 9.756941       172.217.29.46         172.31.197.245        TLSv1.2  979    Application Data

Frame 39: 979 bytes on wire (7832 bits), 979 bytes captured (7832 bits) on interface 0
Ethernet II, Src: ArubaNet_02:38:10 (00:1a:1e:02:38:10), Dst: Tp-LinkT_ec:75:a2 (00:25:86:ec:75:a2)
Internet Protocol Version 4, Src: 172.217.29.46, Dst: 172.31.197.245
Transmission Control Protocol, Src Port: 443, Dst Port: 54921, Seq: 492, Ack: 5637, Len: 925
Secure Sockets Layer

No.     Time           Source                Destination           Protocol Length Info
     40 9.756998       172.31.197.245        172.217.29.46         TCP      54     54921 → 443 [ACK] Seq=5637 Ack=1417 Win=16560 Len=0

Frame 40: 54 bytes on wire (432 bits), 54 bytes captured (432 bits) on interface 0
Ethernet II, Src: Tp-LinkT_ec:75:a2 (00:25:86:ec:75:a2), Dst: ArubaNet_02:38:10 (00:1a:1e:02:38:10)
Internet Protocol Version 4, Src: 172.31.197.245, Dst: 172.217.29.46
Transmission Control Protocol, Src Port: 54921, Dst Port: 443, Seq: 5637, Ack: 1417, Len: 0

No.     Time           Source                Destination           Protocol Length Info
     41 9.757209       172.217.29.46         172.31.197.245        TLSv1.2  92     Application Data

Frame 41: 92 bytes on wire (736 bits), 92 bytes captured (736 bits) on interface 0
Ethernet II, Src: ArubaNet_02:38:10 (00:1a:1e:02:38:10), Dst: Tp-LinkT_ec:75:a2 (00:25:86:ec:75:a2)
Internet Protocol Version 4, Src: 172.217.29.46, Dst: 172.31.197.245
Transmission Control Protocol, Src Port: 443, Dst Port: 54921, Seq: 1417, Ack: 5637, Len: 38
Secure Sockets Layer

No.     Time           Source                Destination           Protocol Length Info
     42 9.757930       172.31.197.245        172.217.29.46         TLSv1.2  92     Application Data

Frame 42: 92 bytes on wire (736 bits), 92 bytes captured (736 bits) on interface 0
Ethernet II, Src: Tp-LinkT_ec:75:a2 (00:25:86:ec:75:a2), Dst: ArubaNet_02:38:10 (00:1a:1e:02:38:10)
Internet Protocol Version 4, Src: 172.31.197.245, Dst: 172.217.29.46
Transmission Control Protocol, Src Port: 54921, Dst Port: 443, Seq: 5637, Ack: 1455, Len: 38
Secure Sockets Layer

No.     Time           Source                Destination           Protocol Length Info
     43 9.759045       172.31.197.245        164.41.101.11         DNS      89     Standard query 0x47fc A safebrowsing-cache.google.com

Frame 43: 89 bytes on wire (712 bits), 89 bytes captured (712 bits) on interface 0
Ethernet II, Src: Tp-LinkT_ec:75:a2 (00:25:86:ec:75:a2), Dst: ArubaNet_02:38:10 (00:1a:1e:02:38:10)
Internet Protocol Version 4, Src: 172.31.197.245, Dst: 164.41.101.11
User Datagram Protocol, Src Port: 54731, Dst Port: 53
Domain Name System (query)

No.     Time           Source                Destination           Protocol Length Info
     44 9.764228       164.41.101.11         172.31.197.245        DNS      140    Standard query response 0x47fc A safebrowsing-cache.google.com CNAME safebrowsing.cache.l.google.com A 172.217.29.46

Frame 44: 140 bytes on wire (1120 bits), 140 bytes captured (1120 bits) on interface 0
Ethernet II, Src: ArubaNet_02:38:10 (00:1a:1e:02:38:10), Dst: Tp-LinkT_ec:75:a2 (00:25:86:ec:75:a2)
Internet Protocol Version 4, Src: 164.41.101.11, Dst: 172.31.197.245
User Datagram Protocol, Src Port: 53, Dst Port: 54731
Domain Name System (response)

No.     Time           Source                Destination           Protocol Length Info
     45 9.765522       172.31.197.245        172.217.29.46         TLSv1.2  196    Application Data

Frame 45: 196 bytes on wire (1568 bits), 196 bytes captured (1568 bits) on interface 0
Ethernet II, Src: Tp-LinkT_ec:75:a2 (00:25:86:ec:75:a2), Dst: ArubaNet_02:38:10 (00:1a:1e:02:38:10)
Internet Protocol Version 4, Src: 172.31.197.245, Dst: 172.217.29.46
Transmission Control Protocol, Src Port: 54921, Dst Port: 443, Seq: 5675, Ack: 1455, Len: 142
Secure Sockets Layer

No.     Time           Source                Destination           Protocol Length Info
     46 9.790605       162.125.18.133        172.31.197.245        TLSv1.2  311    Application Data

Frame 46: 311 bytes on wire (2488 bits), 311 bytes captured (2488 bits) on interface 0
Ethernet II, Src: ArubaNet_02:38:10 (00:1a:1e:02:38:10), Dst: Tp-LinkT_ec:75:a2 (00:25:86:ec:75:a2)
Internet Protocol Version 4, Src: 162.125.18.133, Dst: 172.31.197.245
Transmission Control Protocol, Src Port: 443, Dst Port: 54871, Seq: 1, Ack: 1, Len: 257
Secure Sockets Layer

No.     Time           Source                Destination           Protocol Length Info
     47 9.794562       172.31.197.245        162.125.18.133        TLSv1.2  1062   Application Data

Frame 47: 1062 bytes on wire (8496 bits), 1062 bytes captured (8496 bits) on interface 0
Ethernet II, Src: Tp-LinkT_ec:75:a2 (00:25:86:ec:75:a2), Dst: ArubaNet_02:38:10 (00:1a:1e:02:38:10)
Internet Protocol Version 4, Src: 172.31.197.245, Dst: 162.125.18.133
Transmission Control Protocol, Src Port: 54871, Dst Port: 443, Seq: 1, Ack: 258, Len: 1008
Secure Sockets Layer

No.     Time           Source                Destination           Protocol Length Info
     48 9.907213       172.217.29.46         172.31.197.245        TCP      60     443 → 54921 [ACK] Seq=1455 Ack=5675 Win=57088 Len=0

Frame 48: 60 bytes on wire (480 bits), 60 bytes captured (480 bits) on interface 0
Ethernet II, Src: ArubaNet_02:38:10 (00:1a:1e:02:38:10), Dst: Tp-LinkT_ec:75:a2 (00:25:86:ec:75:a2)
Internet Protocol Version 4, Src: 172.217.29.46, Dst: 172.31.197.245
Transmission Control Protocol, Src Port: 443, Dst Port: 54921, Seq: 1455, Ack: 5675, Len: 0

No.     Time           Source                Destination           Protocol Length Info
     49 9.913804       172.217.29.46         172.31.197.245        TCP      60     443 → 54921 [ACK] Seq=1455 Ack=5817 Win=59904 Len=0

Frame 49: 60 bytes on wire (480 bits), 60 bytes captured (480 bits) on interface 0
Ethernet II, Src: ArubaNet_02:38:10 (00:1a:1e:02:38:10), Dst: Tp-LinkT_ec:75:a2 (00:25:86:ec:75:a2)
Internet Protocol Version 4, Src: 172.217.29.46, Dst: 172.31.197.245
Transmission Control Protocol, Src Port: 443, Dst Port: 54921, Seq: 1455, Ack: 5817, Len: 0

No.     Time           Source                Destination           Protocol Length Info
     50 9.914429       172.217.29.46         172.31.197.245        TLSv1.2  178    Application Data

Frame 50: 178 bytes on wire (1424 bits), 178 bytes captured (1424 bits) on interface 0
Ethernet II, Src: ArubaNet_02:38:10 (00:1a:1e:02:38:10), Dst: Tp-LinkT_ec:75:a2 (00:25:86:ec:75:a2)
Internet Protocol Version 4, Src: 172.217.29.46, Dst: 172.31.197.245
Transmission Control Protocol, Src Port: 443, Dst Port: 54921, Seq: 1455, Ack: 5817, Len: 124
Secure Sockets Layer

No.     Time           Source                Destination           Protocol Length Info
     51 9.914759       172.217.29.46         172.31.197.245        TLSv1.2  321    Application Data

Frame 51: 321 bytes on wire (2568 bits), 321 bytes captured (2568 bits) on interface 0
Ethernet II, Src: ArubaNet_02:38:10 (00:1a:1e:02:38:10), Dst: Tp-LinkT_ec:75:a2 (00:25:86:ec:75:a2)
Internet Protocol Version 4, Src: 172.217.29.46, Dst: 172.31.197.245
Transmission Control Protocol, Src Port: 443, Dst Port: 54921, Seq: 1579, Ack: 5817, Len: 267
Secure Sockets Layer

No.     Time           Source                Destination           Protocol Length Info
     52 9.914831       172.31.197.245        172.217.29.46         TCP      54     54921 → 443 [ACK] Seq=5817 Ack=1846 Win=16128 Len=0

Frame 52: 54 bytes on wire (432 bits), 54 bytes captured (432 bits) on interface 0
Ethernet II, Src: Tp-LinkT_ec:75:a2 (00:25:86:ec:75:a2), Dst: ArubaNet_02:38:10 (00:1a:1e:02:38:10)
Internet Protocol Version 4, Src: 172.31.197.245, Dst: 172.217.29.46
Transmission Control Protocol, Src Port: 54921, Dst Port: 443, Seq: 5817, Ack: 1846, Len: 0

No.     Time           Source                Destination           Protocol Length Info
     53 9.915073       172.217.29.46         172.31.197.245        TLSv1.2  92     Application Data

Frame 53: 92 bytes on wire (736 bits), 92 bytes captured (736 bits) on interface 0
Ethernet II, Src: ArubaNet_02:38:10 (00:1a:1e:02:38:10), Dst: Tp-LinkT_ec:75:a2 (00:25:86:ec:75:a2)
Internet Protocol Version 4, Src: 172.217.29.46, Dst: 172.31.197.245
Transmission Control Protocol, Src Port: 443, Dst Port: 54921, Seq: 1846, Ack: 5817, Len: 38
Secure Sockets Layer

No.     Time           Source                Destination           Protocol Length Info
     54 9.916050       172.31.197.245        172.217.29.46         TLSv1.2  92     Application Data

Frame 54: 92 bytes on wire (736 bits), 92 bytes captured (736 bits) on interface 0
Ethernet II, Src: Tp-LinkT_ec:75:a2 (00:25:86:ec:75:a2), Dst: ArubaNet_02:38:10 (00:1a:1e:02:38:10)
Internet Protocol Version 4, Src: 172.31.197.245, Dst: 172.217.29.46
Transmission Control Protocol, Src Port: 54921, Dst Port: 443, Seq: 5817, Ack: 1884, Len: 38
Secure Sockets Layer

No.     Time           Source                Destination           Protocol Length Info
     55 9.916488       172.31.197.245        172.217.29.46         TLSv1.2  156    Application Data

Frame 55: 156 bytes on wire (1248 bits), 156 bytes captured (1248 bits) on interface 0
Ethernet II, Src: Tp-LinkT_ec:75:a2 (00:25:86:ec:75:a2), Dst: ArubaNet_02:38:10 (00:1a:1e:02:38:10)
Internet Protocol Version 4, Src: 172.31.197.245, Dst: 172.217.29.46
Transmission Control Protocol, Src Port: 54921, Dst Port: 443, Seq: 5855, Ack: 1884, Len: 102
Secure Sockets Layer

No.     Time           Source                Destination           Protocol Length Info
     56 9.921145       162.125.18.133        172.31.197.245        TCP      60     443 → 54871 [ACK] Seq=258 Ack=1009 Win=136 Len=0

Frame 56: 60 bytes on wire (480 bits), 60 bytes captured (480 bits) on interface 0
Ethernet II, Src: ArubaNet_02:38:10 (00:1a:1e:02:38:10), Dst: Tp-LinkT_ec:75:a2 (00:25:86:ec:75:a2)
Internet Protocol Version 4, Src: 162.125.18.133, Dst: 172.31.197.245
Transmission Control Protocol, Src Port: 443, Dst Port: 54871, Seq: 258, Ack: 1009, Len: 0

No.     Time           Source                Destination           Protocol Length Info
     57 9.999009       172.31.197.245        104.244.42.1          TLSv1.2  157    Application Data

Frame 57: 157 bytes on wire (1256 bits), 157 bytes captured (1256 bits) on interface 0
Ethernet II, Src: Tp-LinkT_ec:75:a2 (00:25:86:ec:75:a2), Dst: ArubaNet_02:38:10 (00:1a:1e:02:38:10)
Internet Protocol Version 4, Src: 172.31.197.245, Dst: 104.244.42.1
Transmission Control Protocol, Src Port: 54883, Dst Port: 443, Seq: 198, Ack: 1013, Len: 103
Secure Sockets Layer

No.     Time           Source                Destination           Protocol Length Info
     58 10.006283      172.31.197.245        104.244.42.1          TLSv1.2  176    Application Data

Frame 58: 176 bytes on wire (1408 bits), 176 bytes captured (1408 bits) on interface 0
Ethernet II, Src: Tp-LinkT_ec:75:a2 (00:25:86:ec:75:a2), Dst: ArubaNet_02:38:10 (00:1a:1e:02:38:10)
Internet Protocol Version 4, Src: 172.31.197.245, Dst: 104.244.42.1
Transmission Control Protocol, Src Port: 54883, Dst Port: 443, Seq: 301, Ack: 1013, Len: 122
Secure Sockets Layer

No.     Time           Source                Destination           Protocol Length Info
     59 10.006775      172.31.197.245        104.244.42.1          TLSv1.2  251    Application Data

Frame 59: 251 bytes on wire (2008 bits), 251 bytes captured (2008 bits) on interface 0
Ethernet II, Src: Tp-LinkT_ec:75:a2 (00:25:86:ec:75:a2), Dst: ArubaNet_02:38:10 (00:1a:1e:02:38:10)
Internet Protocol Version 4, Src: 172.31.197.245, Dst: 104.244.42.1
Transmission Control Protocol, Src Port: 54883, Dst Port: 443, Seq: 423, Ack: 1013, Len: 197
Secure Sockets Layer

No.     Time           Source                Destination           Protocol Length Info
     60 10.067582      172.217.29.46         172.31.197.245        TCP      60     443 → 54921 [ACK] Seq=1884 Ack=5957 Win=59904 Len=0

Frame 60: 60 bytes on wire (480 bits), 60 bytes captured (480 bits) on interface 0
Ethernet II, Src: ArubaNet_02:38:10 (00:1a:1e:02:38:10), Dst: Tp-LinkT_ec:75:a2 (00:25:86:ec:75:a2)
Internet Protocol Version 4, Src: 172.217.29.46, Dst: 172.31.197.245
Transmission Control Protocol, Src Port: 443, Dst Port: 54921, Seq: 1884, Ack: 5957, Len: 0

No.     Time           Source                Destination           Protocol Length Info
     61 10.067929      172.217.29.46         172.31.197.245        TLSv1.2  122    Application Data

Frame 61: 122 bytes on wire (976 bits), 122 bytes captured (976 bits) on interface 0
Ethernet II, Src: ArubaNet_02:38:10 (00:1a:1e:02:38:10), Dst: Tp-LinkT_ec:75:a2 (00:25:86:ec:75:a2)
Internet Protocol Version 4, Src: 172.217.29.46, Dst: 172.31.197.245
Transmission Control Protocol, Src Port: 443, Dst Port: 54921, Seq: 1884, Ack: 5957, Len: 68
Secure Sockets Layer

No.     Time           Source                Destination           Protocol Length Info
     62 10.068256      172.217.29.46         172.31.197.245        TLSv1.2  321    Application Data

Frame 62: 321 bytes on wire (2568 bits), 321 bytes captured (2568 bits) on interface 0
Ethernet II, Src: ArubaNet_02:38:10 (00:1a:1e:02:38:10), Dst: Tp-LinkT_ec:75:a2 (00:25:86:ec:75:a2)
Internet Protocol Version 4, Src: 172.217.29.46, Dst: 172.31.197.245
Transmission Control Protocol, Src Port: 443, Dst Port: 54921, Seq: 1952, Ack: 5957, Len: 267
Secure Sockets Layer

No.     Time           Source                Destination           Protocol Length Info
     63 10.068332      172.31.197.245        172.217.29.46         TCP      54     54921 → 443 [ACK] Seq=5957 Ack=2219 Win=15756 Len=0

Frame 63: 54 bytes on wire (432 bits), 54 bytes captured (432 bits) on interface 0
Ethernet II, Src: Tp-LinkT_ec:75:a2 (00:25:86:ec:75:a2), Dst: ArubaNet_02:38:10 (00:1a:1e:02:38:10)
Internet Protocol Version 4, Src: 172.31.197.245, Dst: 172.217.29.46
Transmission Control Protocol, Src Port: 54921, Dst Port: 443, Seq: 5957, Ack: 2219, Len: 0

No.     Time           Source                Destination           Protocol Length Info
     64 10.068724      172.217.29.46         172.31.197.245        TLSv1.2  92     Application Data

Frame 64: 92 bytes on wire (736 bits), 92 bytes captured (736 bits) on interface 0
Ethernet II, Src: ArubaNet_02:38:10 (00:1a:1e:02:38:10), Dst: Tp-LinkT_ec:75:a2 (00:25:86:ec:75:a2)
Internet Protocol Version 4, Src: 172.217.29.46, Dst: 172.31.197.245
Transmission Control Protocol, Src Port: 443, Dst Port: 54921, Seq: 2219, Ack: 5957, Len: 38
Secure Sockets Layer

No.     Time           Source                Destination           Protocol Length Info
     65 10.069604      172.31.197.245        172.217.29.46         TLSv1.2  92     Application Data

Frame 65: 92 bytes on wire (736 bits), 92 bytes captured (736 bits) on interface 0
Ethernet II, Src: Tp-LinkT_ec:75:a2 (00:25:86:ec:75:a2), Dst: ArubaNet_02:38:10 (00:1a:1e:02:38:10)
Internet Protocol Version 4, Src: 172.31.197.245, Dst: 172.217.29.46
Transmission Control Protocol, Src Port: 54921, Dst Port: 443, Seq: 5957, Ack: 2257, Len: 38
Secure Sockets Layer

No.     Time           Source                Destination           Protocol Length Info
     66 10.069993      172.31.197.245        172.217.29.46         TLSv1.2  171    Application Data

Frame 66: 171 bytes on wire (1368 bits), 171 bytes captured (1368 bits) on interface 0
Ethernet II, Src: Tp-LinkT_ec:75:a2 (00:25:86:ec:75:a2), Dst: ArubaNet_02:38:10 (00:1a:1e:02:38:10)
Internet Protocol Version 4, Src: 172.31.197.245, Dst: 172.217.29.46
Transmission Control Protocol, Src Port: 54921, Dst Port: 443, Seq: 5995, Ack: 2257, Len: 117
Secure Sockets Layer

No.     Time           Source                Destination           Protocol Length Info
     67 10.119763      104.244.42.1          172.31.197.245        TCP      60     443 → 54883 [ACK] Seq=1013 Ack=301 Win=683 Len=0

Frame 67: 60 bytes on wire (480 bits), 60 bytes captured (480 bits) on interface 0
Ethernet II, Src: ArubaNet_02:38:10 (00:1a:1e:02:38:10), Dst: Tp-LinkT_ec:75:a2 (00:25:86:ec:75:a2)
Internet Protocol Version 4, Src: 104.244.42.1, Dst: 172.31.197.245
Transmission Control Protocol, Src Port: 443, Dst Port: 54883, Seq: 1013, Ack: 301, Len: 0

No.     Time           Source                Destination           Protocol Length Info
     68 10.127493      104.244.42.1          172.31.197.245        TCP      60     443 → 54883 [ACK] Seq=1013 Ack=423 Win=683 Len=0

Frame 68: 60 bytes on wire (480 bits), 60 bytes captured (480 bits) on interface 0
Ethernet II, Src: ArubaNet_02:38:10 (00:1a:1e:02:38:10), Dst: Tp-LinkT_ec:75:a2 (00:25:86:ec:75:a2)
Internet Protocol Version 4, Src: 104.244.42.1, Dst: 172.31.197.245
Transmission Control Protocol, Src Port: 443, Dst Port: 54883, Seq: 1013, Ack: 423, Len: 0

No.     Time           Source                Destination           Protocol Length Info
     69 10.128000      104.244.42.1          172.31.197.245        TCP      60     443 → 54883 [ACK] Seq=1013 Ack=620 Win=693 Len=0

Frame 69: 60 bytes on wire (480 bits), 60 bytes captured (480 bits) on interface 0
Ethernet II, Src: ArubaNet_02:38:10 (00:1a:1e:02:38:10), Dst: Tp-LinkT_ec:75:a2 (00:25:86:ec:75:a2)
Internet Protocol Version 4, Src: 104.244.42.1, Dst: 172.31.197.245
Transmission Control Protocol, Src Port: 443, Dst Port: 54883, Seq: 1013, Ack: 620, Len: 0

No.     Time           Source                Destination           Protocol Length Info
     70 10.239891      172.217.29.46         172.31.197.245        TCP      60     443 → 54921 [ACK] Seq=2257 Ack=6112 Win=59904 Len=0

Frame 70: 60 bytes on wire (480 bits), 60 bytes captured (480 bits) on interface 0
Ethernet II, Src: ArubaNet_02:38:10 (00:1a:1e:02:38:10), Dst: Tp-LinkT_ec:75:a2 (00:25:86:ec:75:a2)
Internet Protocol Version 4, Src: 172.217.29.46, Dst: 172.31.197.245
Transmission Control Protocol, Src Port: 443, Dst Port: 54921, Seq: 2257, Ack: 6112, Len: 0

No.     Time           Source                Destination           Protocol Length Info
     71 10.241294      172.217.29.46         172.31.197.245        TLSv1.2  127    Application Data

Frame 71: 127 bytes on wire (1016 bits), 127 bytes captured (1016 bits) on interface 0
Ethernet II, Src: ArubaNet_02:38:10 (00:1a:1e:02:38:10), Dst: Tp-LinkT_ec:75:a2 (00:25:86:ec:75:a2)
Internet Protocol Version 4, Src: 172.217.29.46, Dst: 172.31.197.245
Transmission Control Protocol, Src Port: 443, Dst Port: 54921, Seq: 2257, Ack: 6112, Len: 73
Secure Sockets Layer

No.     Time           Source                Destination           Protocol Length Info
     72 10.241864      172.217.29.46         172.31.197.245        TLSv1.2  411    Application Data

Frame 72: 411 bytes on wire (3288 bits), 411 bytes captured (3288 bits) on interface 0
Ethernet II, Src: ArubaNet_02:38:10 (00:1a:1e:02:38:10), Dst: Tp-LinkT_ec:75:a2 (00:25:86:ec:75:a2)
Internet Protocol Version 4, Src: 172.217.29.46, Dst: 172.31.197.245
Transmission Control Protocol, Src Port: 443, Dst Port: 54921, Seq: 2330, Ack: 6112, Len: 357
Secure Sockets Layer

No.     Time           Source                Destination           Protocol Length Info
     73 10.241923      172.31.197.245        172.217.29.46         TCP      54     54921 → 443 [ACK] Seq=6112 Ack=2687 Win=15288 Len=0

Frame 73: 54 bytes on wire (432 bits), 54 bytes captured (432 bits) on interface 0
Ethernet II, Src: Tp-LinkT_ec:75:a2 (00:25:86:ec:75:a2), Dst: ArubaNet_02:38:10 (00:1a:1e:02:38:10)
Internet Protocol Version 4, Src: 172.31.197.245, Dst: 172.217.29.46
Transmission Control Protocol, Src Port: 54921, Dst Port: 443, Seq: 6112, Ack: 2687, Len: 0

No.     Time           Source                Destination           Protocol Length Info
     74 10.242240      172.217.29.46         172.31.197.245        TLSv1.2  92     Application Data

Frame 74: 92 bytes on wire (736 bits), 92 bytes captured (736 bits) on interface 0
Ethernet II, Src: ArubaNet_02:38:10 (00:1a:1e:02:38:10), Dst: Tp-LinkT_ec:75:a2 (00:25:86:ec:75:a2)
Internet Protocol Version 4, Src: 172.217.29.46, Dst: 172.31.197.245
Transmission Control Protocol, Src Port: 443, Dst Port: 54921, Seq: 2687, Ack: 6112, Len: 38
Secure Sockets Layer

No.     Time           Source                Destination           Protocol Length Info
     75 10.243020      172.31.197.245        172.217.29.46         TLSv1.2  92     Application Data

Frame 75: 92 bytes on wire (736 bits), 92 bytes captured (736 bits) on interface 0
Ethernet II, Src: Tp-LinkT_ec:75:a2 (00:25:86:ec:75:a2), Dst: ArubaNet_02:38:10 (00:1a:1e:02:38:10)
Internet Protocol Version 4, Src: 172.31.197.245, Dst: 172.217.29.46
Transmission Control Protocol, Src Port: 54921, Dst Port: 443, Seq: 6112, Ack: 2725, Len: 38
Secure Sockets Layer

No.     Time           Source                Destination           Protocol Length Info
     76 10.243406      172.31.197.245        172.217.29.46         TLSv1.2  170    Application Data

Frame 76: 170 bytes on wire (1360 bits), 170 bytes captured (1360 bits) on interface 0
Ethernet II, Src: Tp-LinkT_ec:75:a2 (00:25:86:ec:75:a2), Dst: ArubaNet_02:38:10 (00:1a:1e:02:38:10)
Internet Protocol Version 4, Src: 172.31.197.245, Dst: 172.217.29.46
Transmission Control Protocol, Src Port: 54921, Dst Port: 443, Seq: 6150, Ack: 2725, Len: 116
Secure Sockets Layer

No.     Time           Source                Destination           Protocol Length Info
     77 10.264233      104.244.42.1          172.31.197.245        TLSv1.2  327    Application Data

Frame 77: 327 bytes on wire (2616 bits), 327 bytes captured (2616 bits) on interface 0
Ethernet II, Src: ArubaNet_02:38:10 (00:1a:1e:02:38:10), Dst: Tp-LinkT_ec:75:a2 (00:25:86:ec:75:a2)
Internet Protocol Version 4, Src: 104.244.42.1, Dst: 172.31.197.245
Transmission Control Protocol, Src Port: 443, Dst Port: 54883, Seq: 1013, Ack: 620, Len: 273
Secure Sockets Layer

No.     Time           Source                Destination           Protocol Length Info
     78 10.264555      104.244.42.1          172.31.197.245        TLSv1.2  241    Application Data

Frame 78: 241 bytes on wire (1928 bits), 241 bytes captured (1928 bits) on interface 0
Ethernet II, Src: ArubaNet_02:38:10 (00:1a:1e:02:38:10), Dst: Tp-LinkT_ec:75:a2 (00:25:86:ec:75:a2)
Internet Protocol Version 4, Src: 104.244.42.1, Dst: 172.31.197.245
Transmission Control Protocol, Src Port: 443, Dst Port: 54883, Seq: 1286, Ack: 620, Len: 187
Secure Sockets Layer

No.     Time           Source                Destination           Protocol Length Info
     79 10.264612      172.31.197.245        104.244.42.1          TCP      54     54883 → 443 [ACK] Seq=620 Ack=1473 Win=267 Len=0

Frame 79: 54 bytes on wire (432 bits), 54 bytes captured (432 bits) on interface 0
Ethernet II, Src: Tp-LinkT_ec:75:a2 (00:25:86:ec:75:a2), Dst: ArubaNet_02:38:10 (00:1a:1e:02:38:10)
Internet Protocol Version 4, Src: 172.31.197.245, Dst: 104.244.42.1
Transmission Control Protocol, Src Port: 54883, Dst Port: 443, Seq: 620, Ack: 1473, Len: 0

No.     Time           Source                Destination           Protocol Length Info
     80 10.264816      104.244.42.1          172.31.197.245        TLSv1.2  102    Application Data

Frame 80: 102 bytes on wire (816 bits), 102 bytes captured (816 bits) on interface 0
Ethernet II, Src: ArubaNet_02:38:10 (00:1a:1e:02:38:10), Dst: Tp-LinkT_ec:75:a2 (00:25:86:ec:75:a2)
Internet Protocol Version 4, Src: 104.244.42.1, Dst: 172.31.197.245
Transmission Control Protocol, Src Port: 443, Dst Port: 54883, Seq: 1473, Ack: 620, Len: 48
Secure Sockets Layer

No.     Time           Source                Destination           Protocol Length Info
     81 10.265061      104.244.42.1          172.31.197.245        TLSv1.2  92     Application Data

Frame 81: 92 bytes on wire (736 bits), 92 bytes captured (736 bits) on interface 0
Ethernet II, Src: ArubaNet_02:38:10 (00:1a:1e:02:38:10), Dst: Tp-LinkT_ec:75:a2 (00:25:86:ec:75:a2)
Internet Protocol Version 4, Src: 104.244.42.1, Dst: 172.31.197.245
Transmission Control Protocol, Src Port: 443, Dst Port: 54883, Seq: 1521, Ack: 620, Len: 38
Secure Sockets Layer

No.     Time           Source                Destination           Protocol Length Info
     82 10.265111      172.31.197.245        104.244.42.1          TCP      54     54883 → 443 [ACK] Seq=620 Ack=1559 Win=267 Len=0

Frame 82: 54 bytes on wire (432 bits), 54 bytes captured (432 bits) on interface 0
Ethernet II, Src: Tp-LinkT_ec:75:a2 (00:25:86:ec:75:a2), Dst: ArubaNet_02:38:10 (00:1a:1e:02:38:10)
Internet Protocol Version 4, Src: 172.31.197.245, Dst: 104.244.42.1
Transmission Control Protocol, Src Port: 54883, Dst Port: 443, Seq: 620, Ack: 1559, Len: 0

No.     Time           Source                Destination           Protocol Length Info
     83 10.292198      104.244.42.1          172.31.197.245        TLSv1.2  136    Application Data

Frame 83: 136 bytes on wire (1088 bits), 136 bytes captured (1088 bits) on interface 0
Ethernet II, Src: ArubaNet_02:38:10 (00:1a:1e:02:38:10), Dst: Tp-LinkT_ec:75:a2 (00:25:86:ec:75:a2)
Internet Protocol Version 4, Src: 104.244.42.1, Dst: 172.31.197.245
Transmission Control Protocol, Src Port: 443, Dst Port: 54883, Seq: 1559, Ack: 620, Len: 82
Secure Sockets Layer

No.     Time           Source                Destination           Protocol Length Info
     84 10.292482      104.244.42.1          172.31.197.245        TLSv1.2  306    Application Data

Frame 84: 306 bytes on wire (2448 bits), 306 bytes captured (2448 bits) on interface 0
Ethernet II, Src: ArubaNet_02:38:10 (00:1a:1e:02:38:10), Dst: Tp-LinkT_ec:75:a2 (00:25:86:ec:75:a2)
Internet Protocol Version 4, Src: 104.244.42.1, Dst: 172.31.197.245
Transmission Control Protocol, Src Port: 443, Dst Port: 54883, Seq: 1641, Ack: 620, Len: 252
Secure Sockets Layer

No.     Time           Source                Destination           Protocol Length Info
     85 10.292562      172.31.197.245        104.244.42.1          TCP      54     54883 → 443 [ACK] Seq=620 Ack=1893 Win=265 Len=0

Frame 85: 54 bytes on wire (432 bits), 54 bytes captured (432 bits) on interface 0
Ethernet II, Src: Tp-LinkT_ec:75:a2 (00:25:86:ec:75:a2), Dst: ArubaNet_02:38:10 (00:1a:1e:02:38:10)
Internet Protocol Version 4, Src: 172.31.197.245, Dst: 104.244.42.1
Transmission Control Protocol, Src Port: 54883, Dst Port: 443, Seq: 620, Ack: 1893, Len: 0

No.     Time           Source                Destination           Protocol Length Info
     86 10.292869      104.244.42.1          172.31.197.245        TLSv1.2  102    Application Data

Frame 86: 102 bytes on wire (816 bits), 102 bytes captured (816 bits) on interface 0
Ethernet II, Src: ArubaNet_02:38:10 (00:1a:1e:02:38:10), Dst: Tp-LinkT_ec:75:a2 (00:25:86:ec:75:a2)
Internet Protocol Version 4, Src: 104.244.42.1, Dst: 172.31.197.245
Transmission Control Protocol, Src Port: 443, Dst Port: 54883, Seq: 1893, Ack: 620, Len: 48
Secure Sockets Layer

No.     Time           Source                Destination           Protocol Length Info
     87 10.293053      104.244.42.1          172.31.197.245        TLSv1.2  92     Application Data

Frame 87: 92 bytes on wire (736 bits), 92 bytes captured (736 bits) on interface 0
Ethernet II, Src: ArubaNet_02:38:10 (00:1a:1e:02:38:10), Dst: Tp-LinkT_ec:75:a2 (00:25:86:ec:75:a2)
Internet Protocol Version 4, Src: 104.244.42.1, Dst: 172.31.197.245
Transmission Control Protocol, Src Port: 443, Dst Port: 54883, Seq: 1941, Ack: 620, Len: 38
Secure Sockets Layer

No.     Time           Source                Destination           Protocol Length Info
     88 10.293094      172.31.197.245        104.244.42.1          TCP      54     54883 → 443 [ACK] Seq=620 Ack=1979 Win=265 Len=0

Frame 88: 54 bytes on wire (432 bits), 54 bytes captured (432 bits) on interface 0
Ethernet II, Src: Tp-LinkT_ec:75:a2 (00:25:86:ec:75:a2), Dst: ArubaNet_02:38:10 (00:1a:1e:02:38:10)
Internet Protocol Version 4, Src: 172.31.197.245, Dst: 104.244.42.1
Transmission Control Protocol, Src Port: 54883, Dst Port: 443, Seq: 620, Ack: 1979, Len: 0

No.     Time           Source                Destination           Protocol Length Info
     89 10.297532      172.31.197.245        104.244.42.1          TLSv1.2  147    Application Data

Frame 89: 147 bytes on wire (1176 bits), 147 bytes captured (1176 bits) on interface 0
Ethernet II, Src: Tp-LinkT_ec:75:a2 (00:25:86:ec:75:a2), Dst: ArubaNet_02:38:10 (00:1a:1e:02:38:10)
Internet Protocol Version 4, Src: 172.31.197.245, Dst: 104.244.42.1
Transmission Control Protocol, Src Port: 54883, Dst Port: 443, Seq: 620, Ack: 1979, Len: 93
Secure Sockets Layer

No.     Time           Source                Destination           Protocol Length Info
     90 10.297789      172.31.197.245        104.244.42.1          TCP      1440   [TCP segment of a reassembled PDU]

Frame 90: 1440 bytes on wire (11520 bits), 1440 bytes captured (11520 bits) on interface 0
Ethernet II, Src: Tp-LinkT_ec:75:a2 (00:25:86:ec:75:a2), Dst: ArubaNet_02:38:10 (00:1a:1e:02:38:10)
Internet Protocol Version 4, Src: 172.31.197.245, Dst: 104.244.42.1
Transmission Control Protocol, Src Port: 54883, Dst Port: 443, Seq: 713, Ack: 1979, Len: 1386

No.     Time           Source                Destination           Protocol Length Info
     91 10.297797      172.31.197.245        104.244.42.1          TCP      1440   [TCP segment of a reassembled PDU]

Frame 91: 1440 bytes on wire (11520 bits), 1440 bytes captured (11520 bits) on interface 0
Ethernet II, Src: Tp-LinkT_ec:75:a2 (00:25:86:ec:75:a2), Dst: ArubaNet_02:38:10 (00:1a:1e:02:38:10)
Internet Protocol Version 4, Src: 172.31.197.245, Dst: 104.244.42.1
Transmission Control Protocol, Src Port: 54883, Dst Port: 443, Seq: 2099, Ack: 1979, Len: 1386

No.     Time           Source                Destination           Protocol Length Info
     92 10.297803      172.31.197.245        104.244.42.1          TLSv1.2  172    Application Data

Frame 92: 172 bytes on wire (1376 bits), 172 bytes captured (1376 bits) on interface 0
Ethernet II, Src: Tp-LinkT_ec:75:a2 (00:25:86:ec:75:a2), Dst: ArubaNet_02:38:10 (00:1a:1e:02:38:10)
Internet Protocol Version 4, Src: 172.31.197.245, Dst: 104.244.42.1
Transmission Control Protocol, Src Port: 54883, Dst Port: 443, Seq: 3485, Ack: 1979, Len: 118
[3 Reassembled TCP Segments (2890 bytes): #90(1386), #91(1386), #92(118)]
Secure Sockets Layer

No.     Time           Source                Destination           Protocol Length Info
     93 10.298002      172.31.197.245        104.244.42.1          TCP      1440   [TCP segment of a reassembled PDU]

Frame 93: 1440 bytes on wire (11520 bits), 1440 bytes captured (11520 bits) on interface 0
Ethernet II, Src: Tp-LinkT_ec:75:a2 (00:25:86:ec:75:a2), Dst: ArubaNet_02:38:10 (00:1a:1e:02:38:10)
Internet Protocol Version 4, Src: 172.31.197.245, Dst: 104.244.42.1
Transmission Control Protocol, Src Port: 54883, Dst Port: 443, Seq: 3603, Ack: 1979, Len: 1386

No.     Time           Source                Destination           Protocol Length Info
     94 10.298010      172.31.197.245        104.244.42.1          TCP      1440   [TCP segment of a reassembled PDU]

Frame 94: 1440 bytes on wire (11520 bits), 1440 bytes captured (11520 bits) on interface 0
Ethernet II, Src: Tp-LinkT_ec:75:a2 (00:25:86:ec:75:a2), Dst: ArubaNet_02:38:10 (00:1a:1e:02:38:10)
Internet Protocol Version 4, Src: 172.31.197.245, Dst: 104.244.42.1
Transmission Control Protocol, Src Port: 54883, Dst Port: 443, Seq: 4989, Ack: 1979, Len: 1386

No.     Time           Source                Destination           Protocol Length Info
     95 10.298013      172.31.197.245        104.244.42.1          TLSv1.2  172    Application Data

Frame 95: 172 bytes on wire (1376 bits), 172 bytes captured (1376 bits) on interface 0
Ethernet II, Src: Tp-LinkT_ec:75:a2 (00:25:86:ec:75:a2), Dst: ArubaNet_02:38:10 (00:1a:1e:02:38:10)
Internet Protocol Version 4, Src: 172.31.197.245, Dst: 104.244.42.1
Transmission Control Protocol, Src Port: 54883, Dst Port: 443, Seq: 6375, Ack: 1979, Len: 118
[3 Reassembled TCP Segments (2890 bytes): #93(1386), #94(1386), #95(118)]
Secure Sockets Layer

No.     Time           Source                Destination           Protocol Length Info
     96 10.298144      172.31.197.245        104.244.42.1          TCP      1440   [TCP segment of a reassembled PDU]

Frame 96: 1440 bytes on wire (11520 bits), 1440 bytes captured (11520 bits) on interface 0
Ethernet II, Src: Tp-LinkT_ec:75:a2 (00:25:86:ec:75:a2), Dst: ArubaNet_02:38:10 (00:1a:1e:02:38:10)
Internet Protocol Version 4, Src: 172.31.197.245, Dst: 104.244.42.1
Transmission Control Protocol, Src Port: 54883, Dst Port: 443, Seq: 6493, Ack: 1979, Len: 1386

No.     Time           Source                Destination           Protocol Length Info
     97 10.298151      172.31.197.245        104.244.42.1          TCP      1440   [TCP segment of a reassembled PDU]

Frame 97: 1440 bytes on wire (11520 bits), 1440 bytes captured (11520 bits) on interface 0
Ethernet II, Src: Tp-LinkT_ec:75:a2 (00:25:86:ec:75:a2), Dst: ArubaNet_02:38:10 (00:1a:1e:02:38:10)
Internet Protocol Version 4, Src: 172.31.197.245, Dst: 104.244.42.1
Transmission Control Protocol, Src Port: 54883, Dst Port: 443, Seq: 7879, Ack: 1979, Len: 1386

No.     Time           Source                Destination           Protocol Length Info
     98 10.298154      172.31.197.245        104.244.42.1          TLSv1.2  172    Application Data

Frame 98: 172 bytes on wire (1376 bits), 172 bytes captured (1376 bits) on interface 0
Ethernet II, Src: Tp-LinkT_ec:75:a2 (00:25:86:ec:75:a2), Dst: ArubaNet_02:38:10 (00:1a:1e:02:38:10)
Internet Protocol Version 4, Src: 172.31.197.245, Dst: 104.244.42.1
Transmission Control Protocol, Src Port: 54883, Dst Port: 443, Seq: 9265, Ack: 1979, Len: 118
[3 Reassembled TCP Segments (2890 bytes): #96(1386), #97(1386), #98(118)]
Secure Sockets Layer

No.     Time           Source                Destination           Protocol Length Info
     99 10.298271      172.31.197.245        104.244.42.1          TCP      1440   [TCP segment of a reassembled PDU]

Frame 99: 1440 bytes on wire (11520 bits), 1440 bytes captured (11520 bits) on interface 0
Ethernet II, Src: Tp-LinkT_ec:75:a2 (00:25:86:ec:75:a2), Dst: ArubaNet_02:38:10 (00:1a:1e:02:38:10)
Internet Protocol Version 4, Src: 172.31.197.245, Dst: 104.244.42.1
Transmission Control Protocol, Src Port: 54883, Dst Port: 443, Seq: 9383, Ack: 1979, Len: 1386

No.     Time           Source                Destination           Protocol Length Info
    100 10.298277      172.31.197.245        104.244.42.1          TLSv1.2  471    Application Data

Frame 100: 471 bytes on wire (3768 bits), 471 bytes captured (3768 bits) on interface 0
Ethernet II, Src: Tp-LinkT_ec:75:a2 (00:25:86:ec:75:a2), Dst: ArubaNet_02:38:10 (00:1a:1e:02:38:10)
Internet Protocol Version 4, Src: 172.31.197.245, Dst: 104.244.42.1
Transmission Control Protocol, Src Port: 54883, Dst Port: 443, Seq: 10769, Ack: 1979, Len: 417
[2 Reassembled TCP Segments (1803 bytes): #99(1386), #100(417)]
Secure Sockets Layer

No.     Time           Source                Destination           Protocol Length Info
    101 10.333032      104.244.42.1          172.31.197.245        TLSv1.2  135    Application Data

Frame 101: 135 bytes on wire (1080 bits), 135 bytes captured (1080 bits) on interface 0
Ethernet II, Src: ArubaNet_02:38:10 (00:1a:1e:02:38:10), Dst: Tp-LinkT_ec:75:a2 (00:25:86:ec:75:a2)
Internet Protocol Version 4, Src: 104.244.42.1, Dst: 172.31.197.245
Transmission Control Protocol, Src Port: 443, Dst Port: 54883, Seq: 1979, Ack: 620, Len: 81
Secure Sockets Layer

No.     Time           Source                Destination           Protocol Length Info
    102 10.386916      104.244.42.1          172.31.197.245        TCP      1440   [TCP segment of a reassembled PDU]

Frame 102: 1440 bytes on wire (11520 bits), 1440 bytes captured (11520 bits) on interface 0
Ethernet II, Src: ArubaNet_02:38:10 (00:1a:1e:02:38:10), Dst: Tp-LinkT_ec:75:a2 (00:25:86:ec:75:a2)
Internet Protocol Version 4, Src: 104.244.42.1, Dst: 172.31.197.245
Transmission Control Protocol, Src Port: 443, Dst Port: 54883, Seq: 2060, Ack: 620, Len: 1386

No.     Time           Source                Destination           Protocol Length Info
    103 10.387053      172.31.197.245        104.244.42.1          TCP      54     54883 → 443 [ACK] Seq=11186 Ack=3446 Win=259 Len=0

Frame 103: 54 bytes on wire (432 bits), 54 bytes captured (432 bits) on interface 0
Ethernet II, Src: Tp-LinkT_ec:75:a2 (00:25:86:ec:75:a2), Dst: ArubaNet_02:38:10 (00:1a:1e:02:38:10)
Internet Protocol Version 4, Src: 172.31.197.245, Dst: 104.244.42.1
Transmission Control Protocol, Src Port: 54883, Dst Port: 443, Seq: 11186, Ack: 3446, Len: 0

No.     Time           Source                Destination           Protocol Length Info
    104 10.387344      104.244.42.1          172.31.197.245        TLSv1.2  144    Application Data, Application Data, Application Data

Frame 104: 144 bytes on wire (1152 bits), 144 bytes captured (1152 bits) on interface 0
Ethernet II, Src: ArubaNet_02:38:10 (00:1a:1e:02:38:10), Dst: Tp-LinkT_ec:75:a2 (00:25:86:ec:75:a2)
Internet Protocol Version 4, Src: 104.244.42.1, Dst: 172.31.197.245
Transmission Control Protocol, Src Port: 443, Dst Port: 54883, Seq: 3446, Ack: 620, Len: 90
[2 Reassembled TCP Segments (1390 bytes): #102(1386), #104(4)]
Secure Sockets Layer
Secure Sockets Layer

No.     Time           Source                Destination           Protocol Length Info
    105 10.414260      172.217.29.46         172.31.197.245        TCP      60     443 → 54921 [ACK] Seq=2725 Ack=6266 Win=59904 Len=0

Frame 105: 60 bytes on wire (480 bits), 60 bytes captured (480 bits) on interface 0
Ethernet II, Src: ArubaNet_02:38:10 (00:1a:1e:02:38:10), Dst: Tp-LinkT_ec:75:a2 (00:25:86:ec:75:a2)
Internet Protocol Version 4, Src: 172.217.29.46, Dst: 172.31.197.245
Transmission Control Protocol, Src Port: 443, Dst Port: 54921, Seq: 2725, Ack: 6266, Len: 0

No.     Time           Source                Destination           Protocol Length Info
    106 10.414468      172.217.29.46         172.31.197.245        TLSv1.2  127    Application Data

Frame 106: 127 bytes on wire (1016 bits), 127 bytes captured (1016 bits) on interface 0
Ethernet II, Src: ArubaNet_02:38:10 (00:1a:1e:02:38:10), Dst: Tp-LinkT_ec:75:a2 (00:25:86:ec:75:a2)
Internet Protocol Version 4, Src: 172.217.29.46, Dst: 172.31.197.245
Transmission Control Protocol, Src Port: 443, Dst Port: 54921, Seq: 2725, Ack: 6266, Len: 73
Secure Sockets Layer

No.     Time           Source                Destination           Protocol Length Info
    107 10.416731      172.217.29.46         172.31.197.245        TLSv1.2  1440   Application Data

Frame 107: 1440 bytes on wire (11520 bits), 1440 bytes captured (11520 bits) on interface 0
Ethernet II, Src: ArubaNet_02:38:10 (00:1a:1e:02:38:10), Dst: Tp-LinkT_ec:75:a2 (00:25:86:ec:75:a2)
Internet Protocol Version 4, Src: 172.217.29.46, Dst: 172.31.197.245
Transmission Control Protocol, Src Port: 443, Dst Port: 54921, Seq: 2798, Ack: 6266, Len: 1386
Secure Sockets Layer

No.     Time           Source                Destination           Protocol Length Info
    108 10.416799      172.31.197.245        172.217.29.46         TCP      54     54921 → 443 [ACK] Seq=6266 Ack=4184 Win=16560 Len=0

Frame 108: 54 bytes on wire (432 bits), 54 bytes captured (432 bits) on interface 0
Ethernet II, Src: Tp-LinkT_ec:75:a2 (00:25:86:ec:75:a2), Dst: ArubaNet_02:38:10 (00:1a:1e:02:38:10)
Internet Protocol Version 4, Src: 172.31.197.245, Dst: 172.217.29.46
Transmission Control Protocol, Src Port: 54921, Dst Port: 443, Seq: 6266, Ack: 4184, Len: 0

No.     Time           Source                Destination           Protocol Length Info
    109 10.417933      172.217.29.46         172.31.197.245        TLSv1.2  1388   Application Data

Frame 109: 1388 bytes on wire (11104 bits), 1388 bytes captured (11104 bits) on interface 0
Ethernet II, Src: ArubaNet_02:38:10 (00:1a:1e:02:38:10), Dst: Tp-LinkT_ec:75:a2 (00:25:86:ec:75:a2)
Internet Protocol Version 4, Src: 172.217.29.46, Dst: 172.31.197.245
Transmission Control Protocol, Src Port: 443, Dst Port: 54921, Seq: 4184, Ack: 6266, Len: 1334
Secure Sockets Layer

No.     Time           Source                Destination           Protocol Length Info
    110 10.418947      172.217.29.46         172.31.197.245        TLSv1.2  92     Application Data

Frame 110: 92 bytes on wire (736 bits), 92 bytes captured (736 bits) on interface 0
Ethernet II, Src: ArubaNet_02:38:10 (00:1a:1e:02:38:10), Dst: Tp-LinkT_ec:75:a2 (00:25:86:ec:75:a2)
Internet Protocol Version 4, Src: 172.217.29.46, Dst: 172.31.197.245
Transmission Control Protocol, Src Port: 443, Dst Port: 54921, Seq: 5518, Ack: 6266, Len: 38
Secure Sockets Layer

No.     Time           Source                Destination           Protocol Length Info
    111 10.419028      172.31.197.245        172.217.29.46         TCP      54     54921 → 443 [ACK] Seq=6266 Ack=5556 Win=15188 Len=0

Frame 111: 54 bytes on wire (432 bits), 54 bytes captured (432 bits) on interface 0
Ethernet II, Src: Tp-LinkT_ec:75:a2 (00:25:86:ec:75:a2), Dst: ArubaNet_02:38:10 (00:1a:1e:02:38:10)
Internet Protocol Version 4, Src: 172.31.197.245, Dst: 172.217.29.46
Transmission Control Protocol, Src Port: 54921, Dst Port: 443, Seq: 6266, Ack: 5556, Len: 0

No.     Time           Source                Destination           Protocol Length Info
    112 10.419158      172.31.197.245        172.217.29.46         TLSv1.2  92     Application Data

Frame 112: 92 bytes on wire (736 bits), 92 bytes captured (736 bits) on interface 0
Ethernet II, Src: Tp-LinkT_ec:75:a2 (00:25:86:ec:75:a2), Dst: ArubaNet_02:38:10 (00:1a:1e:02:38:10)
Internet Protocol Version 4, Src: 172.31.197.245, Dst: 172.217.29.46
Transmission Control Protocol, Src Port: 54921, Dst Port: 443, Seq: 6266, Ack: 5556, Len: 38
Secure Sockets Layer

No.     Time           Source                Destination           Protocol Length Info
    113 10.419432      104.244.42.1          172.31.197.245        TCP      60     443 → 54883 [ACK] Seq=3536 Ack=713 Win=693 Len=0

Frame 113: 60 bytes on wire (480 bits), 60 bytes captured (480 bits) on interface 0
Ethernet II, Src: ArubaNet_02:38:10 (00:1a:1e:02:38:10), Dst: Tp-LinkT_ec:75:a2 (00:25:86:ec:75:a2)
Internet Protocol Version 4, Src: 104.244.42.1, Dst: 172.31.197.245
Transmission Control Protocol, Src Port: 443, Dst Port: 54883, Seq: 3536, Ack: 713, Len: 0

No.     Time           Source                Destination           Protocol Length Info
    114 10.420427      172.31.197.245        172.217.29.46         TLSv1.2  159    Application Data

Frame 114: 159 bytes on wire (1272 bits), 159 bytes captured (1272 bits) on interface 0
Ethernet II, Src: Tp-LinkT_ec:75:a2 (00:25:86:ec:75:a2), Dst: ArubaNet_02:38:10 (00:1a:1e:02:38:10)
Internet Protocol Version 4, Src: 172.31.197.245, Dst: 172.217.29.46
Transmission Control Protocol, Src Port: 54921, Dst Port: 443, Seq: 6304, Ack: 5556, Len: 105
Secure Sockets Layer

No.     Time           Source                Destination           Protocol Length Info
    115 10.420436      104.244.42.1          172.31.197.245        TCP      60     443 → 54883 [ACK] Seq=3536 Ack=2099 Win=704 Len=0

Frame 115: 60 bytes on wire (480 bits), 60 bytes captured (480 bits) on interface 0
Ethernet II, Src: ArubaNet_02:38:10 (00:1a:1e:02:38:10), Dst: Tp-LinkT_ec:75:a2 (00:25:86:ec:75:a2)
Internet Protocol Version 4, Src: 104.244.42.1, Dst: 172.31.197.245
Transmission Control Protocol, Src Port: 443, Dst Port: 54883, Seq: 3536, Ack: 2099, Len: 0

No.     Time           Source                Destination           Protocol Length Info
    116 10.421690      104.244.42.1          172.31.197.245        TCP      60     443 → 54883 [ACK] Seq=3536 Ack=3485 Win=715 Len=0

Frame 116: 60 bytes on wire (480 bits), 60 bytes captured (480 bits) on interface 0
Ethernet II, Src: ArubaNet_02:38:10 (00:1a:1e:02:38:10), Dst: Tp-LinkT_ec:75:a2 (00:25:86:ec:75:a2)
Internet Protocol Version 4, Src: 104.244.42.1, Dst: 172.31.197.245
Transmission Control Protocol, Src Port: 443, Dst Port: 54883, Seq: 3536, Ack: 3485, Len: 0

No.     Time           Source                Destination           Protocol Length Info
    117 10.424232      104.244.42.1          172.31.197.245        TCP      60     443 → 54883 [ACK] Seq=3536 Ack=3603 Win=715 Len=0

Frame 117: 60 bytes on wire (480 bits), 60 bytes captured (480 bits) on interface 0
Ethernet II, Src: ArubaNet_02:38:10 (00:1a:1e:02:38:10), Dst: Tp-LinkT_ec:75:a2 (00:25:86:ec:75:a2)
Internet Protocol Version 4, Src: 104.244.42.1, Dst: 172.31.197.245
Transmission Control Protocol, Src Port: 443, Dst Port: 54883, Seq: 3536, Ack: 3603, Len: 0

No.     Time           Source                Destination           Protocol Length Info
    118 10.424936      104.244.42.1          172.31.197.245        TCP      60     443 → 54883 [ACK] Seq=3536 Ack=4989 Win=726 Len=0

Frame 118: 60 bytes on wire (480 bits), 60 bytes captured (480 bits) on interface 0
Ethernet II, Src: ArubaNet_02:38:10 (00:1a:1e:02:38:10), Dst: Tp-LinkT_ec:75:a2 (00:25:86:ec:75:a2)
Internet Protocol Version 4, Src: 104.244.42.1, Dst: 172.31.197.245
Transmission Control Protocol, Src Port: 443, Dst Port: 54883, Seq: 3536, Ack: 4989, Len: 0

No.     Time           Source                Destination           Protocol Length Info
    119 10.425314      104.244.42.1          172.31.197.245        TCP      60     443 → 54883 [ACK] Seq=3536 Ack=6375 Win=737 Len=0

Frame 119: 60 bytes on wire (480 bits), 60 bytes captured (480 bits) on interface 0
Ethernet II, Src: ArubaNet_02:38:10 (00:1a:1e:02:38:10), Dst: Tp-LinkT_ec:75:a2 (00:25:86:ec:75:a2)
Internet Protocol Version 4, Src: 104.244.42.1, Dst: 172.31.197.245
Transmission Control Protocol, Src Port: 443, Dst Port: 54883, Seq: 3536, Ack: 6375, Len: 0

No.     Time           Source                Destination           Protocol Length Info
    120 10.425819      104.244.42.1          172.31.197.245        TCP      60     443 → 54883 [ACK] Seq=3536 Ack=6493 Win=737 Len=0

Frame 120: 60 bytes on wire (480 bits), 60 bytes captured (480 bits) on interface 0
Ethernet II, Src: ArubaNet_02:38:10 (00:1a:1e:02:38:10), Dst: Tp-LinkT_ec:75:a2 (00:25:86:ec:75:a2)
Internet Protocol Version 4, Src: 104.244.42.1, Dst: 172.31.197.245
Transmission Control Protocol, Src Port: 443, Dst Port: 54883, Seq: 3536, Ack: 6493, Len: 0

No.     Time           Source                Destination           Protocol Length Info
    121 10.426479      104.244.42.1          172.31.197.245        TCP      60     443 → 54883 [ACK] Seq=3536 Ack=7879 Win=747 Len=0

Frame 121: 60 bytes on wire (480 bits), 60 bytes captured (480 bits) on interface 0
Ethernet II, Src: ArubaNet_02:38:10 (00:1a:1e:02:38:10), Dst: Tp-LinkT_ec:75:a2 (00:25:86:ec:75:a2)
Internet Protocol Version 4, Src: 104.244.42.1, Dst: 172.31.197.245
Transmission Control Protocol, Src Port: 443, Dst Port: 54883, Seq: 3536, Ack: 7879, Len: 0

No.     Time           Source                Destination           Protocol Length Info
    122 10.427473      104.244.42.1          172.31.197.245        TCP      60     443 → 54883 [ACK] Seq=3536 Ack=9265 Win=758 Len=0

Frame 122: 60 bytes on wire (480 bits), 60 bytes captured (480 bits) on interface 0
Ethernet II, Src: ArubaNet_02:38:10 (00:1a:1e:02:38:10), Dst: Tp-LinkT_ec:75:a2 (00:25:86:ec:75:a2)
Internet Protocol Version 4, Src: 104.244.42.1, Dst: 172.31.197.245
Transmission Control Protocol, Src Port: 443, Dst Port: 54883, Seq: 3536, Ack: 9265, Len: 0

No.     Time           Source                Destination           Protocol Length Info
    123 10.450439      104.244.42.1          172.31.197.245        TCP      60     443 → 54883 [ACK] Seq=3536 Ack=10769 Win=769 Len=0

Frame 123: 60 bytes on wire (480 bits), 60 bytes captured (480 bits) on interface 0
Ethernet II, Src: ArubaNet_02:38:10 (00:1a:1e:02:38:10), Dst: Tp-LinkT_ec:75:a2 (00:25:86:ec:75:a2)
Internet Protocol Version 4, Src: 104.244.42.1, Dst: 172.31.197.245
Transmission Control Protocol, Src Port: 443, Dst Port: 54883, Seq: 3536, Ack: 10769, Len: 0

No.     Time           Source                Destination           Protocol Length Info
    124 10.450777      104.244.42.1          172.31.197.245        TCP      60     443 → 54883 [ACK] Seq=3536 Ack=11186 Win=780 Len=0

Frame 124: 60 bytes on wire (480 bits), 60 bytes captured (480 bits) on interface 0
Ethernet II, Src: ArubaNet_02:38:10 (00:1a:1e:02:38:10), Dst: Tp-LinkT_ec:75:a2 (00:25:86:ec:75:a2)
Internet Protocol Version 4, Src: 104.244.42.1, Dst: 172.31.197.245
Transmission Control Protocol, Src Port: 443, Dst Port: 54883, Seq: 3536, Ack: 11186, Len: 0

No.     Time           Source                Destination           Protocol Length Info
    125 10.583942      172.31.197.245        104.244.42.1          TCP      54     54883 → 443 [ACK] Seq=11186 Ack=3536 Win=259 Len=0

Frame 125: 54 bytes on wire (432 bits), 54 bytes captured (432 bits) on interface 0
Ethernet II, Src: Tp-LinkT_ec:75:a2 (00:25:86:ec:75:a2), Dst: ArubaNet_02:38:10 (00:1a:1e:02:38:10)
Internet Protocol Version 4, Src: 172.31.197.245, Dst: 104.244.42.1
Transmission Control Protocol, Src Port: 54883, Dst Port: 443, Seq: 11186, Ack: 3536, Len: 0

No.     Time           Source                Destination           Protocol Length Info
    126 10.590121      104.244.42.1          172.31.197.245        TLSv1.2  159    Application Data

Frame 126: 159 bytes on wire (1272 bits), 159 bytes captured (1272 bits) on interface 0
Ethernet II, Src: ArubaNet_02:38:10 (00:1a:1e:02:38:10), Dst: Tp-LinkT_ec:75:a2 (00:25:86:ec:75:a2)
Internet Protocol Version 4, Src: 104.244.42.1, Dst: 172.31.197.245
Transmission Control Protocol, Src Port: 443, Dst Port: 54883, Seq: 3536, Ack: 11186, Len: 105
Secure Sockets Layer

No.     Time           Source                Destination           Protocol Length Info
    127 10.590940      172.217.29.46         172.31.197.245        TCP      60     443 → 54921 [ACK] Seq=5556 Ack=6409 Win=59904 Len=0

Frame 127: 60 bytes on wire (480 bits), 60 bytes captured (480 bits) on interface 0
Ethernet II, Src: ArubaNet_02:38:10 (00:1a:1e:02:38:10), Dst: Tp-LinkT_ec:75:a2 (00:25:86:ec:75:a2)
Internet Protocol Version 4, Src: 172.217.29.46, Dst: 172.31.197.245
Transmission Control Protocol, Src Port: 443, Dst Port: 54921, Seq: 5556, Ack: 6409, Len: 0

No.     Time           Source                Destination           Protocol Length Info
    128 10.591194      172.217.29.46         172.31.197.245        TLSv1.2  127    Application Data

Frame 128: 127 bytes on wire (1016 bits), 127 bytes captured (1016 bits) on interface 0
Ethernet II, Src: ArubaNet_02:38:10 (00:1a:1e:02:38:10), Dst: Tp-LinkT_ec:75:a2 (00:25:86:ec:75:a2)
Internet Protocol Version 4, Src: 172.217.29.46, Dst: 172.31.197.245
Transmission Control Protocol, Src Port: 443, Dst Port: 54921, Seq: 5556, Ack: 6409, Len: 73
Secure Sockets Layer

No.     Time           Source                Destination           Protocol Length Info
    129 10.591484      172.217.29.46         172.31.197.245        TLSv1.2  153    Application Data

Frame 129: 153 bytes on wire (1224 bits), 153 bytes captured (1224 bits) on interface 0
Ethernet II, Src: ArubaNet_02:38:10 (00:1a:1e:02:38:10), Dst: Tp-LinkT_ec:75:a2 (00:25:86:ec:75:a2)
Internet Protocol Version 4, Src: 172.217.29.46, Dst: 172.31.197.245
Transmission Control Protocol, Src Port: 443, Dst Port: 54921, Seq: 5629, Ack: 6409, Len: 99
Secure Sockets Layer

No.     Time           Source                Destination           Protocol Length Info
    130 10.591551      172.31.197.245        172.217.29.46         TCP      54     54921 → 443 [ACK] Seq=6409 Ack=5728 Win=16560 Len=0

Frame 130: 54 bytes on wire (432 bits), 54 bytes captured (432 bits) on interface 0
Ethernet II, Src: Tp-LinkT_ec:75:a2 (00:25:86:ec:75:a2), Dst: ArubaNet_02:38:10 (00:1a:1e:02:38:10)
Internet Protocol Version 4, Src: 172.31.197.245, Dst: 172.217.29.46
Transmission Control Protocol, Src Port: 54921, Dst Port: 443, Seq: 6409, Ack: 5728, Len: 0

No.     Time           Source                Destination           Protocol Length Info
    131 10.591817      172.217.29.46         172.31.197.245        TLSv1.2  92     Application Data

Frame 131: 92 bytes on wire (736 bits), 92 bytes captured (736 bits) on interface 0
Ethernet II, Src: ArubaNet_02:38:10 (00:1a:1e:02:38:10), Dst: Tp-LinkT_ec:75:a2 (00:25:86:ec:75:a2)
Internet Protocol Version 4, Src: 172.217.29.46, Dst: 172.31.197.245
Transmission Control Protocol, Src Port: 443, Dst Port: 54921, Seq: 5728, Ack: 6409, Len: 38
Secure Sockets Layer

No.     Time           Source                Destination           Protocol Length Info
    132 10.593087      172.31.197.245        172.217.29.46         TLSv1.2  92     Application Data

Frame 132: 92 bytes on wire (736 bits), 92 bytes captured (736 bits) on interface 0
Ethernet II, Src: Tp-LinkT_ec:75:a2 (00:25:86:ec:75:a2), Dst: ArubaNet_02:38:10 (00:1a:1e:02:38:10)
Internet Protocol Version 4, Src: 172.31.197.245, Dst: 172.217.29.46
Transmission Control Protocol, Src Port: 54921, Dst Port: 443, Seq: 6409, Ack: 5766, Len: 38
Secure Sockets Layer

No.     Time           Source                Destination           Protocol Length Info
    133 10.789883      172.31.197.245        104.244.42.1          TCP      54     54883 → 443 [ACK] Seq=11186 Ack=3641 Win=258 Len=0

Frame 133: 54 bytes on wire (432 bits), 54 bytes captured (432 bits) on interface 0
Ethernet II, Src: Tp-LinkT_ec:75:a2 (00:25:86:ec:75:a2), Dst: ArubaNet_02:38:10 (00:1a:1e:02:38:10)
Internet Protocol Version 4, Src: 172.31.197.245, Dst: 104.244.42.1
Transmission Control Protocol, Src Port: 54883, Dst Port: 443, Seq: 11186, Ack: 3641, Len: 0

No.     Time           Source                Destination           Protocol Length Info
    134 10.794179      172.217.29.46         172.31.197.245        TCP      60     443 → 54921 [ACK] Seq=5766 Ack=6447 Win=59904 Len=0

Frame 134: 60 bytes on wire (480 bits), 60 bytes captured (480 bits) on interface 0
Ethernet II, Src: ArubaNet_02:38:10 (00:1a:1e:02:38:10), Dst: Tp-LinkT_ec:75:a2 (00:25:86:ec:75:a2)
Internet Protocol Version 4, Src: 172.217.29.46, Dst: 172.31.197.245
Transmission Control Protocol, Src Port: 443, Dst Port: 54921, Seq: 5766, Ack: 6447, Len: 0

No.     Time           Source                Destination           Protocol Length Info
    135 10.943887      172.31.197.245        192.16.59.1           SSL      55     Continuation Data

Frame 135: 55 bytes on wire (440 bits), 55 bytes captured (440 bits) on interface 0
Ethernet II, Src: Tp-LinkT_ec:75:a2 (00:25:86:ec:75:a2), Dst: ArubaNet_02:38:10 (00:1a:1e:02:38:10)
Internet Protocol Version 4, Src: 172.31.197.245, Dst: 192.16.59.1
Transmission Control Protocol, Src Port: 54919, Dst Port: 443, Seq: 1, Ack: 1, Len: 1
Secure Sockets Layer

No.     Time           Source                Destination           Protocol Length Info
    136 10.967450      172.31.197.245        224.0.0.22            IGMPv3   54     Membership Report / Join group 224.0.0.253 for any sources

Frame 136: 54 bytes on wire (432 bits), 54 bytes captured (432 bits) on interface 0
Ethernet II, Src: Tp-LinkT_ec:75:a2 (00:25:86:ec:75:a2), Dst: IPv4mcast_16 (01:00:5e:00:00:16)
Internet Protocol Version 4, Src: 172.31.197.245, Dst: 224.0.0.22
Internet Group Management Protocol

No.     Time           Source                Destination           Protocol Length Info
    137 10.967646      fe80::ffff:ffff:fffe  ff02::2               ICMPv6   103    Router Solicitation

Frame 137: 103 bytes on wire (824 bits), 103 bytes captured (824 bits) on interface 0
Ethernet II, Src: Tp-LinkT_ec:75:a2 (00:25:86:ec:75:a2), Dst: ArubaNet_02:38:10 (00:1a:1e:02:38:10)
Internet Protocol Version 4, Src: 172.31.197.245, Dst: 157.56.120.207
User Datagram Protocol, Src Port: 64309, Dst Port: 3544
Teredo IPv6 over UDP tunneling
Internet Protocol Version 6, Src: fe80::ffff:ffff:fffe, Dst: ff02::2
Internet Control Message Protocol v6

No.     Time           Source                Destination           Protocol Length Info
    138 11.032364      192.16.59.1           172.31.197.245        TCP      66     443 → 54919 [ACK] Seq=1 Ack=2 Win=292 Len=0 SLE=1 SRE=2

Frame 138: 66 bytes on wire (528 bits), 66 bytes captured (528 bits) on interface 0
Ethernet II, Src: ArubaNet_02:38:10 (00:1a:1e:02:38:10), Dst: Tp-LinkT_ec:75:a2 (00:25:86:ec:75:a2)
Internet Protocol Version 4, Src: 192.16.59.1, Dst: 172.31.197.245
Transmission Control Protocol, Src Port: 443, Dst Port: 54919, Seq: 1, Ack: 2, Len: 0

No.     Time           Source                Destination           Protocol Length Info
    139 11.234860      172.31.197.245        224.0.0.22            IGMPv3   54     Membership Report / Join group 224.0.0.253 for any sources

Frame 139: 54 bytes on wire (432 bits), 54 bytes captured (432 bits) on interface 0
Ethernet II, Src: Tp-LinkT_ec:75:a2 (00:25:86:ec:75:a2), Dst: IPv4mcast_16 (01:00:5e:00:00:16)
Internet Protocol Version 4, Src: 172.31.197.245, Dst: 224.0.0.22
Internet Group Management Protocol

No.     Time           Source                Destination           Protocol Length Info
    140 11.967161      fe80::ffff:ffff:fffe  ff02::2               ICMPv6   103    Router Solicitation

Frame 140: 103 bytes on wire (824 bits), 103 bytes captured (824 bits) on interface 0
Ethernet II, Src: Tp-LinkT_ec:75:a2 (00:25:86:ec:75:a2), Dst: ArubaNet_02:38:10 (00:1a:1e:02:38:10)
Internet Protocol Version 4, Src: 172.31.197.245, Dst: 157.56.120.207
User Datagram Protocol, Src Port: 64309, Dst Port: 3544
Teredo IPv6 over UDP tunneling
Internet Protocol Version 6, Src: fe80::ffff:ffff:fffe, Dst: ff02::2
Internet Control Message Protocol v6

No.     Time           Source                Destination           Protocol Length Info
    141 11.975247      172.31.197.245        172.31.197.255        NBNS     92     Name query NB CAIO-PC<1c>

Frame 141: 92 bytes on wire (736 bits), 92 bytes captured (736 bits) on interface 0
Ethernet II, Src: Tp-LinkT_ec:75:a2 (00:25:86:ec:75:a2), Dst: Broadcast (ff:ff:ff:ff:ff:ff)
Internet Protocol Version 4, Src: 172.31.197.245, Dst: 172.31.197.255
User Datagram Protocol, Src Port: 137, Dst Port: 137
NetBIOS Name Service

No.     Time           Source                Destination           Protocol Length Info
    142 12.725067      172.31.197.245        172.31.197.255        NBNS     92     Name query NB CAIO-PC<1c>

Frame 142: 92 bytes on wire (736 bits), 92 bytes captured (736 bits) on interface 0
Ethernet II, Src: Tp-LinkT_ec:75:a2 (00:25:86:ec:75:a2), Dst: Broadcast (ff:ff:ff:ff:ff:ff)
Internet Protocol Version 4, Src: 172.31.197.245, Dst: 172.31.197.255
User Datagram Protocol, Src Port: 137, Dst Port: 137
NetBIOS Name Service

No.     Time           Source                Destination           Protocol Length Info
    143 13.475118      172.31.197.245        172.31.197.255        NBNS     92     Name query NB CAIO-PC<1c>

Frame 143: 92 bytes on wire (736 bits), 92 bytes captured (736 bits) on interface 0
Ethernet II, Src: Tp-LinkT_ec:75:a2 (00:25:86:ec:75:a2), Dst: Broadcast (ff:ff:ff:ff:ff:ff)
Internet Protocol Version 4, Src: 172.31.197.245, Dst: 172.31.197.255
User Datagram Protocol, Src Port: 137, Dst Port: 137
NetBIOS Name Service

No.     Time           Source                Destination           Protocol Length Info
    144 13.967166      fe80::ffff:ffff:fffe  ff02::2               ICMPv6   103    Router Solicitation

Frame 144: 103 bytes on wire (824 bits), 103 bytes captured (824 bits) on interface 0
Ethernet II, Src: Tp-LinkT_ec:75:a2 (00:25:86:ec:75:a2), Dst: ArubaNet_02:38:10 (00:1a:1e:02:38:10)
Internet Protocol Version 4, Src: 172.31.197.245, Dst: 157.56.120.207
User Datagram Protocol, Src Port: 64309, Dst Port: 3544
Teredo IPv6 over UDP tunneling
Internet Protocol Version 6, Src: fe80::ffff:ffff:fffe, Dst: ff02::2
Internet Control Message Protocol v6

No.     Time           Source                Destination           Protocol Length Info
    145 14.265546      172.31.197.245        192.168.1.66          ICMP     74     Echo (ping) request  id=0x0001, seq=1/256, ttl=128 (no response found!)

Frame 145: 74 bytes on wire (592 bits), 74 bytes captured (592 bits) on interface 0
Ethernet II, Src: Tp-LinkT_ec:75:a2 (00:25:86:ec:75:a2), Dst: ArubaNet_02:38:10 (00:1a:1e:02:38:10)
Internet Protocol Version 4, Src: 172.31.197.245, Dst: 192.168.1.66
Internet Control Message Protocol

No.     Time           Source                Destination           Protocol Length Info
    146 15.654133      172.31.197.245        64.233.186.188        SSL      55     Continuation Data

Frame 146: 55 bytes on wire (440 bits), 55 bytes captured (440 bits) on interface 0
Ethernet II, Src: Tp-LinkT_ec:75:a2 (00:25:86:ec:75:a2), Dst: ArubaNet_02:38:10 (00:1a:1e:02:38:10)
Internet Protocol Version 4, Src: 172.31.197.245, Dst: 64.233.186.188
Transmission Control Protocol, Src Port: 54901, Dst Port: 443, Seq: 1, Ack: 1, Len: 1
Secure Sockets Layer

No.     Time           Source                Destination           Protocol Length Info
    147 15.854830      64.233.186.188        172.31.197.245        TCP      66     443 → 54901 [ACK] Seq=1 Ack=2 Win=360 Len=0 SLE=1 SRE=2

Frame 147: 66 bytes on wire (528 bits), 66 bytes captured (528 bits) on interface 0
Ethernet II, Src: ArubaNet_02:38:10 (00:1a:1e:02:38:10), Dst: Tp-LinkT_ec:75:a2 (00:25:86:ec:75:a2)
Internet Protocol Version 4, Src: 64.233.186.188, Dst: 172.31.197.245
Transmission Control Protocol, Src Port: 443, Dst Port: 54901, Seq: 1, Ack: 2, Len: 0

No.     Time           Source                Destination           Protocol Length Info
    148 17.967348      fe80::ffff:ffff:fffe  ff02::2               ICMPv6   103    Router Solicitation

Frame 148: 103 bytes on wire (824 bits), 103 bytes captured (824 bits) on interface 0
Ethernet II, Src: Tp-LinkT_ec:75:a2 (00:25:86:ec:75:a2), Dst: ArubaNet_02:38:10 (00:1a:1e:02:38:10)
Internet Protocol Version 4, Src: 172.31.197.245, Dst: 157.56.120.207
User Datagram Protocol, Src Port: 64309, Dst Port: 3544
Teredo IPv6 over UDP tunneling
Internet Protocol Version 6, Src: fe80::ffff:ffff:fffe, Dst: ff02::2
Internet Control Message Protocol v6

No.     Time           Source                Destination           Protocol Length Info
    149 18.654225      172.31.197.245        172.217.29.46         SSL      55     Continuation Data

Frame 149: 55 bytes on wire (440 bits), 55 bytes captured (440 bits) on interface 0
Ethernet II, Src: Tp-LinkT_ec:75:a2 (00:25:86:ec:75:a2), Dst: ArubaNet_02:38:10 (00:1a:1e:02:38:10)
Internet Protocol Version 4, Src: 172.31.197.245, Dst: 172.217.29.46
Transmission Control Protocol, Src Port: 54890, Dst Port: 443, Seq: 1, Ack: 1, Len: 1
Secure Sockets Layer

No.     Time           Source                Destination           Protocol Length Info
    150 18.796569      172.217.29.46         172.31.197.245        TCP      66     443 → 54890 [ACK] Seq=1 Ack=2 Win=610 Len=0 SLE=1 SRE=2

Frame 150: 66 bytes on wire (528 bits), 66 bytes captured (528 bits) on interface 0
Ethernet II, Src: ArubaNet_02:38:10 (00:1a:1e:02:38:10), Dst: Tp-LinkT_ec:75:a2 (00:25:86:ec:75:a2)
Internet Protocol Version 4, Src: 172.217.29.46, Dst: 172.31.197.245
Transmission Control Protocol, Src Port: 443, Dst Port: 54890, Seq: 1, Ack: 2, Len: 0

No.     Time           Source                Destination           Protocol Length Info
    151 19.235301      172.31.197.245        192.168.1.66          ICMP     74     Echo (ping) request  id=0x0001, seq=2/512, ttl=128 (no response found!)

Frame 151: 74 bytes on wire (592 bits), 74 bytes captured (592 bits) on interface 0
Ethernet II, Src: Tp-LinkT_ec:75:a2 (00:25:86:ec:75:a2), Dst: ArubaNet_02:38:10 (00:1a:1e:02:38:10)
Internet Protocol Version 4, Src: 172.31.197.245, Dst: 192.168.1.66
Internet Control Message Protocol

No.     Time           Source                Destination           Protocol Length Info
    152 19.999682      172.31.197.245        104.244.42.1          TLSv1.2  251    Application Data

Frame 152: 251 bytes on wire (2008 bits), 251 bytes captured (2008 bits) on interface 0
Ethernet II, Src: Tp-LinkT_ec:75:a2 (00:25:86:ec:75:a2), Dst: ArubaNet_02:38:10 (00:1a:1e:02:38:10)
Internet Protocol Version 4, Src: 172.31.197.245, Dst: 104.244.42.1
Transmission Control Protocol, Src Port: 54883, Dst Port: 443, Seq: 11186, Ack: 3641, Len: 197
Secure Sockets Layer

No.     Time           Source                Destination           Protocol Length Info
    153 20.123178      104.244.42.1          172.31.197.245        TCP      60     443 → 54883 [ACK] Seq=3641 Ack=11383 Win=791 Len=0

Frame 153: 60 bytes on wire (480 bits), 60 bytes captured (480 bits) on interface 0
Ethernet II, Src: ArubaNet_02:38:10 (00:1a:1e:02:38:10), Dst: Tp-LinkT_ec:75:a2 (00:25:86:ec:75:a2)
Internet Protocol Version 4, Src: 104.244.42.1, Dst: 172.31.197.245
Transmission Control Protocol, Src Port: 443, Dst Port: 54883, Seq: 3641, Ack: 11383, Len: 0

No.     Time           Source                Destination           Protocol Length Info
    154 20.261802      172.31.197.245        172.31.197.255        DB-LSP-DISC 175    Dropbox LAN sync Discovery Protocol

Frame 154: 175 bytes on wire (1400 bits), 175 bytes captured (1400 bits) on interface 0
Ethernet II, Src: Tp-LinkT_ec:75:a2 (00:25:86:ec:75:a2), Dst: Broadcast (ff:ff:ff:ff:ff:ff)
Internet Protocol Version 4, Src: 172.31.197.245, Dst: 172.31.197.255
User Datagram Protocol, Src Port: 17500, Dst Port: 17500
Dropbox LAN sync Discovery Protocol

No.     Time           Source                Destination           Protocol Length Info
    155 20.293234      104.244.42.1          172.31.197.245        TLSv1.2  253    Application Data

Frame 155: 253 bytes on wire (2024 bits), 253 bytes captured (2024 bits) on interface 0
Ethernet II, Src: ArubaNet_02:38:10 (00:1a:1e:02:38:10), Dst: Tp-LinkT_ec:75:a2 (00:25:86:ec:75:a2)
Internet Protocol Version 4, Src: 104.244.42.1, Dst: 172.31.197.245
Transmission Control Protocol, Src Port: 443, Dst Port: 54883, Seq: 3641, Ack: 11383, Len: 199
Secure Sockets Layer

No.     Time           Source                Destination           Protocol Length Info
    156 20.293614      104.244.42.1          172.31.197.245        TLSv1.2  306    Application Data

Frame 156: 306 bytes on wire (2448 bits), 306 bytes captured (2448 bits) on interface 0
Ethernet II, Src: ArubaNet_02:38:10 (00:1a:1e:02:38:10), Dst: Tp-LinkT_ec:75:a2 (00:25:86:ec:75:a2)
Internet Protocol Version 4, Src: 104.244.42.1, Dst: 172.31.197.245
Transmission Control Protocol, Src Port: 443, Dst Port: 54883, Seq: 3840, Ack: 11383, Len: 252
Secure Sockets Layer

No.     Time           Source                Destination           Protocol Length Info
    157 20.293705      172.31.197.245        104.244.42.1          TCP      54     54883 → 443 [ACK] Seq=11383 Ack=4092 Win=257 Len=0

Frame 157: 54 bytes on wire (432 bits), 54 bytes captured (432 bits) on interface 0
Ethernet II, Src: Tp-LinkT_ec:75:a2 (00:25:86:ec:75:a2), Dst: ArubaNet_02:38:10 (00:1a:1e:02:38:10)
Internet Protocol Version 4, Src: 172.31.197.245, Dst: 104.244.42.1
Transmission Control Protocol, Src Port: 54883, Dst Port: 443, Seq: 11383, Ack: 4092, Len: 0

No.     Time           Source                Destination           Protocol Length Info
    158 20.294003      104.244.42.1          172.31.197.245        TLSv1.2  102    Application Data

Frame 158: 102 bytes on wire (816 bits), 102 bytes captured (816 bits) on interface 0
Ethernet II, Src: ArubaNet_02:38:10 (00:1a:1e:02:38:10), Dst: Tp-LinkT_ec:75:a2 (00:25:86:ec:75:a2)
Internet Protocol Version 4, Src: 104.244.42.1, Dst: 172.31.197.245
Transmission Control Protocol, Src Port: 443, Dst Port: 54883, Seq: 4092, Ack: 11383, Len: 48
Secure Sockets Layer

No.     Time           Source                Destination           Protocol Length Info
    159 20.294201      104.244.42.1          172.31.197.245        TLSv1.2  92     Application Data

Frame 159: 92 bytes on wire (736 bits), 92 bytes captured (736 bits) on interface 0
Ethernet II, Src: ArubaNet_02:38:10 (00:1a:1e:02:38:10), Dst: Tp-LinkT_ec:75:a2 (00:25:86:ec:75:a2)
Internet Protocol Version 4, Src: 104.244.42.1, Dst: 172.31.197.245
Transmission Control Protocol, Src Port: 443, Dst Port: 54883, Seq: 4140, Ack: 11383, Len: 38
Secure Sockets Layer

No.     Time           Source                Destination           Protocol Length Info
    160 20.294239      172.31.197.245        104.244.42.1          TCP      54     54883 → 443 [ACK] Seq=11383 Ack=4178 Win=256 Len=0

Frame 160: 54 bytes on wire (432 bits), 54 bytes captured (432 bits) on interface 0
Ethernet II, Src: Tp-LinkT_ec:75:a2 (00:25:86:ec:75:a2), Dst: ArubaNet_02:38:10 (00:1a:1e:02:38:10)
Internet Protocol Version 4, Src: 172.31.197.245, Dst: 104.244.42.1
Transmission Control Protocol, Src Port: 54883, Dst Port: 443, Seq: 11383, Ack: 4178, Len: 0

No.     Time           Source                Destination           Protocol Length Info
    161 25.889630      162.125.18.133        172.31.197.245        TLSv1.2  311    Application Data

Frame 161: 311 bytes on wire (2488 bits), 311 bytes captured (2488 bits) on interface 0
Ethernet II, Src: ArubaNet_02:38:10 (00:1a:1e:02:38:10), Dst: Tp-LinkT_ec:75:a2 (00:25:86:ec:75:a2)
Internet Protocol Version 4, Src: 162.125.18.133, Dst: 172.31.197.245
Transmission Control Protocol, Src Port: 443, Dst Port: 54876, Seq: 1, Ack: 1, Len: 257
Secure Sockets Layer
